,title,link,channel,views,length
1912,AI Features in Oracle Database 23ai - AI Vector Search ,https://youtu.be/UVwN1aPUmME,Fahd Mirza,6500,1:52:35
1913,How to Build Data Pipelines for ML Projects (w/ Python Code) ,https://youtu.be/ZJlfF1ESXVw,Shaw Talebi,3400,34:24
1914,Realtime Multimodal RAG Usecase with Google Gemini-Pro-Vision and Langchain | RAG Application #rag ,https://youtu.be/QpRTdZDR4tE,Sunny Savita,127 ,34:24
1915,PROMETHEUS 2: An Open Source Language Model Specialized in Evaluating Other Language Models ,https://youtu.be/5Vc71tEiVPw,Arxiv Papers,62 ,11:30
1916,NeMo-Aligner: Scalable Toolkit for Efficient Model Alignment ,https://youtu.be/RCxa-6b9xXI,Arxiv Papers,110 ,11:30
1917,WILDCHAT: 1M ChatGPT Interaction Logs in the Wild ,https://youtu.be/5-1lKFvV1i0,Arxiv Papers,306 ,1:19:44
1918,What is AI Quality? // Mohamed Elgendy // MLOps Podcast #229 ,https://youtu.be/38V-feBAOFY,MLOps.community,7000,1:19:44
1919,Praison AI Custom Tools: Integrate ANY Application with AI Agents ,https://youtu.be/H90z30dO6hM,Mervin Praison,1600,11:05
1920,How to Use Flash Attention in LM Studio with LLMs ,https://youtu.be/d14WsGI_5TQ,Fahd Mirza,95000,11:05
1921,The PERFECT AI Prompt For Everything ,https://youtu.be/rSApe5xrHWk,Matt Wolfe,1000,49:28
1922,Convert PDFs into Videos Using AI - Brainy Docs ,https://youtu.be/AVr1uHhnpBg,Fahd Mirza,14000,49:28
1923,Adding RAG to LangGraph Agents ,https://youtu.be/5fp6e5nhJRk,Sam Witteveen,26000,26:20
1924,9-End To End Powerful Document Q&amp;A Chatbot using Llama3-Langchain and Groq API ,https://youtu.be/bEsXP-zAFEQ,Krish Naik,6400,26:20
1925,How to Use LangSmith to Achieve a 30% Accuracy Improvement with No Prompt Engineering ,https://youtu.be/erc6bkojqlA,LangChain,108000,12:59
1926,AI Leader Reveals The Future of AI AGENTS (LangChain CEO) ,https://youtu.be/bqnszWcl_v8,Matthew Berman,1000,12:59
1927,IDEFICS 2 API Endpoint- vLLM vs TGI- and General Fine-tuning tips ,https://youtu.be/tRtllBv5-VM,Trelis Research,155 ,26:11
1928,AI's Struggle with Abstraction in Analogies // Shane Morris // MLOps podcast #223 clip ,https://youtu.be/USpbuZ22kOI,MLOps.community,186 ,26:11
1929,Self-Play Preference Optimization for Language Model Alignment ,https://youtu.be/KLfYPwVP0qs,Arxiv Papers,12000,48:15
1930,Extending Llama-3 to 1M+ Tokens  -  Does it Impact the Performance? ,https://youtu.be/ibzlEQmgPPY,Prompt Engineering,2900,48:15
1931,Very Few Parameter Fine tuning with ReFT and LoRA ,https://youtu.be/Zj5RCweUHIk,Trelis Research,213 ,6:39
1932,Data Labeling Best Practices // Charles Brecque // AI in Production Conference Lightning Talk ,https://youtu.be/cDm5vPXVln8,MLOps.community,466 ,6:39
1933,LLMOps and GenAI at Enterprise Scale - Challenges and Opportunities // Andy McMahon // AI in Prod ,https://youtu.be/nblP8CgScog,MLOps.community,305 ,15:23
1934,Streamlining Model Deployment // Daniel Lenton // AI in Production Talk ,https://youtu.be/LP3Q9mjQ3EE,MLOps.community,966 ,15:23
1935,AI Agents with GPT-4 Turbo and CrewAI | Cryptocurrency Market Report with News ,https://youtu.be/eoOkMdrCkEY,Venelin Valkov,109 ,4:55
1937,ORPO: Monolithic Preference Optimization without Reference Model (Paper Explained) ,https://youtu.be/mnRPmB547G0,Yannic Kilcher,20000,30:20
1938,Important Playlist To Cover For Learning Generative AI On AWS And Azure Cloud ,https://youtu.be/r09tJfON6kE,Krish Naik,4100,30:20
1939,Regression Testing | LangSmith Evaluations - Part 15 ,https://youtu.be/YJ_jDZPj4V4,LangChain,309 ,6:09
1940,AWS Summit Sydney 2024: Building smart applications using large language models ,https://youtu.be/DsrOH2h9ajU,AWS Events,386 ,6:09
1941,AWS Summit Sydney 2024: Mixed RAG: Routing user prompts across multiple content domains ,https://youtu.be/S6PdFPoteBU,AWS Events,16000,4:47
1942,How To Fine-tune LLaVA Model (From Your Laptop!) ,https://youtu.be/anIBtQNn1G0,Brev,288 ,4:47
1943,Better &amp; Faster Large Language Models via Multi-token Prediction ,https://youtu.be/TcRRfcbsApw,Arxiv Papers,1600,47:04
1944,NEW LLM Test: Reasoning &amp; gpt2-chatbot ,https://youtu.be/ZtltjSjFPDg,Discover AI,330 ,47:04
1945,Vector and Keyword Search for Enhanced LLM Performance 🚀 | LLMOps ,https://youtu.be/r6AeD-CH1Uw,LLMOps Space,162 ,11:26
1946,Harmonic LLMs are Trustworthy ,https://youtu.be/N6Piou4oYx8,Arxiv Papers,453 ,11:26
1947,AI-Powered Local Personal Email Assistant - Panza ,https://youtu.be/SFXlvPo-CEs,Fahd Mirza,1700,8:16
1948,Advance RAG with Azure &amp; LlamaIndex ,https://youtu.be/zkQAEsgEJF8,MG,1300,8:16
1949,Hanna Hajishirzi (AI2) - OLMo: Findings of Training an Open LM ,https://youtu.be/SrwxLx-r0VE,Sasha Rush 🤗,2200,25:49
1950,Lessons learned from building cool products (winners of MLOps Discord demos) ,https://youtu.be/WAvO8FTDJ8M,MLOps Learners,14000,25:49
1951,🔴 This Agentic AI Workflow Will Take Over 🤯 Algorithm + Papers Explained ,https://youtu.be/kwh4WSO96xw,Analytics Camp,9800,35:15
1952,Can LLMs Reason &amp; Plan? (Talk @Google_DeepMind LLM Reasoning Seminar) ,https://youtu.be/OLj5MFNHP0Q,Subbarao Kambhampati,134 ,35:15
1953,Kangaroo: Lossless Self-Speculative Decoding via Double Early Exiting ,https://youtu.be/Har-Pzwx_8I,Arxiv Papers,135 ,18:51
1954,DPO Meets PPO: Reinforced Token Optimization for RLHF ,https://youtu.be/l30wTMfc1vs,Arxiv Papers,139 ,18:51
1955,Replacing Judges with Juries: Evaluating LLM Generations with a Panel of Diverse Models ,https://youtu.be/Y8LBYPAyk34,Arxiv Papers,6500,11:37
1956,Fine-Tune Llama 3 with LlaMA Factory in Free Colab ,https://youtu.be/ZZ7prpxjKhE,Fahd Mirza,427 ,11:37
1957,Simplest Way to Implement RAG with Command R Plus with Custom Data ,https://youtu.be/1InwTxDjUVE,Fahd Mirza,4800,6:05
1958,Generative AI Journeys - Fireside Chat with Smartsheet | Amazon Web Services ,https://youtu.be/3dvmak7kvUY,Amazon Web Services,1200,6:05
1959,Make your Production Level RAG 45 times Faster 🔥🔥 ,https://youtu.be/m3ZvWIrDZQk,Neural Hacks with Vasanth,334 ,1:21:53
1960,Tool Use with LLM with Any Data Source - Command R Plus ,https://youtu.be/OIeT1ktPoDw,Fahd Mirza,4800,1:21:53
1961,RAG Evaluation (Document Relevance) | LangSmith Evaluations - Part 14 ,https://youtu.be/B_E4g1Ku1OM,LangChain,2300,32:17
1962,ALMOST a step closer to HER!! (ChatGPT Memory Tutorial) ,https://youtu.be/EaPFQttpwNQ,1littlecoder,460 ,32:17
1963,Handling Multi-Tera,https://youtu.be/OnIQrDiTtRM,MLOps.community,38000,24:12
1964,TransformerFAM: Feedback attention is working memory ,https://youtu.be/1a94Pfn6sIg,Yannic Kilcher,54000,24:12
1965,STUNNING Step for Autonomous AI Agents PLUS OpenAI Defense Against JAILBROKEN Agents ,https://youtu.be/KazKtXi4jSM,Wes Roth,96 ,14:13
1966,Talking Nonsense: Probing Large Language Models' Understanding ofAdversarial Gibberish Inputs ,https://youtu.be/ePSrXlIipv8,Arxiv Papers,1000,14:13
1967,Hanrui Wang's PhD Defense- Toward Practical Quantum Computing Systems @ MIT ,https://youtu.be/9g1D_V6K6xs,MIT HAN Lab,111 ,12:48
1968,AdvPrompter: Fast Adaptive Adversarial Prompting for LLMs ,https://youtu.be/-Jdmq4DiOew,Arxiv Papers,10000,12:48
1969,How Good is LLAMA-3 for RAG- Routing- and Function Calling ,https://youtu.be/JSU2Rndh06c,Prompt Engineering,7900,11:37
1970,Building End To End Webloader RAG Application using Groq With DataStax and Cassio- Langchain ,https://youtu.be/kyW7gmnRUrM,Krish Naik,202 ,11:37
1971,LLaMa Family: Alpaca- Vicuna and LLaVA ,https://youtu.be/y8_jeWCVMaY,YanAITalk,3900,53:20
1972,❄️ Snowflake ❄️ Arctic 480Bx128 MoE:  MoE with 128 EXPERTS faster than LLama3!? ,https://youtu.be/At2zMjv7gJc,Ai Flux,260 ,53:20
1973,AdvPrompter - Fast Adaptive Adversarial Prompting for LLMs ,https://youtu.be/WyIWaopiUEo,Fahd Mirza,271 ,12:20
1974,Apply ML with your partners without sharing underlying data using AWS Clean Rooms ML | AWS OnAir S05 ,https://youtu.be/-PSq_ilkvwI,AWS Events,947 ,12:20
1975,LLMs: Rewriting Our Tomorrow (plus code) #ai ,https://youtu.be/tHZtq_pJSGo,Discover AI,17000,23:39
1976,Meta Llama 3 Fine tuning- RAG- and Prompt Engineering for Drug Discovery ,https://youtu.be/9ZhbA0FHZYc,ChemicalQDevice,6600,23:39
1977,LangChain Expression Language - The ONLY video you need to TRULY understand LCEL ,https://youtu.be/XUX9S9IqAX8,Coding Crash Courses,1600,30:58
1978,How Context Length of LLM is Increased ,https://youtu.be/IPdPTOSu6l0,Fahd Mirza,225 ,30:58
1979,AUTOCRAWLER : A Progressive Understanding Web Agent for Web Crawler Generation ,https://youtu.be/Zva_CUFvQJc,Arxiv Papers,139 ,1:01:04
1980,Retrieval Head Mechanistically Explains Long-Context Factuality ,https://youtu.be/oDfpG6uWlw4,Arxiv Papers,158 ,1:01:04
1981,Let’s Think Dot ,https://youtu.be/TIUkONyNAb4,Arxiv Papers,3100,1:01:18
1982,OpenELM- Phi-3- Quantized LLaMA-3 ,https://youtu.be/9hf_nFMiLCo,hu-po,1900,1:01:18
1983,Autonomous AI Agents: 14% MAX Performance ,https://youtu.be/L4tFxMWFVFc,Discover AI,87000,46:03
1984,MASSIVE Step Allowing AI Agents To Control Computers (MacOS- Windows- Linux) ,https://youtu.be/jodNnvBFYws,Matthew Berman,7900,46:03
1985,This AI Research Agent Generates Detailed Report Using PhiData ,https://youtu.be/Ev0uzdzesjU,Mervin Praison,209 ,45:18
1986,LangTail Introduction - LLMOps Platform ,https://youtu.be/ScJY1nBl0nM,Fahd Mirza,8200,45:18
1987,LM Studio 2.0: Image Analysis Revolution with AI Unleashed ,https://youtu.be/52kMBrAI_IM,Mervin Praison,8900,7:23
1988,Testing Framework Giskard for LLM and RAG Evaluation (Bias- Hallucination- and More) ,https://youtu.be/MbS6uMvuXyQ,AI Anytime,4300,7:23
1989,Advanced RAG Techniques with @LlamaIndex ,https://youtu.be/xTMngs6JWNM,Timescale,331000,10:06
1990,Python RAG Tutorial (with Local LLMs): AI For Your PDFs ,https://youtu.be/TWnhgSqRfm8,pixegami,5400,10:06
1991,Quantize LLMs with AWQ: Faster and Smaller Llama 3 ,https://youtu.be/RG4RNiHdqh0,AI Anytime,1200,35:21
1992,Leading Enterprise Data Teams // Sol Rashidi // MLOps Podcast #227 ,https://youtu.be/XICHJx2_Rm8,MLOps.community,191 ,35:21
1993,LayerSkip: Enabling Early Exit Inference and Self-Speculative Decoding ,https://youtu.be/p7nJ8-zf2vE,Arxiv Papers,3800,14:43
1994,Merge LLMs with No Code Mergekit GUI ,https://youtu.be/oRnYBp_5X-o,AI Anytime,280 ,14:43
1995,MambaByte: Token-free Selective State Space Model ,https://youtu.be/wXSglU2DNE4,Fahd Mirza,505 ,16:01
1997,Understanding When and Why Transformers Generalize Hierarchically ,https://youtu.be/ly53IU0x1Tk,Arxiv Papers,23000,50:58
1998,How to Use Hugging Face Inference API ,https://youtu.be/8Rbq6zHarZM,Fahd Mirza,518 ,50:58
1999,AI Horde - Crowdsourced AI For Free ,https://youtu.be/qFZbu2P1vZ8,Fahd Mirza,13000,15:29
2000,How Good is Phi-3-Mini for RAG- Routing- Agents ,https://youtu.be/3e9YAdOpihI,Prompt Engineering,2100,15:29
2001,Estimate Memory Consumption of LLMs for Inference and Fine-Tuning ,https://youtu.be/lA3Tju4VUho,AI Anytime,312 ,22:24
2002,Many-Shot In-Context Learning ,https://youtu.be/hGXhFa3gzBs,Fahd Mirza,1100,22:24
2003,Discover a Graph Data Model Using Generative AI and Diagram as Code | Amazon Web Services ,https://youtu.be/AF8kJE6my38,Amazon Web Services,252 ,39:50
2004,Build a data foundation for healthcare transformation with AWS and Redox | AWS Events ,https://youtu.be/1p9HoSBDo2k,AWS Events,39000,39:50
2005,Test Your Prompts with Every ChatBot (for Free) ,https://youtu.be/vc-UbhcPbYQ,Matt Wolfe,589 ,5:40
2006,Authorization process simplification using generative AI | AWS Events ,https://youtu.be/ucJJ7tM8xkM,AWS Events,561 ,5:40
2007,Best Prompt Engineering Tool for Anthropic Models - MetaPrompt ,https://youtu.be/u_17Y6UE6eo,Fahd Mirza,220 ,7:00
2008,Free LLM Benchmarks for Enterprise - Vals AI ,https://youtu.be/MgHxUm0xKCE,Fahd Mirza,436 ,7:00
2009,Startup AI School: Application Design and Development in the Gen AI Era #7 ,https://youtu.be/zxIfm1XY72w,Microsoft Reactor,65 ,14:02
2010,Integrating Multimodal AI in Your Apps with Floom ,https://youtu.be/kNCl3FaZXuE,Zilliz,195 ,14:02
2011,LangWatch Introduction for AI Quality Control ,https://youtu.be/Fr_7HtHjcf0,Fahd Mirza,94 ,10:40
2012,AutoGluon-Multimodal (AutoMM): Supercharging Multimodal AutoML with Foundation Models ,https://youtu.be/KgrSXWZIvAc,Arxiv Papers,129 ,10:40
2013,The Changing Face of AI Engineering // Amritha Arun Babu &amp; Abhik Choudhury // Podcast #221 clip ,https://youtu.be/6MY-IgqiTpg,MLOps.community,323 ,14:51
2014,Introduction to foundation model evaluation on Amazon SageMaker Clarify | Amazon Web Services ,https://youtu.be/3a0_hAiFKag,Amazon Web Services,117 ,14:51
2015,Bring your own datasets | Amazon Web Services ,https://youtu.be/hrPQS__ayu8,Amazon Web Services,95 ,1:15:44
2016,Human-driven foundation model evaluation | Amazon Web Services ,https://youtu.be/qYjS1vmWEMA,Amazon Web Services,107 ,1:15:44
2017,FM Eval Library Deep Dive  | Amazon Web Services ,https://youtu.be/XtiKyTWuqxM,Amazon Web Services,684 ,18:19
2018,Build a foundation model evaluation pipeline | Amazon Web Services ,https://youtu.be/_UFZB_mh6sI,Amazon Web Services,775 ,18:19
2019,JP Morgan Presents FlowMind for LLMs ,https://youtu.be/V83SeIr10FI,Fahd Mirza,124 ,13:15
2020,Fireside Interview with Josh Wilson - Creator of AlwaysReddy ,https://youtu.be/p42BzKKAO74,Fahd Mirza,566 ,13:15
2021,DSPy Assertions: Computational Constraints for Self-Refining LM Pipelines // Arnav Singhvi // Talk ,https://youtu.be/za4yminmZ-w,MLOps.community,110 ,58:16
2022,GenAI is Leading the Biggest Human Revolution ,https://youtu.be/8q_9AX9DRnk,Super Data Science: ML &amp; AI Podcast with Jon Krohn,6600,58:16
2023,MambaByte: Token-Free Language Modeling ,https://youtu.be/jw0w0SOcl0k,Sasha Rush 🤗,344 ,36:27
2024,Accelerate ML Production with Agents // Salma Mayorquin // AI in Production Conference ,https://youtu.be/dxYreblrQbc,MLOps.community,191 ,36:27
2025,Shipping LLMs: Buckle Up &amp; Enjoy the Ride // Rex Harris // AI in Production Conference ,https://youtu.be/YUMdqJxgx5k,MLOps.community,5100,6:51
2026,RAG Evaluation (Answer Hallucinations) | LangSmith Evaluations - Part 13 ,https://youtu.be/CS1O2ZCHsbY,LangChain,1400,6:51
2027,mergekit: Llama 3 Fine-Tuning and Merging ,https://youtu.be/LzxSY7197ns,AI Makerspace,1200,14:44
2028,DSU - Unlock the Power of Generative AI with Amazon Neptune | Amazon Web Services ,https://youtu.be/ScSTs8sWLzM,Amazon Web Services,56000,14:44
2029,Leave No Context Behind: Efficient Infinite Context Transformers with Infini-attention ,https://youtu.be/_j2DkY3T-w4,Yannic Kilcher,5100,52:51
2030,No more Fine-Tuning: Unsupervised ICL+ ,https://youtu.be/6WbvUMqnlYY,Discover AI,50000,52:51
2031,BIG win for Open Source AI | Snowflake Arctic 128 Experts MoE- &quot;Cookbook&quot; create world-class models ,https://youtu.be/AIR9QduDqD8,Wes Roth,191 ,46:16
2032,Mini-Gemini: MGM 7B to MGM 34B ,https://youtu.be/YEm4tuo2HPA,Fahd Mirza,1400,46:16
2033,Snowflake Arctic - Best LLM for Enterprise AI ,https://youtu.be/A2pDicTvOEM,Fahd Mirza,694 ,7:48
2034,We Won Anthropic's Developer Contest with Our STORM Implementation! (Step-,https://youtu.be/YZp3Hy6YFqY,TwoSetAI,237 ,7:48
2035,Promptflow | A tool for RAG development ,https://youtu.be/6NKnaeyQ-2w,Rajib Deb,19000,6:00
2036,Thomas Dietterich- &quot;What’s Wrong with Large Language Models- and What We Should Be Building Instead&quot; ,https://youtu.be/tYLf-YLzmZE,Johns Hopkins Institute for Assured Autonomy,1400,6:00
2037,777: Generative AI in Practice — with Bernard Marr (@bernardmarr) ,https://youtu.be/GoqhT-Bthiw,Super Data Science: ML &amp; AI Podcast with Jon Krohn,3200,12:57
2038,BEST LLMs for Coding- Long Context- Overall Perform ,https://youtu.be/KeY6qPAvyq0,Discover AI,89000,12:57
2039,LangGraph 101: it's better than LangChain ,https://youtu.be/gDQYUaVvH6k,James Briggs,7200,8:14
2040,RAG Evaluation (Answer Correctness) | LangSmith Evaluations - Part 12 ,https://youtu.be/2TJxpyO3ei4,LangChain,62000,8:14
2041,Stanford CS25: V4 I Overview of Transformers ,https://youtu.be/OMkyocVyEpQ,Stanford Online,178 ,1:24:37
2042,A Multimodal Automated Interpretability Agent ,https://youtu.be/qB0AAPCu4o0,Fahd Mirza,411 ,1:24:37
2043,Efficient finetuning of Llama 3 with FSDP QDoRA ,https://youtu.be/fda_wMpRP7U,Fahd Mirza,461 ,6:48
2044,The Rise of Modern Data Management // Chad Sanderson // MLOps Podcast #226 ,https://youtu.be/TkKAmwO8oOY,MLOps.community,128 ,6:48
2046,MultiModal RAG Application Using LanceDB and LlamaIndex for Video Processing ,https://youtu.be/Vw5WucSrObo,Sunny Savita,321 ,13:50
2047,SnapKV: LLM Knows What You are Looking for Before Generation ,https://youtu.be/V5Q2To6hEr4,Arxiv Papers,164 ,17:06
2048,Achieving 97% on GSM8K: Deeply Understanding the Problems Makes LLMs Perfect Reasoners ,https://youtu.be/V5Q2To6hEr4,Arxiv Papers,303 ,17:06
2049,OpenELM: An Efficient Language Model Family with Open-source Training and Inference Framework ,https://youtu.be/sY8mBFwp-dw,Arxiv Papers,29000,16:42
2050,Step ,https://youtu.be/85FVwWPg63Q,Underfitted,424 ,16:42
2051,Making Sense of LLMOps // Maria Vechtomova &amp; Başak Tuğçe Eskili // AI in Production Conference ,https://youtu.be/WoJ44CYrElc,MLOps.community,227 ,21:23
2052,Lessons from Building LLM-based Social Media Products // Faizaan Charania // AI in Production ,https://youtu.be/_4hFNzY1iMA,MLOps.community,2500,21:23
2053,How Large Language Models Are Created (Explained Simply) ,https://youtu.be/N5F_1JAtdzU,Neural Hacks with Vasanth,57000,26:06
2054,Llama3 + CrewAI + Groq = Email AI Agent ,https://youtu.be/CUzpdnG-2SA,Sam Witteveen,10000,26:06
2055,Multimodal RAG Systems: Comprehensive Introduction to Next-Gen AI Technology #multimodal #rag #ai ,https://youtu.be/LvghO60B79k,Sunny Savita,345 ,35:41
2056,PEAKDEFENCE automates security and compliance with GenAI on AWS (Business) - Cloud Adventures ,https://youtu.be/rACZ6nDMHx0,Amazon Web Services,3200,35:41
2057,Generative AI Journeys - Fireside Chat with Bridgewater Associates | Amazon Web Services ,https://youtu.be/C3H4LKmcw1M,Amazon Web Services,93 ,5:35
2058,Preference Fine-Tuning of LLMs Should Leverage Suboptimal- On-Policy Data ,https://youtu.be/EXCdKNpUsY4,Arxiv Papers,900 ,5:35
2059,Unlocking LLM Potential with your own APIs ,https://youtu.be/W2ueLkRJg4U,Microsoft Reactor,138 ,8:02
2060,The Instruction Hierarchy: Training LLMs to Prioritize Privileged Instructions ,https://youtu.be/krFjb9jvXy4,Arxiv Papers,4600,8:02
2061,MIXTRAL 8x22B: The BEST MoE Just got Better | RAG and Function Calling ,https://youtu.be/ab4vRwe77vw,Prompt Engineering,162 ,9:30
2062,Next Steps in the AGI Evolution ,https://youtu.be/BQ1we0Sf-dE,Super Data Science: ML &amp; AI Podcast with Jon Krohn,5900,9:30
2063,Fine Tune Llama 3 using ORPO ,https://youtu.be/zEvHrSd8DJU,AI Anytime,3900,13:35
2064,Next-Gen AI: RecurrentGemma (Long Context Length) ,https://youtu.be/zEvHrSd8DJU,Discover AI,8200,13:35
2065,Q* ,https://youtu.be/Vnsyer0ASHo,hu-po,3500,58:30
2066,why llama-3-8B is 8 billion parameters instead of 7? ,https://youtu.be/K_g9XmybXV0,Chris Hay,40 ,58:30
2067,Stronger Random Baselines for In-Context Learning ,https://youtu.be/gUJetd1m53g,Arxiv Papers,83 ,42:35
2068,Towards Reliable Latent Knowledge Estimation in LLMs ,https://youtu.be/uDXusoQRx5o,Arxiv Papers,164000,42:35
2069,Build Anything with Llama 3 Agents- Here’s How ,https://youtu.be/IgM_UKlstOQ,David Ondrej,3000,6:29
2070,AI Agents: Looping vs Planning ,https://youtu.be/_DMZ6sP4LE4,Jason Liu,23000,6:29
2071,A little guide to building Large Language Models in 2024 ,https://youtu.be/jVU0T_-Aei8,ThomWolf,1700,1:14:14
2072,Fine-Tune Llama 3 Using ORPO on Your Own Dataset ,https://youtu.be/xWif8_m--Xg,Fahd Mirza,56 ,1:14:14
2073,Chinchilla Scaling: A replication attempt ,https://youtu.be/1TZwFGThcFc,Arxiv Papers,1600,16:11
2074,Create Synthetic Dataset from Scratch for Free in Colab - Distilabel ,https://youtu.be/3_ygPgTdowE,Fahd Mirza,132 ,16:11
2075,The Illusion of State in State-Space Models ,https://youtu.be/8INvfiLv-cU,Arxiv Papers,295 ,47:42
2076,Is DPO Superior to PPO for LLM Alignment? A Comprehensive Study ,https://youtu.be/kcd0BTKJuXk,Arxiv Papers,302 ,47:42
2077,Mixture of Attention - Swap Face Body in Image with AI ,https://youtu.be/SqxBmurAn_U,Fahd Mirza,91000,21:12
2078,LLAMA-3 🦙: EASIET WAY To FINE-TUNE ON YOUR DATA 🙌 ,https://youtu.be/zI7JL69Vrhw,Prompt Engineering,1800,21:12
2079,Llama 3 - The Best Open Source Model Easy Finetune and Inference with Architecture Explanation ,https://youtu.be/IlNglM9bKLw,Neural Hacks with Vasanth,119000,8:20
2080,Reliable- fully local RAG agents with LLaMA3 ,https://youtu.be/i54OXTEcaKA,LangChain,177 ,8:20
2081,BLINK - Multimodal LLM Can See but Not Perceive ,https://youtu.be/bdNdo6PTMEA,Fahd Mirza,18000,24:59
2082,Flow Engineering with LangChain/LangGraph and CodiumAI ,https://youtu.be/r_UBBfTPcF0,LangChain,1100,24:59
2083,Create Code Interpreter with Llama 3 for Free ,https://youtu.be/fyAo-K7uxsk,Fahd Mirza,233 ,25:51
2084,Toward Self-Improvement of LLMs via Imagination- Searching- and Criticizing ,https://youtu.be/5Km-6zZP8IQ,Arxiv Papers,222 ,25:51
2085,From R to Q: Your Language Model is Secretly a Q-Function ,https://youtu.be/c61tw8DmLsg,Arxiv Papers,15000,8:26
2086,Advance RAG control flow with Mistral and LangChain: Corrective RAG- Self-RAG- Adaptive RAG ,https://youtu.be/uzADTZnUA_0,Mistral AI,16000,8:26
2087,Llama 3 RAG Demo with DSPy Optimization- Ollama- and Weaviate! ,https://youtu.be/lG-JeZsRMwY,Connor Shorten,7100,59:05
2088,4 Skills You Need to Be a Full-Stack Data Scientist ,https://youtu.be/fZEE2iEKfV8,Shaw Talebi,2600,59:05
2089,Summary Evaluators | LangSmith Evaluations - Part 11 ,https://youtu.be/e8vg1vin78U,LangChain,23000,18:44
2090,8-Building Gen AI Powered App Using Langchain And Huggingface And Mistral ,https://youtu.be/7ZLQGbPB1ac,Krish Naik,291 ,18:44
2091,Megalodon 7B - Alternate of Transformers and State Space Models ,https://youtu.be/COtmBdS6Y-s,Fahd Mirza,1200,2:15:23
2092,Introduction to AI Agents with Milvus and LlamaIndex ,https://youtu.be/qaWOwbFw3cs,Zilliz,27000,2:15:23
2093,Fine-Tune Llama 3 Model on Custom Dataset - Step-,https://youtu.be/lTfhw_9cJqc,Fahd Mirza,80 ,1:06:41
2094,BLINK: Multimodal Large Language Models Can See but Not Perceive ,https://youtu.be/fKMB5UlVY1E,Arxiv Papers,43 ,1:06:41
2095,Reka Core- Flash- and Edge: A Series of Powerful Multimodal Language Models ,https://youtu.be/TAuFH76iz-U,Arxiv Papers,125 ,3:44
2096,TRIFORCE: Lossless Acceleration of Long Sequence Generation with Hierarchical Speculative Decoding ,https://youtu.be/WLDehSkSIhY,Arxiv Papers,1700,3:44
2097,Multi-modal MoonDream API - Mixtral 8x22B Instruct - Llama 3 ,https://youtu.be/h5agcL6t4uM,Trelis Research,907 ,11:40
2098,How to Use LLM Function Calling Locally for Free ,https://youtu.be/1hIBnsvH6-M,Fahd Mirza,1100,11:40
2099,How to do RAG in OpenAI GPT4 Locally with File Search ,https://youtu.be/pvrioGzF-6s,Fahd Mirza,121 ,18:16
2101,Mighty New TransformerFAM (Feedback Attention Mem) ,https://youtu.be/KV8B-sD7T0o,Discover AI,376 ,8:26
2102,How to Create Scalable and Distributed Workflows with DVC and Ray ,https://youtu.be/aO1XvwGT8go,DVCorg,457 ,8:26
2103,Graphs and Language // Louis Guitton // AI in Production Lightning Talk ,https://youtu.be/RWo4GDTZIsE,MLOps.community,649 ,11:04
2104,A Quick &amp; Practical Introduction to Prompt Engineering ,https://youtu.be/En78C8eXWv8,Automata Learning Lab,5400,11:04
2105,Google just Solved the Context Window Challenge for Language Models ? ,https://youtu.be/v21fCCuVMQg,What's AI by Louis-François Bouchard,129 ,19:35
2106,AI For Marketers #13 ,https://youtu.be/rqiqDqfMtTc,AI User Group,730 ,19:35
2107,Don't Deploy RAG Without This! Embedding Quantization (~4 lines of code) ,https://youtu.be/1D4YoAUpjlg,TwoSetAI,805 ,16:15
2108,Innovative Gen AI Applications: Beyond Text // MLOps Mini Summit #5 ,https://youtu.be/7CXJWnHI05w,MLOps.community,435 ,16:15
2109,Enabling Efficient Trillion Parameter Scale Training for Deep Learning Models // Tunji Ruwase ,https://youtu.be/BuGeY4MMTLs,MLOps.community,4200,9:28
2110,Data Agents with #llamaindex ,https://youtu.be/-kPb8AN-8Mg,AI Makerspace,63000,9:28
2111,Retrieval Augmented Generation (RAG) Explained: Embedding- Sentence BERT- Vector Database (HNSW) ,https://youtu.be/_zgOvae-ccY,Umar Jamil,6200,28:26
2112,Mamba- SSMs &amp; S4s Explained in 16 Minutes ,https://youtu.be/c5D45H3xgYQ,Vivian C.,3600,28:26
2113,Chain of Thought with Retrieval for LLMs ,https://youtu.be/C9jVxOLwcgY,Vivek Haldar,803 ,43:25
2114,AI Papers Review - CRAG- RAPTOR RAG - Diving into RAG and AI Agents - S01 ,https://youtu.be/Zn7S5mLfkrc,PolyAgent,90 ,43:25
2115,Self-playing Adversarial Language Game Enhances LLM Reasoning ,https://youtu.be/sbZEvr-ROF8,Arxiv Papers,207000,16:55
2116,CrewAI Tutorial: Complete Crash Course for Beginners ,https://youtu.be/nPIGVaYPQAg,codewithbrandon,53000,16:55
2117,How to Create FULLY Autonomous AI Research Agents ,https://youtu.be/dnrX5amf9_0,Jack Roberts,8300,5:40
2118,AWQ for LLM Quantization ,https://youtu.be/vOA9JSDPJs0,MIT HAN Lab,15000,5:40
2119,An Introduction to LLM Agents | From OpenAI Function Calling to LangChain Agents ,https://youtu.be/3epDk3lf3n8,Automata Learning Lab,49000,9:47
2120,I Automated My YouTube Channel With CrewAI [Free Source Code Included] ,https://youtu.be/l4KS9o2yXGo,codewithbrandon,1100,9:47
2121,Idefics2 and The Cauldron - Good Model for OCR ,https://youtu.be/2Y7PZx7wmBA,Fahd Mirza,55000,14:49
2122,Unlock AI Agent real power?! Long term memory &amp; Self improving ,https://youtu.be/i-txsBoTJtI,AI Jason,805 ,14:49
2123,AutoVector | Chat With Your Both SQL and Free Text Data Simultaneously ,https://youtu.be/W31UMLHcqc4,MG,7600,9:06
2124,How to convert PDF DOCX to Structured TXT Formats for RAG! (UNSTRUCTURED Tutorial) ,https://youtu.be/2-SPH9hIKT8,1littlecoder,122 ,9:06
2125,Pi Day 2024 AWS OnAir: AWS Training Certification - Learn Generative AI For Developers ,https://youtu.be/Tj8l2i3uf0A,AWS Events,333 ,15:45
2126,Pi Day 2024 AWS OnAir: Fine-tuning &amp; Retrieval-Augmented Generation (RAG) for generative AI ,https://youtu.be/BNPG8uQiGNQ,AWS Events,191 ,15:45
