,title,link,channel,views,length
2091,DSPy: Advanced Prompt Engineering? ,https://youtu.be/KI4YxEM6iDM,Arxiv Papers,2700,1:31:21
2092,Gemini Flash is SURPRISINGLY Good for Agents and Function Calling ,https://youtu.be/Zazp0kAQ7tA,AI Makerspace,6300,1:31:21
2093,Why are vector databases so FAST? ,https://youtu.be/ea36pxxh6zA,Prompt Engineering,300 ,28:05
2094,Building open source LLM agents with Llama 3 ,https://youtu.be/nSrj1J6ODoM,Underfitted,1800,28:05
2095,Getting started with MLOps on Amazon SageMaker for generative AI | Amazon Web Services ,https://youtu.be/AOi6uomSHY0,LangChain,1300,25:16
2096,Advanced RAG 03 - Reranking with Sentence Transformers and BM25 API ,https://youtu.be/G3YjjAbKZ-Y,Amazon Web Services,16000,25:16
2097,GenAI for SW developers - V.2! 2# Dr. GPT: Grounding LLMs in Healthcare ,https://youtu.be/iB8FWR9aD5Q,Sunny Savita,98 ,38:46
2098,OpenAGI - Autonomous Human Like Agents ,https://youtu.be/CC-CboRGaDo,Microsoft Reactor,353 ,38:46
2099,HippoRAG - Neurobiologically Inspired Memory for LLMs ,https://youtu.be/MKimX011yOo,Fahd Mirza,20000,13:13
2100,Amazon SageMaker overview | Amazon Web Services ,https://youtu.be/CA2AXfWWdpA,Fahd Mirza,307 ,13:13
2101,Verbalized Machine Learning: Revisiting Machine Learning with Language Models ,https://youtu.be/a4J6tHqyw7E,Amazon Web Services,87 ,20:08
2102,VectorDB Recipes: Stay up-to-date with GenAI in one place | I'm Accepting contributions on this repo ,https://youtu.be/tc92qoRFMPA,Arxiv Papers,88 ,20:08
2103,RAG in 2024: Advancing to Agents ,https://youtu.be/ga4kaACFlJg,Ayush Chaurasia,18000,32:48
2104,Interpretable AI in Medicine | Multimodal Foundation Models in Oncology | Mauricio Reyes ,https://youtu.be/T2usmMiISrs,LlamaIndex,61 ,32:48
2105,Climbing the Quality Hill | Multimodal Foundation Models in Oncology | Fabian Roth ,https://youtu.be/JzvKJ9ytz98,Applied Machine Learning Days,91 ,1:01:04
2106,Training Large-Scale Medical FMs | Multimodal Foundation Models in Oncology | E. De Jong &amp; V. Botha ,https://youtu.be/88rS6ePHOpk,Applied Machine Learning Days,113 ,1:01:04
2107,LLM - Reasoning SOLVED (new research) ,https://youtu.be/TQ6Bz-Az0yI,Applied Machine Learning Days,342 ,1:16:23
2108,How Truncating Weights Improves Reasoning in Language Models ,https://youtu.be/mYF1cFzxusE,Discover AI,2800,1:16:23
2109,Choice of PEFT Technique in Continual Learning: Prompt Tuning is Not All You Need ,https://youtu.be/1tEV5INi5Lk,Arxiv Papers,64 ,1:16:43
2110,Learning to grok: Emergence of in-context learning and skill in modular arithmetic tasks ,https://youtu.be/E-YnoVBN5NM,Arxiv Papers,3100,1:16:43
2111,To Believe or Not to Believe Your LLM ,https://youtu.be/7wF9RMGno28,Arxiv Papers,5000,18:00
2112,MLSys'24 Best Paper - AWQ: Activation-aware Weight Quantization for LLM Compression and Acceleration ,https://youtu.be/pRKFsJqn0eQ,Arxiv Papers,15000,18:00
2113,Does your data spark joy? Performance gains from domain upsampling at the end of training ,https://youtu.be/P-RHhkPtIGE,MIT HAN Lab,104 ,56:43
2114,Bye Bye Privacy!!! ,https://youtu.be/RBhfwJZSBWM,Arxiv Papers,4000,56:43
2115,How to MAKE AI Agents MORE SUCCESSFUL!!! ,https://youtu.be/a6VWF_DpWDU,1littlecoder,3200,38:11
2116,New Discovery: LLMs have a Performance Phase ,https://youtu.be/DvvypUqdjXo,1littlecoder,467 ,38:11
2117,Show- Don't Tell: Aligning Language Models with Demonstrated Feedback ,https://youtu.be/7zbyR_Hty1U,Discover AI,687 ,2:45:33
2119,Enhancing search on AWS with AI- RAG- and vector databases (L300) | AWS Events ,https://youtu.be/-UNY-u1zsCY,Venelin Valkov,404 ,34:03
2120,How Sonrai Analytics leverages ML to accelerate Precision Medicine (L300) | AWS Events ,https://youtu.be/eUOb3iS4nOM,AWS Events,2100,34:03
2121,Has prompt engineering been solved? ,https://youtu.be/dh_am72ykAQ,AWS Events,101 ,10:50
2122,AWS Trainium and Inferentia // Kamran Khan and Matthew McClean // MLOps Podcast #238 ,https://youtu.be/V3fhgpgLuJg,Elvis Saravia,1500,10:50
2123,MMLU-Pro : A New LLM Benchmark ,https://youtu.be/SyO8c0fM6ZU,MLOps.community,117 ,4:06
2124,LLAMA 3 or Phi 3 AI Agent: Can they Beat Perplexity in Web Search? ,https://youtu.be/wEmO00ADppw,Fahd Mirza,1100,4:06
2125,How to handle Class Imbalance in ML problems? ,https://youtu.be/gNY06JM6m8U,Data Centric,183 ,4:03
2126,CoPE - Contextual Position Encoding: Learning to Count What's Important ,https://youtu.be/6rWtZGF5LS8,Data Science in your pocket,844 ,4:03
2127,What makes unlearning hard and what to do about it ,https://youtu.be/B0phjAyaY3Q,Gabriel Mongaras,2800,28:41
2128,Deep Dive into Large Language Models : From RNN to RLHF ,https://youtu.be/coBTzvQsPpQ,Arxiv Papers,296 ,28:41
2129,Graph Neural Networks | Scientific Machine Learning for Science and Engineering | Vinay Sharma ,https://youtu.be/epidA1fBFtI,Aritra Sen,890 ,4:39
2130,Master Python Regular Expressions in 1 Hour: Complete Guide ,https://youtu.be/lJDxkjE9SSY,Applied Machine Learning Days,119 ,4:39
2131,Best Practices for GenAI applications on AWS - RAG pipeline Eval - Part 3 | Amazon Web Services ,https://youtu.be/KwF_ZB29ZB0,Ryan &amp; Matt Data Science,4400,12:51
2132,How To Implement SetFit For Few-Shot Fine-Tuning of Sentence Transformers ,https://youtu.be/t-vnrD8o6TA,Amazon Web Services,6900,12:51
2133,The Communication Platform of the Future ,https://youtu.be/Tjx_kd5db34,Fahd Mirza,879 ,55:19
2135,Informer attention Architecture - FROM SCRATCH! ,https://youtu.be/iheqPgJmX6M,Arxiv Papers,2800,10:22
2136,NVIDIA NIM: Easily Deploy and Integrate Generative AI Models In App ,https://youtu.be/R-o_a6dvzQM,CodeEmporium,963 ,10:22
2137,50x Pandas Speed up with Nvidia GPU!!! ,https://youtu.be/OAQfMoK6AV0,Mervin Praison,261 ,54:10
2138,Preparing Fineweb - A Finely Cleaned Common Crawl Dataset ,https://youtu.be/Fy2V6ZmXK0s,1littlecoder,892 ,54:10
2139,LangGraph vs. LangChain LCEL - Can we get rid of LCEL (LangChain Expression Language) ,https://youtu.be/Sr1NIeSIiNw,Trelis Research,113 ,16:11
2140,Create Complete RAG Pipeline Locally and Free with FastRAG and HayStack ,https://youtu.be/b23mQEHVf5U,Coding Crash Courses,7100,16:11
2141,New State-of-the-art Accuracy for the 3 Primary Uses of Healthcare Language Models ,https://youtu.be/GSrPRxSwcvg,Fahd Mirza,27000,11:00
2142,What is Sentence Transformer - Easiest Explanation with Demo ,https://youtu.be/gCGck5Fn3G4,John Snow Labs,602 ,11:00
2143,MLOps Moves Fast. How Can Keep Up? ,https://youtu.be/us7nTT5hC6U,Fahd Mirza,7500,30:52
2144,*Don't* miss these LLMs Concepts!! ,https://youtu.be/8tS_84-5Hmo,Super Data Science: ML &amp; AI Podcast with Jon Krohn,2800,30:52
2145,LLM Evaluation With MLFLOW And Dagshub For Generative AI Application ,https://youtu.be/GFxQb8lKQS4,1littlecoder,2200,54:25
2146,Self-RAG Could Revolutionize Industrial LLMs! ,https://youtu.be/rPQIYLvPszY,Krish Naik,528 ,54:25
2147,AutoTrain: Train ANY Large Language Model with 1 Command ,https://youtu.be/6YtdtjQD1r0,AI In Everyday Life,462 ,12:21
2148,LlamaIndex Webinar: Open-Source Longterm Memory for Autonomous Agents ,https://youtu.be/A20wzlC7Q-c,Mervin Praison,1600,12:21
2149,One Thought on the Future of AI Agents World Model ,https://youtu.be/cpLi-82koFM,LlamaIndex,15000,1:33:43
2150,Bulk Reading New AI Paper Abstracts - May 25- 2024 ,https://youtu.be/j2OAeeujQ9M,Discover AI,3200,1:33:43
2151,Bulk Reading Newest AI Papers - June 1- 2024 ,https://youtu.be/EjiYnHkmn1I,Tunadorable,847 ,24:53
2152,Integrating LLMs with Knowledge Graphs- a Casual Intro ,https://youtu.be/V58mPkLB95o,Tunadorable,4400,24:53
2153,The Future Of LLM Training Is Federated ,https://youtu.be/VHCDtkjocl8,Tunadorable,41000,1:57:38
2154,Bridging the Gap Between AI Research and Production with Semantic Kernel ,https://youtu.be/rJn-Ti03AjA,Tunadorable,1000,1:57:38
2155,Coding tutorial: RAG with LangChain and Llama3 ,https://youtu.be/o8_LApdDvYE,Alex Chao,63 ,9:46
2156,Hugging Face just got H*CKED?!  Are your GPUs safe? ,https://youtu.be/mzkHGEyAPEw,YanAITalk,265 ,9:46
2157,xLSTM: Extended Long Short-Term Memory ,https://youtu.be/dU6eiWjJfSw,Ai Flux,1900,1:21:22
2158,GNN-RAG - New RAG Method for LLM Reasoning ,https://youtu.be/2Z9rbnhF8yQ,Yannic Kilcher,1000,1:21:22
2159,JINA CLIP: Your CLIP Model Is Also Your Text Retriever ,https://youtu.be/MXPYbjjyHXc,Fahd Mirza,820 ,29:22
2160,Contextual Position Encoding: Learning to Count What's Important ,https://youtu.be/zwrRQEGM76o,Arxiv Papers,2300,29:22
2162,DistriFusion: Distributed Parallel Inferencefor High-Resolution Diffusion Models ,https://youtu.be/4lx4As_e_l0,Fahd Mirza,827 ,25:09
2163,RAPTOR - New RAG Method with Richer Context and Cost Efficient ,https://youtu.be/Z1bXBinTtnQ,MIT HAN Lab,786 ,19:28
2164,NEW ChatGPT EDU for AI Universities: Unique SALE ,https://youtu.be/ielZJwDfZL4,Fahd Mirza,60 ,19:28
2165,Advacne RAG 02 -  Hybrid Search (Keyword + Vector ) &amp; Reranking With Cohere API | Ensemble Retrieval ,https://youtu.be/CqsDFb3ScOc,Discover AI,159 ,13:30
2166,Arithmetic Transformers with Abacus Positional Embeddings | AI Paper Explained ,https://youtu.be/fv8sgcn3VxM,Sunny Savita,1800,13:30
2167,Use RAPTOR RAG Locally with Open-Source Free Models ,https://youtu.be/JlRhytfQlUg,AI Papers Academy,78000,3:04:21
2168,Is In-Context Learning Sufficient for Instruction Following in LLMs? ,https://youtu.be/dcINVsqxQgQ,Fahd Mirza,1200,3:04:21
2169,Large Language Models Can Self-Improve At Web Agent Tasks ,https://youtu.be/DsAN_a01ptU,Arxiv Papers,1200,3:21
2170,Build Local End-to-End RAG Pipeline with Evaluation - BeyondLLM ,https://youtu.be/he-fOrSkKek,Arxiv Papers,9800,3:21
2171,Marker: This Open-Source Tool will make your PDFs LLM Ready ,https://youtu.be/5qetCIOBKAI,Fahd Mirza,7400,14:35
2172,Fine-Tune Sentence Transformer Models on Custom Datasets ,https://youtu.be/QgOeWbW0jeA,Prompt Engineering,2400,14:35
2173,Better RAG with HyDE - Hypothetical Document Embedding ,https://youtu.be/cNKyjpn5tp4,Fahd Mirza,601 ,44:43
2175,METEOR : A metric for Machine Translation ,https://youtu.be/fzqSP3vTZ4E,AI Coffee Break with Letitia,826 ,16:43
2176,Get Ahead in Your RAG! Must-Know Knowledge Graph Integration Secrets! ,https://youtu.be/bjzh9UE9CVs,MachineLearningInterview,11000,16:43
2177,Use Tools and Function Calling on HuggingChat ,https://youtu.be/_xghhjS8JOk,TwoSetAI,1500,34:44
2178,Anonymizing Sensitive Data in LLM Prompts ,https://youtu.be/E5cSYQS2QNU,Fahd Mirza,155 ,34:44
2179,MLOps vs ML Engineering Explained ,https://youtu.be/UwcWPslAxmE,Trelis Research,1100,9:35
2180,Stanford CS25: V4 I From Large Language Models to Large Multimodal Models ,https://youtu.be/xP-TPVr7eAo,Super Data Science: ML &amp; AI Podcast with Jon Krohn,535 ,9:35
2181,LangGraph : Self Corrective RAG (CRAG) to Reduce hallucination in RAG Pipeline : Part4 ,https://youtu.be/9OF_1PBrt8s,Stanford Online,1500,29:37
2182,Copilot for Security: From Posture Management to Threat Detection ,https://youtu.be/WINPpkHd0NM,Aritra Sen,13000,29:37
2183,Data Preparation Tips and Tricks ,https://youtu.be/qcMsvU-wYZA,Microsoft Reactor,364 ,23:24
2184,GenAI for SW developers - V.2! 3# -More Agents Is All You Need? ,https://youtu.be/XvthFEp_nt8,Trelis Research,157 ,23:24
2185,AI/ML based Card Payment Fraud Detection on AWS using replicated data from mainframe ,https://youtu.be/10OlBEYlh6A,Microsoft Reactor,12000,20:43
2186,Advance RAG 01 - Powerful RAG Using Hybrid Search(Keyword+vVector search) | Ensemble Retrieval ,https://youtu.be/n0ZX_ZfWPGg,Amazon Web Services,4600,20:43
2187,General World Model - Pandora ,https://youtu.be/YlRtBs-mWUE,Sunny Savita,56 ,19:27
2188,Handling Massive Machine Learning Models // Simon Karasik // MLOps podcast #228 clip ,https://youtu.be/JbizhCFmC20,Fahd Mirza,153 ,19:27
2189,Synthetic Data Generation using LLM: Crash Course for Beginners ,https://youtu.be/pTGr643h5VE,MLOps.community,62000,24:25
2190,Integrate BEST Coding Assistant into ANY Application (Codestral API) ,https://youtu.be/XB7hG5MbaFU,AI Anytime,5100,24:25
2191,COSY: Evaluating Textual Explanations of Neurons ,https://youtu.be/BSqMgS1bN74,Mervin Praison,18000,18:06
2192,Kernel Language Entropy: Fine-grained Uncertainty Quantification for LLMs from Semantic Similarities ,https://youtu.be/zcBA2KhTwMg,Arxiv Papers,215 ,18:06
2193,Advanced RAG with Knowledge Graphs (Neo4J demo) ,https://youtu.be/TBNFiMGYaAY,Arxiv Papers,335 ,1:01:43
2194,Simplest Way to Use Local and Online LLMs and RAG - Install Msty ,https://youtu.be/m_FTRlwCrLs,Johannes Jolkkonen | Funktio AI,1000,1:01:43
2195,The Future of Personalization in Banking: AI- Marketing Automation &amp; Transaction Data Keynote ,https://youtu.be/20wbA_ijjmg,Fahd Mirza,68 ,10:36
2196,Scaling B2B Marketing for Enterprises Using Gen AI ,https://youtu.be/_yFfc5YB5Xc,Banking Transformed Podcast,104 ,10:36
2197,Avoiding AI POC Purgatory // Sol Rashidi // MLOps podcast #227 clip ,https://youtu.be/AfXBucw5Z6Q,AI User Group,196 ,31:35
2198,[LLM News] xAI Series B- Codestral- LLM Guide- AutoGen Course- Symbolic Chain-of-Thought ,https://youtu.be/xR_SF6HOo2E,MLOps.community,35000,31:35
2199,Self-Exploring Language Models: Active Preference Elicitation for Online Alignment ,https://youtu.be/wNDw8Q_cJJQ,Elvis Saravia,919 ,16:13
2200,Nearest Neighbor Speculative Decoding for LLM Generation and Attribution ,https://youtu.be/xEkQKuKy-i8,Arxiv Papers,9500,16:13
2201,Automatic Data Curation for Self-Supervised Learning ,https://youtu.be/oWXTWqsSos4,Arxiv Papers,990 ,26:48
2202,Building News AI Agents Using CrewAI And Google Gemini Pro LLM Models ,https://youtu.be/VCwk0Xk1oR0,Fahd Mirza,142 ,26:48
2203,787: MLOps: The Job and The Key Tools — with Demetrios Brinkmann ,https://youtu.be/Y43f0AYLlTU,Krish Naik,37 ,1:05:48
2204,Agentic AI: The Future is here? ,https://youtu.be/1C0F9mZCisU,Super Data Science: ML &amp; AI Podcast with Jon Krohn,214 ,1:05:48
2205,Managing Small Knowledge Graphs for Multi-agent Systems // Tom Smoker // MLOps Podcast #236 ,https://youtu.be/o0DPxvgML5c,Discover AI,1800,9:57
2206,Transformers Can Do Arithmetic with the Right Embeddings ,https://youtu.be/7m1x66psgqA,MLOps.community,185 ,9:57
2207,On the Origin of Llamas: Model Tree Heritage Recovery ,https://youtu.be/7m1x66psgqA,Arxiv Papers,19000,39:42
2208,Phased Consistency Model ,https://youtu.be/YFX4KCfOnRQ,Arxiv Papers,18000,39:42
2209,Fine-Tuning with ReFT: Create an Emoji LLM for Medical Diagnosis ,https://youtu.be/ib-7PFBlWEA,Arxiv Papers,7200,48:37
2210,Zamba - Compact 7B SSM Hybrid Model ,https://youtu.be/aCVhNj9UBLg,AI Anytime,199 ,48:37
2212,How to train a model to generate image embeddings from scratch ,https://youtu.be/8QlFtKHzcaY,AI Search,19000,33:10
2213,WARNING: Bad News for CHATGPT! ,https://youtu.be/8QlFtKHzcaY,Underfitted,18000,42:25
2214,Is LLMOps Really a Thing? ,https://youtu.be/ooz8juF2e3I,1littlecoder,7900,42:25
2215,crewAI Crash Course For Beginners-How To Create Multi AI Agent For Complex Usecases ,https://youtu.be/UHEaMY9wW54,Super Data Science: ML &amp; AI Podcast with Jon Krohn,2300,13:27
2216,Introduction to LangGraph: A Quick Dive into Core Concepts ,https://youtu.be/0OaEv1a5jUM,Krish Naik,182 ,13:27
2217,Informer: Time series Transformer - EXPLAINED! ,https://youtu.be/1aVEQJsg2Ho,Coding Crash Courses,1000,1:03:37
2218,Advanced RAG - Self Querying Retrieval ,https://youtu.be/8XjCnX1y4lA,CodeEmporium,6200,1:03:37
2220,EM Distillation for One-step Diffusion Models ,https://youtu.be/UJ7BnX50ZLg,Fahd Mirza,656 ,49:13
2221,NaturalSpeech 3: Zero-Shot Speech Synthesis with Factorized Codec and Diffusion Models ,https://youtu.be/EZX7srDDmW0,Arxiv Papers,896 ,1:10:47
2222,GenAI for Financial Services - MLOps Live #25 with McKinsey ,https://youtu.be/_8ZxOwQW4iU,Gabriel Mongaras,1300,1:10:47
2223,Are Long-LLMs A Necessity For Long-Context Tasks? ,https://youtu.be/gXFTDqi4UIE,Iguazio (Acquired by McKinsey),399 ,16:32
2224,Grokked Transformers are Implicit Reasoners: A Mechanistic Journey to the Edge of Generalization ,https://youtu.be/ZzJoD9JzQcc,Arxiv Papers,1600,16:32
2225,How to Prepare for an AI and Machine Learning Interview ,https://youtu.be/ZzJoD9JzQcc,Arxiv Papers,10000,19:29
2226,Fine-Tuning Mistral 7B with Mistral-finetune ,https://youtu.be/ENykjLzRpoI,Fahd Mirza,3100,19:29
2227,SimPO - Simple Preference Optimization - New RLHF Method ,https://youtu.be/X4HPFFHjf_c,AI Makerspace,1500,14:20
2228,Structured Output Generation Language for LLMs - SGLang ,https://youtu.be/L19paNdGcOE,Fahd Mirza,31000,14:20
2229,Learn What Is Introduced in YOLOv10  | YOLOv10 Paper Explained ,https://youtu.be/J4CbRAOE9no,Fahd Mirza,6700,19:49
2230,DSPy: New Machine Learning Paradigm (No Prompt Engineering Required) ,https://youtu.be/VxUBkdjarIo,Code With Aarohi,743 ,19:49
2231,Control LLM Output with SGL - SGLang with GPT ,https://youtu.be/mdLBr9IMmgI,Ilia Zlobin,1600,1:44:38
2232,Chat and RAG with Tabular Databases Using Knowledge Graph and LLM Agents ,https://youtu.be/4NKODW2j1zo,Fahd Mirza,523 ,1:44:38
2233,Create Realistic Talking AI Agent with D-ID- UneeQ- and Azure AI ,https://youtu.be/FHUX0hlYNZo,Farzad Roozitalab (AI RoundTable),1300,22:37
2234,The Entropy Enigma: Success and Failure of Entropy Minimization ,https://youtu.be/VC9NbOir7q0,AI Anytime,7500,22:37
2235,Easiest Way to Build AI Agents Locally with LlamaIndex and Ollama ,https://youtu.be/FqQbrlEh_b0,Soroush Mehraban,1900,1:06:48
2236,AGILE: A Novel Framework of LLM Agents ,https://youtu.be/vMBL2nErmQ8,Fahd Mirza,8200,1:06:48
2237,Make Your LLM App Lightning Fast ,https://youtu.be/vAZNI3IeFuo,Arxiv Papers,3300,31:03
2238,Advanced Function Calling with Mistral-7B - Multi function and Nested Tool Usage ,https://youtu.be/7NrzPuICLtg,Developers Digest,381 ,31:03
2239,LongRoPE &amp; Theta Scaling to 1 Mio Token (2/2) ,https://youtu.be/RA936kzuDfg,Prompt Engineering,658 ,52:28
2240,Llama Index AI Agents: How to Get Started for Beginners? ,https://youtu.be/cYfKQ6YG9Qo,Discover AI,878 ,52:28
2241,Thermodynamic Gradient Descent ,https://youtu.be/mlnhHMzbCqw,Mervin Praison,4300,16:17
2242,Just when we Started to Solve Software Docs- AI Blew Everything Up // Dave Nunez // Podcast #235 ,https://youtu.be/JjbBaRfHr4U,hu-po,1300,16:17
2243,Developing Talent in Security Operations | Amazon Web Services ,https://youtu.be/lQh0WLxdYos,MLOps.community,88 ,1:38:42
2244,How Will Generative AI Change Security Operations? | Amazon Web Services ,https://youtu.be/wB9gD9FkgNA,Amazon Web Services,78 ,1:38:42
2245,Can My Ollama Local WebSearch Agent (With Llama 3 8B) Beat Perplexity AI? ,https://youtu.be/8k6OfLGsxZU,Amazon Web Services,903 ,46:22
2246,Real Time RAG with Haystack 2 0 and Bytewax ,https://youtu.be/Wwuz1l-PCgQ,Data Centric,115 ,46:22
2247,Thermodynamic Natural Gradient Descent ,https://youtu.be/Wwuz1l-PCgQ,AI Makerspace,593 ,45:31
2248,Lessons from the Trenches on Reproducible Evaluation of Language Models ,https://youtu.be/o7SBf0MgLf0,Arxiv Papers,591 ,45:31
2249,786: The Six Keys to Data Scientists' Success — with Kirill Eremenko ,https://youtu.be/IHHy0nqE3YY,Arxiv Papers,16000,23:51
2250,Implicit In-context Learning ,https://youtu.be/hMjtdECXlYo,Super Data Science: ML &amp; AI Podcast with Jon Krohn,810 ,23:51
2251,Not All Language Model Features Are Linear ,https://youtu.be/XkVIRyxDwiI,Arxiv Papers,1200,38:36
2252,25+ AI SaSS IDEAS That can PAY You💰💸💸 ,https://youtu.be/X6V1YgpUwBI,Arxiv Papers,194 ,38:36
2253,Mistral's new 7B Model with Native Function Calling ,https://youtu.be/5sQuhhFha78,Neural Hacks with Vasanth,5800,1:00:01
2255,AI Systems in Government: Challenges &amp; Opportunities - Jared Dunnmon | Stanford MLSys#100 ,https://youtu.be/h8CiAF5Qn9g,Fahd Mirza,430 ,20:11
2256,Want a Better LLM? You Need Better Embeddings. Here's Why. ,https://youtu.be/clKpYmv3jRg,Stanford MLSys Seminars,401 ,20:11
2257,RoPE Rotary Position Embedding to 100K context length ,https://youtu.be/bh32Gt65OTY,Super Data Science: ML &amp; AI Podcast with Jon Krohn,9000,47:17
2258,Evaluating Quality and Improving LLM Products at Scale // Austin Bell // AI in Production Conference ,https://youtu.be/ZPOx1s2Uy1Q,Discover AI,704 ,47:17
2259,Navigating the Emerging LLMOps Stack // Hien Luu // AI in Production Conference Lightning Talk ,https://youtu.be/BBhLELGj77k,MLOps.community,14000,15:50
2260,Product Thinking in Data &amp; AI // Stuart Winter-Tear // AI in Production Conference ,https://youtu.be/1ndw2JyX0Hk,MLOps.community,209 ,15:50
2261,NEW MISTRAL: Uncensored and Powerful with Function Calling ,https://youtu.be/aHph2p7Mx00,MLOps.community,214 ,16:02
2262,Understanding Scientific Papers With Prompt Engineering &amp; The ChatGPT API ,https://youtu.be/LbDy-GKj8Vg,Prompt Engineering,65 ,16:02
2263,Stanford CS25: V4 I Transformers that Transform Well Enough to Support Near-Shallow Architectures ,https://youtu.be/07vd9dWYjyI,Automata Learning Lab,743 ,16:49
2264,Text is All You Need ,https://youtu.be/6vuYqxXUR18,Stanford Online,220 ,16:49
2265,MoRA: High-Rank Updating for Parameter-Efficient Fine-Tuning ,https://youtu.be/yJHdxYJgYhg,AI User Group,3200,46:52
2266,(Perhaps) Beyond Human Translation: Multi-Agent Collaboration for Translating Ultra-Long Texts ,https://youtu.be/LhWtpV-ZEeI,Arxiv Papers,129 ,46:52
2267,Exploring Capabilities of Long-Context LLMs ,https://youtu.be/VE3YL66i7GM,Arxiv Papers,64 ,41:21
2268,AutoQuizzer - Generate Quizes from URL with AI ,https://youtu.be/lq88x_YVGIg,Elvis Saravia,204 ,41:21
2269,Crack the Nut of Advanced RAG - The Power of Knowledge Graph ,https://youtu.be/uWRwbl-CuCk,Fahd Mirza,162 ,2:21:53
2270,Mercado Libre Gateway: Challenges in GenAI Adoption and a Use Case // Lina Chaparro // AI in Prod ,https://youtu.be/uWRwbl-CuCk,TwoSetAI,143 ,2:21:53
2271,Machine Learning beyond GenAI - Quo Vadis? // Hannes Hapke // AI in Production Conference ,https://youtu.be/DcFv3APc8E8,MLOps.community,8000,14:52
2272,Evaluating Language Models // Matthew Sharp // AI in Production Conference Lightning Talk ,https://youtu.be/KygbsCIpmZU,MLOps.community,8000,14:52
2273,The Intersection of Graphs and Large Language Models // Anthony Alcaraz // AI in Production ,https://youtu.be/KygbsCIpmZU,MLOps.community,90 ,1:39:33
2274,Beyond Guess-and-Check: Towards AI-assisted Prompt Engineering // Alex Cabrera // AI in Production ,https://youtu.be/KDeqfBs4Koc,MLOps.community,247 ,1:39:33
2275,Creating PRODUCTION level END TO END RAG pipeline| Fast- Accurate- Scalable- Simple ,https://youtu.be/GikIJpUv6oo,MLOps.community,1100,58:25
2276,Abacus ChatLLM - Great alternative to ChatGPT + RAG ,https://youtu.be/ihZXGy-BON8,Neural Hacks with Vasanth,1100,58:25
2277,Rethinking Retraining: Cost-Effective AI Solutions // Patrick Beukema // MLOps podcast #225 clip ,https://youtu.be/UDb5AdKiCLw,Mervin Praison,864 ,35:50
2279,CLLMs: Consistency Large Language Models | AI Paper Explained ,https://youtu.be/J5d1l6xgQBc,AI Makerspace,4000,18:55
2280,Achieving Production-level Performance in RAG with DSPy- Parea- and DVC ,https://youtu.be/aETHYkoJeNY,AI Papers Academy,616 ,18:55
2281,785: Math- Quantum ML and Language Embeddings — with Dr. Luis Serrano (@SerranoAcademy) ,https://youtu.be/iaXFggqqGD0,DVCorg,204 ,8:07
2282,Can We Learn Generative AI With Open Source Models- All Alternatives To Open AI Paid API's ,https://youtu.be/iaXFggqqGD0,Super Data Science: ML &amp; AI Podcast with Jon Krohn,127 ,8:07
2283,Fine-tuning on Wikipedia Datasets ,https://youtu.be/kwCQQLmtMgE,Krish Naik,5200,1:01:46
2284,OpenRLHF - Simplest and Fastest RLHF Training ,https://youtu.be/ARpkVPjb57M,Trelis Research,470 ,1:01:46
2285,Open Standards Make MLOps Easier and Silos Harder // Cody Peterson // MLOps podcast #234 ,https://youtu.be/-BelefxpVc8,Fahd Mirza,513 ,29:59
2287,Build a RAG Evaluation Tool and Python Library ,https://youtu.be/P0O78l-TO2Y,AI Makerspace,30000,27:11
2290,Reducing Transformer Key-Value Cache Size with Cross-Layer Attention ,https://youtu.be/EeZIKQmWSXg,Soroush Mehraban,3200,24:32
2291,Griptape: Create Customisable Multi AI Agents from Scratch ,https://youtu.be/lYmUjABuUzE,Arxiv Papers,526 ,19:53
2292,ML Interpretability: feature visualization- adversarial example- interp. for language models ,https://youtu.be/rwnIdla82pc,Mervin Praison,6100,19:53
2293,How to Build AI Assistants with Memory ,https://youtu.be/2ZFJbeJXXDM,Umar Jamil,685 ,12:49
2294,Integrate CrewAI with Ollama Locally and Privately to Run AI Agents ,https://youtu.be/NXI2l0wJNBY,Fahd Mirza,2800,12:49
2295,Easiest Way to Create AI Agents for Any Task ,https://youtu.be/SU88nx6PJoc,Fahd Mirza,582 ,12:42
2296,Chat With Knowledge Graph Data | Improved RAG ,https://youtu.be/3NP1llvtrbI,Fahd Mirza,2600,12:42
2297,Build your own copilot using Semantic Kernel ,https://youtu.be/Qk-tPY-pPJc,MG,29000,27:14
2298,What are GGUF LLM models in Generative AI ,https://youtu.be/PzEfBFDK1Uw,Microsoft Reactor,893 ,27:14
2299,Boost data discovery with AI recommendations in Amazon DataZone-AWS OnAir S5 ,https://youtu.be/jm0_MxWmqYc,Data Science in your pocket,2200,12:33
2300,LangChain - Parent-Document Retriever Deepdive with Custom PgVector Store ,https://youtu.be/F-OQ9bQp3jk,AWS Events,5900,12:33
2301,End To End Document Q&amp;A RAG App With Gemma And Groq API ,https://youtu.be/iF-npWXuKCQ,Coding Crash Courses,7800,40:20
2302,The Next Token: How LLMs Predict ,https://youtu.be/CzCcYlH_6_I,Krish Naik,269 ,40:20
2303,Many-Shot VISUAL ICL is amazing! (Stanford) ,https://youtu.be/RCSvpYb90qE,AI Makerspace,73 ,40:50
2304,XLSTM - Extended LSTMs with sLSTM and mLSTM (paper explained) ,https://youtu.be/jnWaUtS2Fr8,Discover AI,2300,40:50
2305,Easily Create Autonomous AI App from Scratch ,https://youtu.be/Hxv_y_bI3zA,AI Bites,7900,30:09
2306,GoalChain - Goal Oriented Conversations with LLM ,https://youtu.be/8b4fh_NY5fc,Mervin Praison,11000,30:09
2307,Training Data Attribution via Approximate Unrolled Differentation ,https://youtu.be/XwiTK4YDisk,Fahd Mirza,2900,12:19
2308,How to pick LoRA fine-tuning parameters? ,https://youtu.be/GgsDNTlb_4U,Arxiv Papers,6100,12:19
2309,Learn How to Build Multimodal Search and RAG ,https://youtu.be/wJBpLl_lsUQ,Trelis Research,11000,17:33
