,title,link,channel,views,length
857,SMEs and fast-prototyping AI services | Accelerating the Adoption of AI | Sébastien Rumley ,https://youtu.be/_XbWxeD6Z7M,Applied Machine Learning Days,138 ,1:19:44
858,The AI Field Moves Fast. Here's How to Stay Sane. ,https://youtu.be/0AfQXFj9m7Y,Super Data Science: ML &amp; AI Podcast with Jon Krohn,2200,1:19:44
859,LangGraph: Hierarchical Agents - How to build Boss &amp; Subordinate Agents ,https://youtu.be/AT8PCGeA4mI,Coding Crash Courses,38 ,11:05
860,Detecting Greenwashing Signals | Advances of ML Approaches | Susie Xi Rao ,https://youtu.be/4Ebe9JRWmpw,Applied Machine Learning Days,97 ,11:05
861,Bootstrapping Language Models with DPO Implicit Rewards ,https://youtu.be/Nj_RuxnzIvw,Arxiv Papers,4600,49:28
862,Supercharging RAG with Generative Feedback Loops from Weaviate ,https://youtu.be/B-pqcx8S4FU,AI Coffee Break with Letitia,518 ,49:28
863,From RLHF with PPO/DPO to ORPO + How to build ORPO on Trainium/Neuron SDK ,https://youtu.be/U4wTl_VsvsQ,Generative AI on AWS,1000,26:20
864,Avoiding rolling hot keys with Amazon DynamoDB - Amazon DynamoDB Nuggets | Amazon Web Services ,https://youtu.be/M3CL01ZmYIM,Amazon Web Services,448 ,26:20
865,AWS re:Inforce 2024 - Gen AI–powered Lambda code remediation using Amazon Inspector (APS322) ,https://youtu.be/38ACfUhv6Tc,AWS Events,1000,12:59
866,AWS re:Inforce 2024 - Navigating privacy and compliance while securing gen AI applications (GAI201) ,https://youtu.be/0Xp7K2rHcZg,AWS Events,9400,12:59
867,MoME Reduces LLM Hallucinations ,https://youtu.be/pyolU3Sk05w,Elvis Saravia,17000,26:11
868,Building Multi-Modal Search with Vector Databases ,https://youtu.be/LDh5MdR-CPQ,DeepLearningAI,2000,26:11
869,Indexing in Vector Databases ,https://youtu.be/RVMpm86equc,Fahd Mirza,19000,48:15
870,How to Choose a Vector Database ,https://youtu.be/YOClk49Cy2o,Pinecone,6500,48:15
871,Vector Database 101: A Crash Course ,https://youtu.be/nGNdlPOWHHc,Zilliz,18000,6:39
872,Understanding How Vector Databases Work! ,https://youtu.be/tg-ZjNl3OCg,The ML Tech Lead!,22000,6:39
873,What is a vector database? Why are they critical infrastructure for #ai #applications? ,https://youtu.be/VCPx0nUit80,Pinecone,28000,12:15
874,Complete Tutorial on Vector Database - Learn ChromaDB- Pinecone &amp; Weaviate | Generative AI ,https://youtu.be/T3tonLXqoy8,DSwithBappy,23000,12:15
875,Building AI Agents from Scratch- Simplified ,https://youtu.be/WIm2VAVmnfs,Data Centric,4000,15:23
876,Build AI Agents without Coding using Open Source Dify AI ,https://youtu.be/i-fM0jWN9ZU,AI Anytime,114 ,15:23
877,MELTing point - Mobile Evaluation of Language Transformers ,https://youtu.be/eFcHQ_6-qoI,Fahd Mirza,313 ,4:55
878,Llama-3 Spellbound Instruct Tuning-Free - Multi-Turn Story Roleplay - Install Locally ,https://youtu.be/9iWcip5oO8Q,Fahd Mirza,57 ,4:55
879,Ad Auctions for LLMs via Retrieval Augmented Generation ,https://youtu.be/9HhcFiSgLok,Arxiv Papers,4000,30:20
880,Build a Research Assistant AI Agent using Crew AI ,https://youtu.be/-eNfRtGqU4o,AI Anytime,220 ,30:20
881,The Shortcomings of RLHF for LLM Fine-Tuning ,https://youtu.be/GjNMvsGafmA,Super Data Science: ML &amp; AI Podcast with Jon Krohn,14000,6:09
882,NEW TextGrad ,https://youtu.be/ijCjKnbQgXc,Discover AI,388 ,6:09
883,Sorry We Don't Know How LLMs Work - Extracting Concepts from GPT-4 ,https://youtu.be/6HO4gVW5F7E,Fahd Mirza,1200,4:47
884,Shorter Sequence Lengths Using Matryoshka Models ,https://youtu.be/jHx4psu1C0k,Tunadorable,958 ,4:47
885,Generative AI Journeys - Fireside Chat with NinjaTech AI | Amazon Web Services ,https://youtu.be/QVIYDhN4nxg,Amazon Web Services,1700,47:04
886,Advanced RAG 04 - Reranking with Cross Encoders- and Cohere API ,https://youtu.be/3tndVt8W-Tk,Sunny Savita,786 ,47:04
887,Python Validate User Inputs in 20 Minutes ,https://youtu.be/Bs36gxpKcqk,Ryan &amp; Matt Data Science,20000,11:26
888,Building a Generative UI App With LangChain Python ,https://youtu.be/3WUobZryyok,LangChain,425 ,11:26
889,Amazon DynamoDB Well-Architected Lens - Security | Amazon Web Services ,https://youtu.be/swM4bQMW0EQ,Amazon Web Services,1200,8:16
890,AWS re:Inforce 2024 - Securely accelerating generative AI innovation (SEC203-INT) ,https://youtu.be/Yo-AzVpWrRg,AWS Events,77 ,8:16
891,The Challenge of Establishing AI Quality Standards // Cody Peterson // MLOps podcast #234 ,https://youtu.be/6yLmbL1o3Ow,MLOps.community,461 ,25:49
892,[LLM News] Apple Intelligence- Dream Machine- Self Teaching- AI Personality- Function Calling Course ,https://youtu.be/035I2WKj5F0,Elvis Saravia,136 ,25:49
893,An Image is Worth More Than 1616 Patches: Exploring Transformers on Individual Pixels ,https://youtu.be/wc3Lh-eiNBM,Arxiv Papers,133 ,35:15
894,Why Warmup the Learning Rate? Underlying Mechanisms and Improvements ,https://youtu.be/8KrTO9bS91s,Arxiv Papers,229 ,35:15
895,ADASYN oversampling algorithm explained ,https://youtu.be/QKNVPHm3G70,Data Science in your pocket,986 ,18:51
896,Traceability and Observability in Multi-Step LLM Systems | Langfuse | LLMOps ,https://youtu.be/3FC3h6zaceQ,LLMOps Space,1400,18:51
898,MoA BEATS GPT4o With Open-Source Models!! (With Code!) ,https://youtu.be/eHxxovdhktM,Matthew Berman,264 ,11:37
899,AWS re:Inforce 2024 - Generative AI to identify potential risks in architectural diagrams (ARC222) ,https://youtu.be/4qmHMN8cr0w,AWS Events,420 ,6:05
900,AWS re:Inforce 2024 - How to protect generative AI models using GenAI Secure (DAP322-S) ,https://youtu.be/f2g24bt_P6Q,AWS Events,114 ,6:05
901,AWS re:Inforce 2024 - Shielding innovation: Safeguarding cloud and AI development (SEC222-S) ,https://youtu.be/v4Wnvn6ivmM,AWS Events,526 ,1:21:53
902,How to Build Production-Ready AI Models for Manufacturing // [Exclusive] LatticeFlow Roundtable ,https://youtu.be/Qks4UEsRwl0,MLOps.community,406 ,1:21:53
903,No Lies Detected: how to make your AI more useful ,https://youtu.be/J-tg6D7lBEg,Microsoft Reactor,592 ,32:17
904,AWS re:Inforce 2024 - Building a secure MLOps pipeline- featuring PathAI (APS302) ,https://youtu.be/SXvpKLiqRxM,AWS Events,718 ,32:17
905,AWS re:Inforce 2024 - Secure your APIs the Well-Architected way from foundation to perimeter (NIS305 ,https://youtu.be/Tr5Y3NFM6hE,AWS Events,530 ,24:12
906,AWS re:Inforce 2024 - Keeping your code secure (APS401) ,https://youtu.be/ZFbaA9eM0uo,AWS Events,592 ,24:12
907,AWS re:Inforce 2024 - Outpacing threats w/ CrowdStrike- Anthropic Claude &amp; Amazon Bedrock (TDR202-S) ,https://youtu.be/Rg0c7wS7vSI,AWS Events,1300,14:13
908,Evaluate LLM Systems &amp; RAGs: Choose the Best LLM Using Automatic Metrics on Your Dataset ,https://youtu.be/d3uoLbfBPkw,Venelin Valkov,419 ,14:13
909,AWS re:Inforce 2024 - Simplify compliance and security investigations with generative AI (GRC204-NEW ,https://youtu.be/95prjv2EEXA,AWS Events,117 ,12:48
910,AWS re:Inforce 2024 - Preserving privacy on data collaboration with AWS Clean Rooms (COM221) ,https://youtu.be/S_4XflTsjZE,AWS Events,127 ,12:48
911,AWS re:Inforce 2024 - How AWS Partners use observability to strengthen customer security (CFS227) ,https://youtu.be/z3j8U1CUD0o,AWS Events,500 ,11:37
912,AWS re:Inforce 2024 - How organizations are actually applying AWS security best practices (COM224) ,https://youtu.be/YFXzKuyxwWY,AWS Events,559 ,11:37
913,AWS re:Inforce 2024 - Elevate your AWS security with CloudFastener- assisted ,https://youtu.be/WWsmxrnyLKc,AWS Events,603 ,53:20
914,AWS re:Inforce 2024 - Cybersecurity w/ PwC: Compliance- generative AI &amp; cost optimization (GRC226-S) ,https://youtu.be/Ph4-m0hFsvU,AWS Events,458 ,53:20
915,AWS re:Inforce 2024 - Use AWS WAF to help avoid cost-prohibitive traffic in LLM apps (NIS221) ,https://youtu.be/KG2C-KsiNyI,AWS Events,1100,12:20
916,AWS re:Inforce 2024 - Reinforce AI security: Protecting AI applications- models- and data (NIS202-S) ,https://youtu.be/vRFSVGaNaG4,AWS Events,500 ,12:20
917,AWS re:Inforce 2024 - How H2O.ai bridges runtime &amp; build time intelligence for security (NIS307-S) ,https://youtu.be/95Qwsi5cs78,AWS Events,1000,23:39
918,AWS re:Inforce 2024 - Building a secure end-to-end generative AI application in the cloud (NIS321) ,https://youtu.be/qxyjkfzD-kE,AWS Events,1300,23:39
919,AWS re:Inforce 2024 - Mitigate OWASP Top 10 for LLM risks with a Zero Trust approach (GAI323) ,https://youtu.be/XyNBA0KQ8eA,AWS Events,626 ,30:58
920,AWS re:Inforce 2024 - Protect your generative AI applications against jailbreaks (GAI321) ,https://youtu.be/X4RqkxjdiS0,AWS Events,1100,30:58
921,AWS re:Inforce 2024 - Safeguarding sensitive data used in generative AI with RAG (DAP223) ,https://youtu.be/5-LDbn9jdRM,AWS Events,935 ,1:01:04
922,OpenAI Prompt Engineering ,https://youtu.be/HWs2TXo1uaI,Microsoft Reactor,167 ,1:01:04
923,SAMBA: Simple Hybrid State Space Models for Efficient Unlimited Context Language Modeling ,https://youtu.be/fH0wTfdIlGg,Arxiv Papers,833 ,1:01:18
924,What If We Recaption Billions of Web Images with LLaMA-3? ,https://youtu.be/fH0wTfdIlGg,Arxiv Papers,1200,1:01:18
925,Advance RAG 05 - Merger Retriever and LongContextReorder | Lost in Middle Phenomenon ,https://youtu.be/LjCU4V2da3U,Sunny Savita,68 ,46:03
926,Tomek's Link Undersampling algorithm explained ,https://youtu.be/0IReZ4I5W54,Data Science in your pocket,19000,46:03
927,Mesop: Google's UI Framework for Building Web Application ,https://youtu.be/I8sZFvGhDIs,Prompt Engineering,87 ,45:18
928,Multiple-Stage Optimization Leads to Sub-Optimal LLMs ,https://youtu.be/tK762dthlLU,Super Data Science: ML &amp; AI Podcast with Jon Krohn,1500,45:18
929,How to Build Database AI Agents - Hands on Easy Tutorial ,https://youtu.be/H2DDISTgm7U,Fahd Mirza,4700,7:23
930,Learn How he reproduced Karpathy's GPT-2 for Audio!!! ,https://youtu.be/68IDtv2nQKo,1littlecoder,754 ,7:23
931,Monitoring Agents with AgentOps ,https://youtu.be/frQAA9DMQeM,AI Makerspace,2900,10:06
932,Hella Brand New AI Papers - June 15- 2024 ,https://youtu.be/M1ADv0xweZQ,Tunadorable,335 ,10:06
933,Build Local LLM Agentic Apps with LLMFlex ,https://youtu.be/4pgLHxphWTk,Fahd Mirza,298 ,35:21
934,Humans Vs AI Models on AGI Tests Using ARC-AGI - Try Now Locally ,https://youtu.be/oElg6YV4KWc,Fahd Mirza,66 ,35:21
935,Unpacking DPO and PPO: Disentangling Best Practices for Learning from Preference Feedback ,https://youtu.be/lkPUVwYLO1g,Arxiv Papers,140 ,14:43
936,An Empirical Study of Mamba-based Language Models ,https://youtu.be/aypyGPoKrr4,Arxiv Papers,7000,14:43
937,Mamba 2 - Transformers are SSMs: Generalized Models and Efficient Algorithms Through SSS Duality ,https://youtu.be/9RCq-vN3jzA,Gabriel Mongaras,1000,16:01
938,Husky - A Unified Open-Source Language Agent for Multi-Step Reasoning ,https://youtu.be/uoTwBF266IY,Fahd Mirza,27000,16:01
939,Vision Transformer Basics ,https://youtu.be/k1NaKVkB_wg,Samuel Albanie,2200,50:58
940,Mixture-of-Agents (MoA) Enhances Large Language Model Capabilities ,https://youtu.be/eOmgoNIC7a0,AI Papers Academy,1600,50:58
941,What is MatMul-free Language Modeling ,https://youtu.be/DAN86Oqe07A,Fahd Mirza,407 ,15:29
942,AWS re:Inforce 2024 - Securing generative AI: Privacy and compliance considerations (GAI222) ,https://youtu.be/eDr_F3JrS7E,AWS Events,431 ,15:29
943,AWS re:Inforce 2024 - Generative AI skills and culture for security organizations (GAI121) ,https://youtu.be/L1h2OdeDKfo,AWS Events,704 ,22:24
944,AWS re:Inforce 2024 - 5 ways generative AI can enhance cybersecurity (GAI324) ,https://youtu.be/WbfVI7Hu9Ls,AWS Events,8700,22:24
945,Function Calling with OpenAI APIs | A Crash Course ,https://youtu.be/Pxx_euJiA0U,Elvis Saravia,90 ,39:50
946,Beyond Model Collapse: Scaling Up with Synthesized Data Requires Reinforcement ,https://youtu.be/nRP-frj5FmI,Arxiv Papers,811 ,39:50
947,Thread: AI-Powered Jupyter Notebook - Install Locally ,https://youtu.be/fZ5tumMJSxE,Fahd Mirza,96 ,5:40
948,How RLHF Aligns LLMs with Human Desires ,https://youtu.be/IYpsbwJmN7c,Super Data Science: ML &amp; AI Podcast with Jon Krohn,196 ,5:40
949,Estimating the Hallucination Rate of Generative AI ,https://youtu.be/E-kisR5NRKs,Arxiv Papers,847 ,7:00
950,Atomic Agents - Building AI Agents Atomically ,https://youtu.be/Tkds301xtHI,Fahd Mirza,313 ,7:00
951,AWS re:Inforce 2024 - Build- deploy- and manage your applications securely with AWS (NIS225) ,https://youtu.be/Tkds301xtHI,AWS Events,227 ,14:02
952,AWS re:Inforce 2024 - Keeping people away from data: A generative AI use case (GAI326) ,https://youtu.be/sbz3w9nFV0E,AWS Events,325 ,14:02
953,AWS re:Inforce 2024 - Mind your business: Secure your generative AI application on AWS (GAI322) ,https://youtu.be/GjNf3Zvjofc,AWS Events,1700,10:40
954,Reinforcement Learning from Human Feedback (RLHF) &amp; Direct Preference Optimization (DPO) Explained ,https://youtu.be/5til6Xri8xI,Entry Point AI,239 ,10:40
955,AWS re:Inforce 2024 - Balancing responsible AI: Privacy and data protection on AWS (GAI223) ,https://youtu.be/1zVMCmyQ2nE,AWS Events,882 ,14:51
956,AWS re:Inforce 2024 - Accelerate securely: The Generative AI Security Scoping Matrix (APS201) ,https://youtu.be/Ipa0y4rNB4M,AWS Events,850 ,14:51
957,Logits and Loss: Training and Fine-Tuning LLMs ,https://youtu.be/WPcNHYWS344,AI Makerspace,344 ,1:15:44
958,AWS re:Inforce 2024 - How Deloitte helps navigate generative AI compliance for customers (GRC221) ,https://youtu.be/7w9Bp-SAEHQ,AWS Events,616 ,1:15:44
959,AWS re:Inforce 2024 - Accelerating auditing and compliance for generative AI on AWS (GRC302) ,https://youtu.be/EtnSexLgQMc,AWS Events,764 ,18:19
960,Import Custom Models Into Amazon Bedrock - AWS OnAir S5 ,https://youtu.be/brLTY26etxw,AWS Events,178 ,18:19
961,Streamline ML governance with Amazon DataZone and Amazon SageMaker | AWS OnAir-S05 ,https://youtu.be/vsqKGZT8Qn8,AWS Events,179 ,13:15
962,AWS re:Inforce 2024 - Diversity and accessibility in the age of generative AI (ABW101) ,https://youtu.be/Cf0Jidg-pDc,AWS Events,1000,13:15
963,AWS re:Inforce 2024 - The building blocks of a culture of security (SEC202-INT) ,https://youtu.be/ci-aYGFnz6c,AWS Events,240 ,58:16
964,Assessing security risk in AI model using Microsoft Counterfit ,https://youtu.be/brKi2Lf8-8c,Microsoft Reactor,197 ,58:16
965,AWS re:Inforce 2024 - Fine-tune the COE process with generative AI (ARC221) ,https://youtu.be/-CTA79oZk9s,AWS Events,311 ,36:27
966,AWS re:Inforce 2024 - Security- and AI... so happy together? (CFS222) ,https://youtu.be/t_77sBGIG6w,AWS Events,78 ,36:27
967,AI For Marketers #15 ,https://youtu.be/p0I-hwZSWMs,AI User Group,189 ,6:50
968,AWS re:Inforce 2024 - Protecting data in generative AI applications with Amazon Bedrock (COM223) ,https://youtu.be/eSld2AkT3iI,AWS Events,164 ,6:50
969,AWS re:Inforce 2024 - Manual versus automated penetration testing on AWS (COM225) ,https://youtu.be/lY42IoXwk_I,AWS Events,280 ,14:44
970,AWS re:Inforce 2024 - Developer’s security survival guide (COM321) ,https://youtu.be/jSYih32JPnA,AWS Events,469 ,14:44
971,AWS re:Inforce 2024 - Accelerating privacy &amp; security in AI with Amazon Bedrock and Tines (TDR324-S) ,https://youtu.be/qe186Xamhac,AWS Events,81 ,52:51
972,State Soup: In-Context Skill Learning- Retrieval and Mixing ,https://youtu.be/2rVIy5pT4Xo,Arxiv Papers,181 ,52:51
973,AWS re:Inforce 2024 - Securing AI models and using AI to maintain compliance (SEC321-S) ,https://youtu.be/KI4YxEM6iDM,AWS Events,204 ,46:16
974,Large Language Models Must Be Taught to Know What They Don't Know ,https://youtu.be/Zazp0kAQ7tA,Arxiv Papers,459 ,46:16
975,AWS re:Inforce 2024 - Elevating security investigations with generative AI (TDR329) ,https://youtu.be/ea36pxxh6zA,AWS Events,1200,7:48
976,The Secret Weapons Revolutionizing Customer Support: RAG + Knowledge Graphs ,https://youtu.be/nSrj1J6ODoM,TwoSetAI,1300,7:48
977,AWS re:Inforce 2024 - Build responsible AI applications with Guardrails for Amazon Bedrock (GRC325) ,https://youtu.be/AOi6uomSHY0,AWS Events,6600,6:00
978,A Machine Learning roadmap (the one I recommend to my students) ,https://youtu.be/G3YjjAbKZ-Y,Underfitted,634 ,6:00
979,791: Reinforcement Learning from Human Feedback (RLHF) — with Dr. Nathan Lambert ,https://youtu.be/iB8FWR9aD5Q,Super Data Science: ML &amp; AI Podcast with Jon Krohn,63 ,12:57
980,Distributional Preference Alignment of LLMs via Optimal Transport ,https://youtu.be/CC-CboRGaDo,Arxiv Papers,162 ,12:57
981,Attention as a Hypernetwork ,https://youtu.be/MKimX011yOo,Arxiv Papers,2500,8:14
982,Retrieval Heads Mechanistically Explain Long-Context Factuality ,https://youtu.be/CA2AXfWWdpA,Tunadorable,5400,8:14
983,Data Scientists Automated with AI!!! ,https://youtu.be/a4J6tHqyw7E,1littlecoder,1700,1:24:37
984,The A to Z of Prompt Engineering - Advanced Prompt Engineering Techniques ,https://youtu.be/tc92qoRFMPA,Microsoft Reactor,394 ,1:24:37
985,From Robotics to Recommender Systems // Miguel Fierro // MLOps Podcast #240 ,https://youtu.be/ga4kaACFlJg,MLOps.community,1000,13:36
986,Best Practices for GenAI applications on AWS - RAG pipeline Eval - Part 4 | Amazon Web Services ,https://youtu.be/T2usmMiISrs,Amazon Web Services,2400,13:36
987,How to Make your AI Application Highly Scalable? ,https://youtu.be/JzvKJ9ytz98,Mervin Praison,1600,6:48
988,Informer attention code -  FROM SCRATCH! ,https://youtu.be/88rS6ePHOpk,CodeEmporium,6000,6:48
989,RAG explained step-,https://youtu.be/8UAApfmrTQU,Discover AI,8500,13:50
990,Movie Recommender System in Python with LLMs ,https://youtu.be/TQ6Bz-Az0yI,NeuralNine,3000,13:50
991,My TOP TEN TIPS for Fine-tuning ,https://youtu.be/mYF1cFzxusE,Trelis Research,1800,13:07
992,The future of AI agents is WebAssembly (get started now) ,https://youtu.be/1tEV5INi5Lk,Chris Hay,61 ,13:07
993,Why Has Predicting Downstream Capabilities of Frontier AI Models with Scale Remained Elusive? ,https://youtu.be/E-YnoVBN5NM,Arxiv Papers,717 ,17:06
994,Mixture-of-Agents Enhances Large Language Model Capabilities ,https://youtu.be/7wF9RMGno28,Arxiv Papers,7700,17:06
995,GROKKED LLM beats RAG Reasoning (Part 3) ,https://youtu.be/pRKFsJqn0eQ,Discover AI,1000,16:42
996,[LLMS News] AGI Predictions- Mamba-2- NLLB- GPT-4 Features- Structured LLM Generation- KLING ,https://youtu.be/P-RHhkPtIGE,Elvis Saravia,33000,16:42
997,LangGraph Simplified: Master Custom AI Agent Creation ,https://youtu.be/RBhfwJZSBWM,Data Centric,1000,21:23
998,What is Grokking and Over-Fitting of an LLM ,https://youtu.be/a6VWF_DpWDU,Fahd Mirza,215 ,21:23
999,Alice in Wonderland: Simple Tasks Showing Complete Reasoning Breakdown in State-Of-the-Art LLMs ,https://youtu.be/DvvypUqdjXo,Arxiv Papers,91 ,26:06
1000,Improving Alignment and Robustness with Short Circuiting ,https://youtu.be/7zbyR_Hty1U,Arxiv Papers,37000,26:06
1001,I Found The Best Alternative To ChatGPT- Get The Power Of ALL LLM Models ,https://youtu.be/McaI5kkQySU,Krish Naik,2700,9:30
1002,Fine-Tune LLM in VS Code AI Toolkit Locally on Custom Dataset ,https://youtu.be/-UNY-u1zsCY,Fahd Mirza,548 ,9:30
1003,Autonomous Agents for Dummies | Groq and CrewAI ,https://youtu.be/eUOb3iS4nOM,AI With Tarun,461 ,35:41
1004,Uber's Michelangelo: Strategic AI Overhaul and Impact // MLOps podcast #239 ,https://youtu.be/dh_am72ykAQ,MLOps.community,1300,35:41
1005,New prompting method uses thought templates | Buffer of Thoughts ,https://youtu.be/V3fhgpgLuJg,Elvis Saravia,89 ,26:06
1006,Cloud Native Artificial Intelligence ,https://youtu.be/SyO8c0fM6ZU,AI User Group,1600,26:06
1007,Multi-Agent Crews with CrewAI ,https://youtu.be/wEmO00ADppw,AI Makerspace,81 ,5:35
1008,Block Transformer: Global-to-Local Language Modeling for Fast Inference ,https://youtu.be/gNY06JM6m8U,Arxiv Papers,300 ,5:35
1009,Buffer of Thoughts: Thought-Augmented Reasoning with Large Language Models ,https://youtu.be/6rWtZGF5LS8,Arxiv Papers,3800,8:02
1010,DSPy: Advanced Prompt Engineering? ,https://youtu.be/B0phjAyaY3Q,AI Makerspace,7000,8:02
1011,Gemini Flash is SURPRISINGLY Good for Agents and Function Calling ,https://youtu.be/coBTzvQsPpQ,Prompt Engineering,18000,9:30
1012,Why are vector databases so FAST? ,https://youtu.be/epidA1fBFtI,Underfitted,26000,9:30
1013,Building open source LLM agents with Llama 3 ,https://youtu.be/lJDxkjE9SSY,LangChain,1400,13:35
1014,Getting started with MLOps on Amazon SageMaker for generative AI | Amazon Web Services ,https://youtu.be/KwF_ZB29ZB0,Amazon Web Services,2800,13:35
1015,Advanced RAG 03 - Reranking with Sentence Transformers and BM25 API ,https://youtu.be/t-vnrD8o6TA,Sunny Savita,283 ,58:30
1016,GenAI for SW developers - V.2! 2# Dr. GPT: Grounding LLMs in Healthcare ,https://youtu.be/Tjx_kd5db34,Microsoft Reactor,1700,58:30
1017,OpenAGI - Autonomous Human Like Agents ,https://youtu.be/HE4ykZATuIw,Fahd Mirza,1000,42:35
1018,HippoRAG - Neurobiologically Inspired Memory for LLMs ,https://youtu.be/iheqPgJmX6M,Fahd Mirza,3200,42:35
1019,Amazon SageMaker overview | Amazon Web Services ,https://youtu.be/R-o_a6dvzQM,Amazon Web Services,91 ,6:29
1020,Verbalized Machine Learning: Revisiting Machine Learning with Language Models ,https://youtu.be/OAQfMoK6AV0,Arxiv Papers,341 ,6:29
1021,VectorDB Recipes: Stay up-to-date with GenAI in one place | I'm Accepting contributions on this repo ,https://youtu.be/Fy2V6ZmXK0s,Ayush Chaurasia,37 ,1:14:14
1022,The Brain's Bitter Lesson: Scaling Speech Decoding With Self-Supervised Learning ,https://youtu.be/Sr1NIeSIiNw,Arxiv Papers,15000,1:14:14
1023,RAG in 2024: Advancing to Agents ,https://youtu.be/PYvAfKNGVlg,LlamaIndex,133 ,16:11
1024,Interpretable AI in Medicine | Multimodal Foundation Models in Oncology | Mauricio Reyes ,https://youtu.be/b23mQEHVf5U,Applied Machine Learning Days,61 ,16:11
1025,Climbing the Quality Hill | Multimodal Foundation Models in Oncology | Fabian Roth ,https://youtu.be/IhawEdplzkI,Applied Machine Learning Days,70 ,47:42
1026,Training Large-Scale Medical FMs | Multimodal Foundation Models in Oncology | E. De Jong &amp; V. Botha ,https://youtu.be/GSrPRxSwcvg,Applied Machine Learning Days,17000,47:42
1027,LLM - Reasoning SOLVED (new research) ,https://youtu.be/gCGck5Fn3G4,Discover AI,57 ,21:12
1028,How Truncating Weights Improves Reasoning in Language Models ,https://youtu.be/us7nTT5hC6U,Arxiv Papers,67 ,21:12
1029,Choice of PEFT Technique in Continual Learning: Prompt Tuning is Not All You Need ,https://youtu.be/8tS_84-5Hmo,Arxiv Papers,80 ,8:20
1030,Learning to grok: Emergence of in-context learning and skill in modular arithmetic tasks ,https://youtu.be/GFxQb8lKQS4,Arxiv Papers,291 ,8:20
1031,To Believe or Not to Believe Your LLM ,https://youtu.be/rPQIYLvPszY,Arxiv Papers,1700,18:23
1032,MLSys'24 Best Paper - AWQ: Activation-aware Weight Quantization for LLM Compression and Acceleration ,https://youtu.be/6YtdtjQD1r0,MIT HAN Lab,59 ,18:23
1033,Does your data spark joy? Performance gains from domain upsampling at the end of training ,https://youtu.be/A20wzlC7Q-c,Arxiv Papers,3100,24:59
1034,Bye Bye Privacy!!! ,https://youtu.be/cpLi-82koFM,1littlecoder,4800,24:59
1035,How to MAKE AI Agents MORE SUCCESSFUL!!! ,https://youtu.be/j2OAeeujQ9M,1littlecoder,15000,25:51
1036,New Discovery: LLMs have a Performance Phase ,https://youtu.be/EjiYnHkmn1I,Discover AI,62 ,25:51
1037,Production-Ready Strategies For Achieving Precision With Midjourney ,https://youtu.be/V58mPkLB95o,AI User Group,98 ,8:26
1038,Show- Don't Tell: Aligning Language Models with Demonstrated Feedback ,https://youtu.be/VHCDtkjocl8,Arxiv Papers,2700,8:26
1039,AI Agents with LangChain- CrewAI and Llama 3: Build an AI Tweet Writing App | Step-,https://youtu.be/rJn-Ti03AjA,Venelin Valkov,1800,59:05
1040,Enhancing search on AWS with AI- RAG- and vector databases (L300) | AWS Events ,https://youtu.be/o8_LApdDvYE,AWS Events,382 ,59:05
1041,How Sonrai Analytics leverages ML to accelerate Precision Medicine (L300) | AWS Events ,https://youtu.be/mzkHGEyAPEw,AWS Events,651 ,18:44
1042,Has prompt engineering been solved? ,https://youtu.be/dU6eiWjJfSw,Elvis Saravia,396 ,18:44
1043,AWS Trainium and Inferentia // Kamran Khan and Matthew McClean // MLOps Podcast #238 ,https://youtu.be/2Z9rbnhF8yQ,MLOps.community,216 ,2:15:23
1044,MMLU-Pro : A New LLM Benchmark ,https://youtu.be/OyrXZdAOM54,Fahd Mirza,2100,2:15:23
1045,LLAMA 3 or Phi 3 AI Agent: Can they Beat Perplexity in Web Search? ,https://youtu.be/MXPYbjjyHXc,Data Centric,87 ,1:06:41
1046,How to handle Class Imbalance in ML problems? ,https://youtu.be/zwrRQEGM76o,Data Science in your pocket,1300,1:06:41
1047,CoPE - Contextual Position Encoding: Learning to Count What's Important ,https://youtu.be/bKIGLgblRwg,Gabriel Mongaras,76 ,3:44
1048,What makes unlearning hard and what to do about it ,https://youtu.be/4lx4As_e_l0,Arxiv Papers,965 ,3:44
1049,Deep Dive into Large Language Models : From RNN to RLHF ,https://youtu.be/Z1bXBinTtnQ,Aritra Sen,18000,11:40
1050,Basics And Foundation Is Important For Any Data Science or GENAI Roles-Start From Basics ,https://youtu.be/ielZJwDfZL4,Krish Naik,135 ,11:40
1051,Graph Neural Networks | Scientific Machine Learning for Science and Engineering | Vinay Sharma ,https://youtu.be/CqsDFb3ScOc,Applied Machine Learning Days,462 ,18:16
1052,Python Regular Expressions Explained in 1 Hour ,https://youtu.be/fv8sgcn3VxM,Ryan &amp; Matt Data Science,2500,18:16
1053,Best Practices for GenAI applications on AWS - RAG pipeline Eval - Part 3 | Amazon Web Services ,https://youtu.be/JlRhytfQlUg,Amazon Web Services,196 ,8:26
1054,How To Implement SetFit For Few-Shot Fine-Tuning of Sentence Transformers ,https://youtu.be/dcINVsqxQgQ,Fahd Mirza,841 ,8:26
1055,The Communication Platform of the Future ,https://youtu.be/DsAN_a01ptU,Tunadorable,109 ,11:04
1056,Perplexed ,https://youtu.be/he-fOrSkKek,Arxiv Papers,2800,11:04
1057,Informer attention Architecture - FROM SCRATCH! ,https://youtu.be/5qetCIOBKAI,CodeEmporium,5700,15:32
1058,NVIDIA NIM: Easily Deploy and Integrate Generative AI Models In App ,https://youtu.be/QgOeWbW0jeA,Mervin Praison,48 ,15:32
1059,A Few How-To Gems for Building a Thriving Community from Scratch ,https://youtu.be/KxiKlb5_Hmc,Super Data Science: ML &amp; AI Podcast with Jon Krohn,836 ,19:35
