,title,link,channel,views,length
1290,Advantage Alignment Algorithms ,https://youtu.be/kJkRPIcX3To,Arxiv Papers,63 ,7:23
1291,Evaluating Numerical Reasoning in Text-to-Image Models ,https://youtu.be/b_l5aeLLxSE,Arxiv Papers,8100,13:39
1292,Build an Agentic RAG using Crew AI ,https://youtu.be/zsSQicZp_8o,AI Anytime,1000,13:39
1293,Deep Dive into Hybrid search techniques in RAG: BM25- MMR- Reciprocal Ranking- Metadata filtering ,https://youtu.be/mXNrhyw4q84,Aritra Sen,10000,26:52
1294,SQL AI Agents: Analyze Relational Databases with Natural Language using Llama 3 (LLM) and CrewAI ,https://youtu.be/3gCTa0Li4ew,Venelin Valkov,4400,26:52
1295,Generative Models Can Outperform The Experts That Train Them ,https://youtu.be/no7EQkOiHQM,Tunadorable,235 ,12:57
1296,Self-MoE : Compositional LLMs with Self-Specialized Experts ,https://youtu.be/wGzuTa7fGAk,Fahd Mirza,1400,12:57
1297,R2R with Ollama - RAG to Riches - Create Local RAG Pipelines ,https://youtu.be/8BV9TW490nQ,Fahd Mirza,1600,34:36
1298,BLEU Score for LLM Evaluation explained ,https://youtu.be/8BV9TW490nQ,Data Science in your pocket,325 ,34:36
1299,Hardcore Bayesian Stats: Post-Stratification + Hierarchical Modeling ,https://youtu.be/qZ0azEsxlAc,Super Data Science: ML &amp; AI Podcast with Jon Krohn,2000,8:02
1300,5 Prompts to Increase Your Productivity ,https://youtu.be/wqJKWkq6y0Y,Mervin Praison,10000,8:02
1301,Future of DataFrames and Data Systems with Wes McKinney (creator of pandas and Apache Arrow) ,https://youtu.be/wQJBuA3Hm30,MLOps Learners,2000,1:03:42
1302,Build Multi-agent AI system for Investment Risk Analysis 🔍 ,https://youtu.be/EzBQP1IUUSA,AI Anytime,15000,1:03:42
1303,Deliver high-performance ML models faster with MLOps tools ,https://youtu.be/Sb94A5ETiHM,AWS Developers,26000,9:49
1304,Why the world NEEDS Kolmogorov Arnold Networks ,https://youtu.be/obwEdk-uBb0,ThatMathThing,471 ,9:49
1305,Decoding: From Logits to the Next Token ,https://youtu.be/CWGPWvCeK3E,AI Makerspace,1500,5:18
1306,Implement the Target Network | DQN PyTorch Beginners Tutorial #5 ,https://youtu.be/DtzIIVJq8wA,Johnny Code,122 ,5:18
1307,Refusal in Language Models Is Mediated ,https://youtu.be/JE6E86RlVQ4,Arxiv Papers,644 ,1:04:50
1308,Transcendence: Generative Models Can Outperform The Experts That Train Them ,https://youtu.be/blYpzQdzWlU,Arxiv Papers,1000,1:04:50
1309,ROUGE score for LLM Evaluation explained ,https://youtu.be/PJ7ZjTBUvZ8,Data Science in your pocket,73000,31:56
1310,Andrew Ng On AI Agentic Workflows And Their Potential For Driving AI Progress ,https://youtu.be/JMZyHr31IsY,Snowflake Developers,876 ,31:56
1311,Model CI/CD for Enterprise-Grade Production ML ,https://youtu.be/YYXcDcjoN_o,Weights &amp; Biases,67000,11:11
1312,Building a Machine Learning Pipeline with Kubeflow | Full Walk-through ,https://youtu.be/k998jyAhFkk,Technology with Flo,325 ,11:11
1313,TokenCost - Easy Token Counting and LLM Cost Estimation for AI Apps ,https://youtu.be/s0rYxfk8DW0,Fahd Mirza,2600,1:10:15
1314,Build RAG-Powered AI Agents on Custom Data in Google Colab ,https://youtu.be/cXWuSWX0Va0,Fahd Mirza,1900,1:10:15
1315,Advance RAG 08-  Powerful RAG with Langchain Contextual Compression Retriever #ai #llm #openai ,https://youtu.be/MPCiNA8BqO8,Sunny Savita,133 ,10:24
1316,Can Long-Context Language Models Subsume Retrieval- RAG- SQL- and More? ,https://youtu.be/DHiaS0gU7uo,Arxiv Papers,91 ,10:24
1317,Instruction Pre-Training: Language Models are Supervised Multitask Learners ,https://youtu.be/Kvxaj6pHeVA,Arxiv Papers,6900,1:13:47
1318,Learn how to build an agent from scratch with LangGraph ,https://youtu.be/kYTEFes5kUk,DeepLearningAI,8500,1:13:47
1319,Direct Preference Optimization (DPO) - How to fine-tune LLMs directly without reinforcement learning ,https://youtu.be/kLZA8v_mtoA,Serrano.Academy,99 ,8:16
1320,Essential Documentation Elements for Startups // Dave Nunez // MLOps Podcast #235 clip ,https://youtu.be/sK7yqqrK2fE,MLOps.community,404 ,8:16
1321,AI Torrent for Models - Download AI Models on the fly ,https://youtu.be/xw-F6Nk-KdE,Fahd Mirza,1800,43:42
1322,PlanRAG - Install Locally - LLMs as Decision Makers - Plan and RAG on Custom Data ,https://youtu.be/y4St6yMb2xk,Fahd Mirza,210 ,43:42
1323,Consistency Models Made Easy ,https://youtu.be/du6FE23-vUg,Arxiv Papers,101 ,24:55
1324,RL on Incorrect Synthetic Data Scales the Efficiency of LLM Math Reasoning ,https://youtu.be/eKXt64Oc9lg,Arxiv Papers,1400,24:55
1325,Fine-Tuning LLMs- Hugging Face &amp; Open Source with Lewis Tunstall #49 ,https://youtu.be/9H__JJMicK8,AI Stories Podcast - Neil Leiser,1200,8:05
1326,LLM Evaluation metrics explained with maths and examples ,https://youtu.be/7QUllHPgtys,Data Science in your pocket,2000,8:05
1327,Understanding Reciprocal Rank Fusion in Hybrid Search [Advanced RAG] ,https://youtu.be/GtyiAd55XN0,TechViz - The Data Science Guy,2400,57:42
1328,New course with Nexusflow: Function-Calling and Data Extraction with LLMs ,https://youtu.be/9bzGSCld8JI,DeepLearningAI,5200,57:42
1329,Local Tool Calling with llamacpp ,https://youtu.be/pGtPzOpSPSg,LangChain,141 ,7:14
1330,The Role of Knowledge Graphs in Enhancing AI Determinism // Tom Smoker // MLOps podcast #236 clip ,https://youtu.be/gMUo_kUxPMg,MLOps.community,14000,7:14
1331,Improving LLM accuracy with Monte Carlo Tree Search ,https://youtu.be/HAcpyiGk_c8,Trelis Research,31000,26:34
1332,Accelerated Training ,https://youtu.be/2SXcfZiUFDo,Tunadorable,98 ,26:34
1333,What Are the Odds? Language Models Are Capable of Probabilistic Reasoning ,https://youtu.be/4QgnU2OvrjU,Arxiv Papers,165 ,11:56
1334,Fresh Data- Smart Retrieval: Milvus &amp; Jina CLIP Explained // MLOps Mini Summit #7 ,https://youtu.be/HqluB-zHTyQ,MLOps.community,4700,11:56
1335,Stanford Seminar - How Can Privacy Exist in a Data-Driven World? ,https://youtu.be/BU5UkEDrqv0,Stanford Online,1000,8:17
1336,R2R (Rag to Riches) - Build Flexible RAG Pipelines ,https://youtu.be/vY3QfLCK7ms,Fahd Mirza,7200,8:17
1337,KL Divergence - How to tell how different two distributions are ,https://youtu.be/gbWT-JP_NSo,Serrano.Academy,23000,59:53
1338,RAG from Scratch without any Frameworks ,https://youtu.be/T9llSCYJXxc,Prompt Engineering,1600,59:53
1339,793: Bayesian Methods and Applications — with Alexandre Andorra ,https://youtu.be/vzUkThsQa9E,Super Data Science: ML &amp; AI Podcast with Jon Krohn,77 ,17:12
1340,Measuring memorization in RLHF for code completion ,https://youtu.be/lslT90W6wko,Arxiv Papers,318 ,17:12
1341,Autoregressive Image Generation without Vector Quantization ,https://youtu.be/vYRpJo-KMSw,Arxiv Papers,1900,21:40
1342,Advance RAG 06- RAG Fusion (Get More Relevant Results for Your RAG) | Reranking With RRF ,https://youtu.be/t_1t3_nuhCA,Sunny Savita,31 ,21:40
1343,Shaping your innovation in the context of Generative AI | AI-Powered Projects | Robert van Kommer ,https://youtu.be/SO9khpfgjxE,Applied Machine Learning Days,6500,1:55:38
1344,5 Types of AI Company - Explained!! ,https://youtu.be/B9_teF7LaVk,1littlecoder,9000,1:55:38
1345,The Evolution of Infrastructure from Code • Adam Keller- Elad Ben-Israel &amp; Eric Johnson • GOTO 2024 ,https://youtu.be/q1XFm21I-VQ,GOTO Conferences,70 ,47:08
1346,The solution to Fairness- Accountability and Trustworthiness&nbsp;? | Clinical AI | Enea Parimbelli ,https://youtu.be/RGLh4IdaOT4,Applied Machine Learning Days,41 ,47:08
1347,Machine learning at the service of the weary warrior | Clinical AI | Sylvain Meylan ,https://youtu.be/6wWdNg0GMV4,Applied Machine Learning Days,1100,1:21:38
1348,Better Than GPT-4o with Mixture of Agents ( MoA ) ! ,https://youtu.be/pbedN7hmrZY,MG,4300,1:21:38
1349,Text-to-GRAPH w/ LGGM: Generative Graph Models ,https://youtu.be/CHg8TmuM0ws,Discover AI,1400,1:01:12
1350,Best open LLM for code and math? ,https://youtu.be/-5MrVN1j7HM,Elvis Saravia,851 ,1:01:12
1351,Melody Agents - AI Agents to Create Songs Using Suno and CrewAI Locally ,https://youtu.be/YDG7MN2Pvs0,Fahd Mirza,15000,10:44
1352,LlamaIndex Webinar: Advanced RAG with Knowledge Graphs (with Tomaz from Neo4j) ,https://youtu.be/mhvDLY-NG9o,LlamaIndex,2900,10:44
1353,Implement the Deep Q-Network Module | DQN PyTorch Beginners Tutorial #2 ,https://youtu.be/Lj9npd7u1Ms,Johnny Code,272 ,1:28:15
1354,Navigating the AI Frontier // Boris Selitser // MLOps Podcast #241 ,https://youtu.be/k2pD3k1485A,MLOps.community,6800,1:28:15
1355,have benchmarks been the problem the whole time?!? ,https://youtu.be/MW51nSKJ4N4,Tunadorable,13000,10:39
1356,Praison AI UI: Automatically Create AI Agents for Work Automation ,https://youtu.be/oixcf0euy-w,Mervin Praison,71 ,10:39
1357,Adversarial Attacks on Multimodal Agents ,https://youtu.be/9HZ00HUwRfk,Arxiv Papers,186 ,14:39
1358,LLM Alignment for Promoting Sustainability | Accelerating Climate Change Action | Cesar Ilharco ,https://youtu.be/VJcycDW6LwY,Applied Machine Learning Days,4000,14:39
1359,SambaNova: Groq Got Competition ,https://youtu.be/NgOFQYliodo,Prompt Engineering,85 ,46:36
1360,SMEs and fast-prototyping AI services | Accelerating the Adoption of AI | Sébastien Rumley ,https://youtu.be/a_3ntWosRs4,Applied Machine Learning Days,145 ,46:36
1361,The AI Field Moves Fast. Here's How to Stay Sane. ,https://youtu.be/Vb-ua--mzRk,Super Data Science: ML &amp; AI Podcast with Jon Krohn,3000,32:57
1362,LangGraph: Hierarchical Agents - How to build Boss &amp; Subordinate Agents ,https://youtu.be/6dDvfGrxFns,Coding Crash Courses,102 ,32:57
1363,Bootstrapping Language Models with DPO Implicit Rewards ,https://youtu.be/4CzCDNPDTBA,Arxiv Papers,4800,50:51
1364,Supercharging RAG with Generative Feedback Loops from Weaviate ,https://youtu.be/rsDlu-9UP00,AI Coffee Break with Letitia,652 ,50:51
1365,From RLHF with PPO/DPO to ORPO + How to build ORPO on Trainium/Neuron SDK ,https://youtu.be/K7g1ZkNyNbg,Generative AI on AWS,1000,14:06
1366,Avoiding rolling hot keys with Amazon DynamoDB - Amazon DynamoDB Nuggets | Amazon Web Services ,https://youtu.be/mfAV_bigdRA,Amazon Web Services,478 ,14:06
1367,AWS re:Inforce 2024 - Gen AI–powered Lambda code remediation using Amazon Inspector (APS322) ,https://youtu.be/__xQw60y200,AWS Events,1100,42:39
1368,AWS re:Inforce 2024 - Navigating privacy and compliance while securing gen AI applications (GAI201) ,https://youtu.be/Q3rVw_HaDD0,AWS Events,9600,42:39
1369,MoME Reduces LLM Hallucinations ,https://youtu.be/zuEGqDe7xrc,Elvis Saravia,17000,53:15
1370,Building Multi-Modal Search with Vector Databases ,https://youtu.be/3F4YI9CpYeQ,DeepLearningAI,2500,53:15
1371,Indexing in Vector Databases ,https://youtu.be/AuQ2vyrG6M4,Fahd Mirza,20000,1:02:00
1372,How to Choose a Vector Database ,https://youtu.be/sjgZxuCm_8Q,Pinecone,7500,1:02:00
1373,Vector Database 101: A Crash Course ,https://youtu.be/bmduzd1oY7U,Zilliz,21000,45:52
1374,Understanding How Vector Databases Work! ,https://youtu.be/xHZn7AT1qK8,The ML Tech Lead!,26000,45:52
1375,What is a vector database? Why are they critical infrastructure for #ai #applications? ,https://youtu.be/ftFTh0pLxKE,Pinecone,36000,55:17
1376,Complete Tutorial on Vector Database - Learn ChromaDB- Pinecone &amp; Weaviate | Generative AI ,https://youtu.be/M108PKD_xeY,DSwithBappy,28000,55:17
1377,Building AI Agents from Scratch- Simplified ,https://youtu.be/LjLB3FbvZAk,Data Centric,4900,49:34
1378,Build AI Agents without Coding using Open Source Dify AI ,https://youtu.be/_XbWxeD6Z7M,AI Anytime,118 ,49:34
1379,MELTing point - Mobile Evaluation of Language Transformers ,https://youtu.be/0AfQXFj9m7Y,Fahd Mirza,333 ,22:43
1380,Llama-3 Spellbound Instruct Tuning-Free - Multi-Turn Story Roleplay - Install Locally ,https://youtu.be/AT8PCGeA4mI,Fahd Mirza,75 ,22:43
1381,Ad Auctions for LLMs via Retrieval Augmented Generation ,https://youtu.be/4Ebe9JRWmpw,Arxiv Papers,5000,29:54
1382,Build a Research Assistant AI Agent using Crew AI ,https://youtu.be/B-pqcx8S4FU,AI Anytime,235 ,29:54
1383,The Shortcomings of RLHF for LLM Fine-Tuning ,https://youtu.be/U4wTl_VsvsQ,Super Data Science: ML &amp; AI Podcast with Jon Krohn,16000,32:02
1384,NEW TextGrad ,https://youtu.be/38ACfUhv6Tc,Discover AI,392 ,32:02
1385,Sorry We Don't Know How LLMs Work - Extracting Concepts from GPT-4 ,https://youtu.be/0Xp7K2rHcZg,Fahd Mirza,1200,9:39
1386,Shorter Sequence Lengths Using Matryoshka Models ,https://youtu.be/pyolU3Sk05w,Tunadorable,1000,9:39
1387,Generative AI Journeys - Fireside Chat with NinjaTech AI | Amazon Web Services ,https://youtu.be/LDh5MdR-CPQ,Amazon Web Services,2600,10:30
1388,Advanced RAG 04 - Reranking with Cross Encoders- and Cohere API ,https://youtu.be/RVMpm86equc,Sunny Savita,1200,10:30
1389,Python Validate User Inputs in 20 Minutes ,https://youtu.be/YOClk49Cy2o,Ryan &amp; Matt Data Science,24000,20:45
1390,Building a Generative UI App With LangChain Python ,https://youtu.be/nGNdlPOWHHc,LangChain,443 ,20:45
1391,Amazon DynamoDB Well-Architected Lens - Security | Amazon Web Services ,https://youtu.be/tg-ZjNl3OCg,Amazon Web Services,1400,10:06
1392,AWS re:Inforce 2024 - Securely accelerating generative AI innovation (SEC203-INT) ,https://youtu.be/T3tonLXqoy8,AWS Events,80 ,10:06
1393,The Challenge of Establishing AI Quality Standards // Cody Peterson // MLOps podcast #234 ,https://youtu.be/WIm2VAVmnfs,MLOps.community,472 ,16:11
1394,[LLM News] Apple Intelligence- Dream Machine- Self Teaching- AI Personality- Function Calling Course ,https://youtu.be/i-fM0jWN9ZU,Elvis Saravia,155 ,16:11
1395,An Image is Worth More Than 1616 Patches: Exploring Transformers on Individual Pixels ,https://youtu.be/eFcHQ_6-qoI,Arxiv Papers,153 ,28:57
1396,Why Warmup the Learning Rate? Underlying Mechanisms and Improvements ,https://youtu.be/9iWcip5oO8Q,Arxiv Papers,466 ,28:57
1397,ADASYN oversampling algorithm explained ,https://youtu.be/9HhcFiSgLok,Data Science in your pocket,1500,25:45
1398,Traceability and Observability in Multi-Step LLM Systems | Langfuse | LLMOps ,https://youtu.be/GjNMvsGafmA,LLMOps Space,57000,25:45
1399,MoA BEATS GPT4o With Open-Source Models!! (With Code!) ,https://youtu.be/ijCjKnbQgXc,Matthew Berman,307 ,17:35
1400,AWS re:Inforce 2024 - Generative AI to identify potential risks in architectural diagrams (ARC222) ,https://youtu.be/6HO4gVW5F7E,AWS Events,570 ,17:35
1401,AWS re:Inforce 2024 - How to protect generative AI models using GenAI Secure (DAP322-S) ,https://youtu.be/jHx4psu1C0k,AWS Events,139 ,29:58
1402,AWS re:Inforce 2024 - Shielding innovation: Safeguarding cloud and AI development (SEC222-S) ,https://youtu.be/QVIYDhN4nxg,AWS Events,616 ,29:58
1403,How to Build Production-Ready AI Models for Manufacturing // [Exclusive] LatticeFlow Roundtable ,https://youtu.be/3tndVt8W-Tk,MLOps.community,430 ,28:30
1404,No Lies Detected: how to make your AI more useful ,https://youtu.be/Bs36gxpKcqk,Microsoft Reactor,807 ,28:30
1405,AWS re:Inforce 2024 - Building a secure MLOps pipeline- featuring PathAI (APS302) ,https://youtu.be/3WUobZryyok,AWS Events,855 ,28:09
1406,AWS re:Inforce 2024 - Secure your APIs the Well-Architected way from foundation to perimeter (NIS305 ,https://youtu.be/swM4bQMW0EQ,AWS Events,613 ,28:09
1407,AWS re:Inforce 2024 - Keeping your code secure (APS401) ,https://youtu.be/Yo-AzVpWrRg,AWS Events,716 ,29:40
1408,AWS re:Inforce 2024 - Outpacing threats w/ CrowdStrike- Anthropic Claude &amp; Amazon Bedrock (TDR202-S) ,https://youtu.be/6yLmbL1o3Ow,AWS Events,1600,29:40
1409,Evaluate LLM Systems &amp; RAGs: Choose the Best LLM Using Automatic Metrics on Your Dataset ,https://youtu.be/035I2WKj5F0,Venelin Valkov,494 ,1:28:30
1410,AWS re:Inforce 2024 - Simplify compliance and security investigations with generative AI (GRC204-NEW ,https://youtu.be/wc3Lh-eiNBM,AWS Events,149 ,1:28:30
1411,AWS re:Inforce 2024 - Preserving privacy on data collaboration with AWS Clean Rooms (COM221) ,https://youtu.be/8KrTO9bS91s,AWS Events,169 ,1:22:15
1412,AWS re:Inforce 2024 - How AWS Partners use observability to strengthen customer security (CFS227) ,https://youtu.be/QKNVPHm3G70,AWS Events,618 ,1:22:15
1413,AWS re:Inforce 2024 - How organizations are actually applying AWS security best practices (COM224) ,https://youtu.be/3FC3h6zaceQ,AWS Events,667 ,46:21
1414,AWS re:Inforce 2024 - Elevate your AWS security with CloudFastener- assisted ,https://youtu.be/N0sCGXSs-RA,AWS Events,767 ,46:21
1415,AWS re:Inforce 2024 - Cybersecurity w/ PwC: Compliance- generative AI &amp; cost optimization (GRC226-S) ,https://youtu.be/eHxxovdhktM,AWS Events,607 ,1:29:40
1416,AWS re:Inforce 2024 - Use AWS WAF to help avoid cost-prohibitive traffic in LLM apps (NIS221) ,https://youtu.be/4qmHMN8cr0w,AWS Events,1500,1:29:40
1417,AWS re:Inforce 2024 - Reinforce AI security: Protecting AI applications- models- and data (NIS202-S) ,https://youtu.be/f2g24bt_P6Q,AWS Events,679 ,1:30:16
1418,AWS re:Inforce 2024 - How H2O.ai bridges runtime &amp; build time intelligence for security (NIS307-S) ,https://youtu.be/v4Wnvn6ivmM,AWS Events,1300,1:30:16
1419,AWS re:Inforce 2024 - Building a secure end-to-end generative AI application in the cloud (NIS321) ,https://youtu.be/Qks4UEsRwl0,AWS Events,1900,1:23:26
1420,AWS re:Inforce 2024 - Mitigate OWASP Top 10 for LLM risks with a Zero Trust approach (GAI323) ,https://youtu.be/J-tg6D7lBEg,AWS Events,743 ,1:23:26
1421,AWS re:Inforce 2024 - Protect your generative AI applications against jailbreaks (GAI321) ,https://youtu.be/SXvpKLiqRxM,AWS Events,1300,57:36
1422,AWS re:Inforce 2024 - Safeguarding sensitive data used in generative AI with RAG (DAP223) ,https://youtu.be/Tr5Y3NFM6hE,AWS Events,1200,57:36
1423,OpenAI Prompt Engineering ,https://youtu.be/ZFbaA9eM0uo,Microsoft Reactor,193 ,39:34
1424,SAMBA: Simple Hybrid State Space Models for Efficient Unlimited Context Language Modeling ,https://youtu.be/Rg0c7wS7vSI,Arxiv Papers,835 ,39:34
1425,What If We Recaption Billions of Web Images with LLaMA-3? ,https://youtu.be/d3uoLbfBPkw,Arxiv Papers,1800,44:06
1426,Advance RAG 05 - Merger Retriever and LongContextReorder | Lost in Middle Phenomenon ,https://youtu.be/95prjv2EEXA,Sunny Savita,103 ,44:06
1427,Tomek's Link Undersampling algorithm explained ,https://youtu.be/S_4XflTsjZE,Data Science in your pocket,20000,26:54
1428,Mesop: Google's UI Framework for Building Web Application ,https://youtu.be/z3j8U1CUD0o,Prompt Engineering,87 ,26:54
1429,Multiple-Stage Optimization Leads to Sub-Optimal LLMs ,https://youtu.be/YFXzKuyxwWY,Super Data Science: ML &amp; AI Podcast with Jon Krohn,2000,14:16
1430,How to Build Database AI Agents - Hands on Easy Tutorial ,https://youtu.be/WWsmxrnyLKc,Fahd Mirza,4800,14:16
1431,Learn How he reproduced Karpathy's GPT-2 for Audio!!! ,https://youtu.be/Ph4-m0hFsvU,1littlecoder,810 ,13:48
1432,Monitoring Agents with AgentOps ,https://youtu.be/KG2C-KsiNyI,AI Makerspace,2900,13:48
1433,Hella Brand New AI Papers - June 15- 2024 ,https://youtu.be/vRFSVGaNaG4,Tunadorable,360 ,56:52
1434,Build Local LLM Agentic Apps with LLMFlex ,https://youtu.be/qxyjkfzD-kE,Fahd Mirza,380 ,56:52
1435,Humans Vs AI Models on AGI Tests Using ARC-AGI - Try Now Locally ,https://youtu.be/XyNBA0KQ8eA,Fahd Mirza,97 ,30:46
1436,Unpacking DPO and PPO: Disentangling Best Practices for Learning from Preference Feedback ,https://youtu.be/X4RqkxjdiS0,Arxiv Papers,150 ,30:46
1437,An Empirical Study of Mamba-based Language Models ,https://youtu.be/5-LDbn9jdRM,Arxiv Papers,9300,30:11
1438,Mamba 2 - Transformers are SSMs: Generalized Models and Efficient Algorithms Through SSS Duality ,https://youtu.be/HWs2TXo1uaI,Gabriel Mongaras,1100,30:11
1439,Husky - A Unified Open-Source Language Agent for Multi-Step Reasoning ,https://youtu.be/fH0wTfdIlGg,Fahd Mirza,33000,21:43
1440,Vision Transformer Basics ,https://youtu.be/fH0wTfdIlGg,Samuel Albanie,2400,21:43
1441,Mixture-of-Agents (MoA) Enhances Large Language Model Capabilities ,https://youtu.be/LjCU4V2da3U,AI Papers Academy,1700,40:40
1442,What is MatMul-free Language Modeling ,https://youtu.be/0IReZ4I5W54,Fahd Mirza,491 ,40:40
1443,AWS re:Inforce 2024 - Securing generative AI: Privacy and compliance considerations (GAI222) ,https://youtu.be/I8sZFvGhDIs,AWS Events,486 ,34:15
1444,AWS re:Inforce 2024 - Generative AI skills and culture for security organizations (GAI121) ,https://youtu.be/tK762dthlLU,AWS Events,825 ,34:15
1445,AWS re:Inforce 2024 - 5 ways generative AI can enhance cybersecurity (GAI324) ,https://youtu.be/H2DDISTgm7U,AWS Events,13000,5:51
1446,Function Calling with OpenAI APIs | A Crash Course ,https://youtu.be/68IDtv2nQKo,Elvis Saravia,91 ,5:51
1447,Beyond Model Collapse: Scaling Up with Synthesized Data Requires Reinforcement ,https://youtu.be/frQAA9DMQeM,Arxiv Papers,835 ,1:24:33
1448,Thread: AI-Powered Jupyter Notebook - Install Locally ,https://youtu.be/M1ADv0xweZQ,Fahd Mirza,114 ,1:24:33
1449,How RLHF Aligns LLMs with Human Desires ,https://youtu.be/4pgLHxphWTk,Super Data Science: ML &amp; AI Podcast with Jon Krohn,213 ,35:24
1450,Estimating the Hallucination Rate of Generative AI ,https://youtu.be/oElg6YV4KWc,Arxiv Papers,1100,35:24
1451,Atomic Agents - Building AI Agents Atomically ,https://youtu.be/lkPUVwYLO1g,Fahd Mirza,414 ,35:26
1452,AWS re:Inforce 2024 - Build- deploy- and manage your applications securely with AWS (NIS225) ,https://youtu.be/aypyGPoKrr4,AWS Events,271 ,35:26
1453,AWS re:Inforce 2024 - Keeping people away from data: A generative AI use case (GAI326) ,https://youtu.be/9RCq-vN3jzA,AWS Events,420 ,50:39
1454,AWS re:Inforce 2024 - Mind your business: Secure your generative AI application on AWS (GAI322) ,https://youtu.be/uoTwBF266IY,AWS Events,3600,50:39
1455,RLHF &amp; DPO Explained (In Simple Terms!) ,https://youtu.be/k1NaKVkB_wg,Entry Point AI,335 ,23:01
1456,AWS re:Inforce 2024 - Balancing responsible AI: Privacy and data protection on AWS (GAI223) ,https://youtu.be/eOmgoNIC7a0,AWS Events,1100,23:01
1457,AWS re:Inforce 2024 - Accelerate securely: The Generative AI Security Scoping Matrix (APS201) ,https://youtu.be/DAN86Oqe07A,AWS Events,1000,1:02:41
1458,Logits and Loss: Training and Fine-Tuning LLMs ,https://youtu.be/eDr_F3JrS7E,AI Makerspace,388 ,1:02:41
1459,AWS re:Inforce 2024 - How Deloitte helps navigate generative AI compliance for customers (GRC221) ,https://youtu.be/L1h2OdeDKfo,AWS Events,753 ,2:13:20
1460,AWS re:Inforce 2024 - Accelerating auditing and compliance for generative AI on AWS (GRC302) ,https://youtu.be/WbfVI7Hu9Ls,AWS Events,1200,2:13:20
1461,Import Custom Models Into Amazon Bedrock - AWS OnAir S05 ,https://youtu.be/Pxx_euJiA0U,AWS Events,244 ,1:08:49
1462,Streamline ML governance with Amazon DataZone and Amazon SageMaker | AWS OnAir-S05 ,https://youtu.be/nRP-frj5FmI,AWS Events,208 ,1:08:49
1463,AWS re:Inforce 2024 - Diversity and accessibility in the age of generative AI (ABW101) ,https://youtu.be/fZ5tumMJSxE,AWS Events,1200,6:52
1464,AWS re:Inforce 2024 - The building blocks of a culture of security (SEC202-INT) ,https://youtu.be/IYpsbwJmN7c,AWS Events,261 ,6:52
1465,Assessing security risk in AI model using Microsoft Counterfit ,https://youtu.be/E-kisR5NRKs,Microsoft Reactor,217 ,18:20
1466,AWS re:Inforce 2024 - Fine-tune the COE process with generative AI (ARC221) ,https://youtu.be/Tkds301xtHI,AWS Events,353 ,18:20
1467,AWS re:Inforce 2024 - Security- and AI... so happy together? (CFS222) ,https://youtu.be/Tkds301xtHI,AWS Events,257 ,1:00
1468,AWS re:Inforce 2024 - Protecting data in generative AI applications with Amazon Bedrock (COM223) ,https://youtu.be/sbz3w9nFV0E,AWS Events,230 ,1:00
1469,AWS re:Inforce 2024 - Manual versus automated penetration testing on AWS (COM225) ,https://youtu.be/GjNf3Zvjofc,AWS Events,310 ,1:03:35
1470,AWS re:Inforce 2024 - Developer’s security survival guide (COM321) ,https://youtu.be/5til6Xri8xI,AWS Events,546 ,1:03:35
1471,AWS re:Inforce 2024 - Accelerating privacy &amp; security in AI with Amazon Bedrock and Tines (TDR324-S) ,https://youtu.be/1zVMCmyQ2nE,AWS Events,81 ,22:50
1472,State Soup: In-Context Skill Learning- Retrieval and Mixing ,https://youtu.be/Ipa0y4rNB4M,Arxiv Papers,210 ,22:50
1473,AWS re:Inforce 2024 - Securing AI models and using AI to maintain compliance (SEC321-S) ,https://youtu.be/WPcNHYWS344,AWS Events,212 ,20:07
1474,Large Language Models Must Be Taught to Know What They Don't Know ,https://youtu.be/7w9Bp-SAEHQ,Arxiv Papers,550 ,20:07
1475,AWS re:Inforce 2024 - Elevating security investigations with generative AI (TDR329) ,https://youtu.be/EtnSexLgQMc,AWS Events,1400,1:03:10
1476,The Secret Weapons Revolutionizing Customer Support: RAG + Knowledge Graphs ,https://youtu.be/brLTY26etxw,TwoSetAI,1800,1:03:10
1477,AWS re:Inforce 2024 - Build responsible AI applications with Guardrails for Amazon Bedrock (GRC325) ,https://youtu.be/vsqKGZT8Qn8,AWS Events,7500,10:29
1478,A Machine Learning roadmap (the one I recommend to my students) ,https://youtu.be/Cf0Jidg-pDc,Underfitted,717 ,10:29
1479,791: Reinforcement Learning from Human Feedback (RLHF) — with Dr. Nathan Lambert ,https://youtu.be/ci-aYGFnz6c,Super Data Science: ML &amp; AI Podcast with Jon Krohn,68 ,1:44:31
1480,Distributional Preference Alignment of LLMs via Optimal Transport ,https://youtu.be/brKi2Lf8-8c,Arxiv Papers,180 ,1:44:31
1481,Attention as a Hypernetwork ,https://youtu.be/-CTA79oZk9s,Arxiv Papers,2500,13:18
1482,Retrieval Heads Mechanistically Explain Long-Context Factuality ,https://youtu.be/t_77sBGIG6w,Tunadorable,5500,13:18
1483,Data Scientists Automated with AI!!! ,https://youtu.be/p0I-hwZSWMs,1littlecoder,2400,49:25
1484,The A to Z of Prompt Engineering - Advanced Prompt Engineering Techniques ,https://youtu.be/eSld2AkT3iI,Microsoft Reactor,410 ,49:25
1485,From Robotics to Recommender Systems // Miguel Fierro // MLOps Podcast #240 ,https://youtu.be/lY42IoXwk_I,MLOps.community,1100,15:05
1486,Best Practices for GenAI applications on AWS - RAG pipeline Eval - Part 4 | Amazon Web Services ,https://youtu.be/jSYih32JPnA,Amazon Web Services,2400,15:05
1487,How to Make your AI Application Highly Scalable? (AWS EKS to Azure AKS Migration) ,https://youtu.be/qe186Xamhac,Mervin Praison,1900,21:48
