,title,link,channel,views,length
1234,The Best RAG Technique Yet? Anthropic’s Contextual Retrieval Explained! ,https://youtu.be/6Zbx0Zi7ZW0,AI Engineer,2000,26:19
1235,LLM inference optimization: Model Quantization and Distillation ,https://youtu.be/a1F_qOn11xc,Prompt Engineering,434000,10:13
1236,2.7 BERT (from scratch) ,https://youtu.be/7hnZ6SFnXXA,YanAITalk,37000,10:13
1237,RAG Quality Starts with Data Quality // Adam Kamor // MLOps Podcast #262 ,https://youtu.be/6efwN_US-zk,AIT Brain Lab,1400,39:56
1238,NEW AI Forecasting (UC Berkeley) ,https://youtu.be/SAUQvgSuOW0,MLOps.community,609 ,39:56
1239,I Built an AI Agent That Does EVERYTHING for You! (100% Automated) ,https://youtu.be/vO3sEdNGibw,Discover AI,107 ,19:06
1240,MIT EI seminar- Hyung Won Chung from OpenAI. &quot;Don't teach. Incentivize.&quot; ,https://youtu.be/zcC8eK6grqw,Nick Puru | AI Studio,85 ,19:06
1241,HuggingFace Agents: Self-Correcting SQL Agent to Chat with SQL Database ,https://youtu.be/e1AsKgztz4w,Hyung Won Chung,2000,27:24
1242,Simple RAG for Newcomers - Easy Tutorial ,https://youtu.be/qQrpq8DOW1I,Hands-on AI ,1100,27:24
1243,To CoT or not to CoT? Chain-of-thought helps mainly on math and symbolic reasoning ,https://youtu.be/MIzPl3hB1nI,Fahd Mirza,2000,13:31
1244,Finetuning Language Models to Emit Linguistic Expressions of Uncertainty ,https://youtu.be/FDsoLvKNok0,Arxiv Papers,455 ,13:31
1245,Accelerate FM pre-training on Amazon SageMaker HyperPod (Amazon EKS) | Amazon Web Services ,https://youtu.be/qJoy8U27NPo,Arxiv Papers,808 ,58:06
1246,Kurage - Multipurpose RAG Model - Install Locally ,https://youtu.be/_ZO3aFAOdXE,Amazon Web Services,1500,58:06
1247,Full Fine tuning with Fewer GPUs - Galore- Optimizer Tricks- Adafactor ,https://youtu.be/Yf98T9wpqcU,Fahd Mirza,11000,14:47
1248,LMNT Python API - Next Level AI Text to Speech - Free Credits ,https://youtu.be/I6ovkeFZKJE,Trelis Research,1000,14:47
1249,Q-Learning Tutorial 7: Adjust Learning Rate to Unstuck MountainCarContinuous-v0 from Local Optima ,https://youtu.be/h-WGL-57OfU,Fahd Mirza,213 ,28:43
1250,819: PyTorch: From Zero to Hero — with Luka Anicin ,https://youtu.be/Dij_3hwpMx8,Johnny Code,3200,28:43
1251,Intro to Product Thinking: Building Human-Centric Tools • Flavia Naezer &amp; Julian Wood • GOTO 2024 ,https://youtu.be/InyinN_hHhA,Super Data Science: ML &amp; AI Podcast with Jon Krohn,13000,36:55
1252,What is The Best RAG Chunking Method?! ,https://youtu.be/oLQQfL3pUDc,GOTO Conferences,872 ,36:55
1253,Who's MLOps for Anyway? // Jonathan Rioux // MLOps Podcast #261 ,https://youtu.be/DBepvfZSfX0,MG,469 ,49:48
1254,🔥 NEW LLama Embedding for Fast NLP💥 Llama-based Lightweight NLP Toolkit 💥 ,https://youtu.be/kl91_1_lNiY,MLOps.community,2800,49:48
1255,The scientist who coined retrieval augmented generation ,https://youtu.be/bg0WX7Ewe6I,1littlecoder,186 ,16:43
1256,WordLlama - NLP and Word Embedding Model Optimized for CPU ,https://youtu.be/CzjeJhTSzto,Machine Learning Street Talk,3600,16:43
1257,LLMs Will Always Hallucinate- and We Need to Live With This ,https://youtu.be/7PAmcNFNXvU,Fahd Mirza,9600,1:05:58
1258,auto-regressive decoders &quot;think ahead&quot; with embedding diffusion ,https://youtu.be/mNFgGS7U6V4,Arxiv Papers,337 ,1:05:58
1259,Stop Using Lists of Stop Words for NLP! (Here are Superior Alternatives) ,https://youtu.be/uLrOI65XbDw,Tunadorable,999 ,22:48
1260,AI Swarm Intelligence: Multi-Agent Ecosystem ,https://youtu.be/iQ3bDVmIR6A,Super Data Science: ML &amp; AI Podcast with Jon Krohn,2800,22:48
1261,The Best RAG Stack Components to date (fully open-source!) ,https://youtu.be/tf60owmwR-c,Discover AI,546 ,14:41
1262,Do You Even Need Fine-Tuning? ,https://youtu.be/c9L8vAvCUyA,What's AI by Louis-François Bouchard,122 ,14:41
1263,DataGemma RAG 27B - First Model to Challenge Hallucination - Install Locally ,https://youtu.be/LzG_Vkd30Kg,AI User Group,563 ,23:51
1264,PaperQA with LiteLLM and Ollama - SuperHuman RAG ,https://youtu.be/26XT9JtWgAk,Fahd Mirza,7100,23:51
1265,Inference &amp; GPU Optimization: AWQ ,https://youtu.be/42Da0O9zkhc,Fahd Mirza,129 ,14:56
1266,WINDOWS AGENT ARENA: Evaluating Multi-Modal OS Agents at Scale ,https://youtu.be/tn6nkZP1iSY,AI Makerspace,6000,14:56
1267,LLaMA-Omni: Seamless Speech Interaction with Large Language Models ,https://youtu.be/-hzrieqPYI4,Arxiv Papers,1700,15:54
1268,Strawberry ,https://youtu.be/WLmsncGSjJ8,Arxiv Papers,3300,15:54
1269,Boost Your AI Prompting Skills: 4 Key Tips You Need to Know ,https://youtu.be/KVhbZYjPfaI,hu-po,607 ,26:04
1270,Stanford ECON295/CS323 I 2024 I AI and Democracy- Lawrence Lessig ,https://youtu.be/gbM7k3NauNI,Ryan &amp; Matt Data Science,635 ,26:04
1271,Evaluating your RAG Chat App ,https://youtu.be/tmiBae2goJM,Stanford Online,1000,51:25
1272,NEW DataGemma-27B LLM Uncover the Truth: RIG + RAG ,https://youtu.be/9nmmfjM-b8g,Microsoft Reactor,891 ,51:25
1273,LLM-Modulo: Using Critics and Verifiers to Improve Grounding of a Plan - Explanation + Improvements ,https://youtu.be/ALrG7VCF8Gc,Discover AI,259 ,18:42
1274,USearch - FAISS Alternative for RAG Vector Store ,https://youtu.be/n6e8BQUdnbI,John Tan Chong Min,588 ,18:42
1275,How to Optimize and Deploy AI Models: Best Practices- Troubleshooting- and Security Considerations ,https://youtu.be/IOJT0Sq8jUE,Fahd Mirza,813 ,18:12
1276,RAG with Data Access Control ,https://youtu.be/PwwvZQORy1I,Ultralytics,4000,18:12
1277,How GenAI is making Application Security harder... and easier! ,https://youtu.be/kYWUEV_e2ss,Microsoft Reactor,5900,36:15
1278,Ax a New Way to Build Complex Workflows with LLMs // Vikram Rangnekar // MLOps Podcast #259 ,https://youtu.be/C81C1nurcEI,Microsoft Reactor,2700,36:15
1279,Production RAG Secrets the Pros Don't Want You to Know -- Part 2 ,https://youtu.be/weiZ7MizjVc,MLOps.community,5200,46:15
1280,SciAgents Graph Reasoning: Stanford vs MIT #ai ,https://youtu.be/weiZ7MizjVc,TwoSetAI,819 ,46:15
1281,David Hanson's Vision for Sentient Robots ,https://youtu.be/Af9xXjb5vRw,Discover AI,11000,1:09:03
1282,Day 9 - AWS CICD Deployment  | MLOPs Production Ready Machine Learning Project ,https://youtu.be/yq6p-i2wXZw,Machine Learning Street Talk,3800,1:09:03
1283,Automated Prompt Engineering with DSPy ,https://youtu.be/mYiZOYlpoO0,DSwithBappy,418 ,1:36:39
1284,Prompt Engineering 101: Power Platform Edition ,https://youtu.be/_LAo59Tr8hI,Trelis Research,3200,1:36:39
1285,Advanced NumPy Course - Vectorization- Masking- Broadcasting &amp; More ,https://youtu.be/i8_qL6y7CLg,Microsoft Reactor,1100,33:49
1286,NEW &quot;Harmonized&quot; Chain of Thought (CoT) Complexity ,https://youtu.be/ehCT97pYOZc,NeuralNine,1700,33:49
1287,RAG Overview ,https://youtu.be/1Ms2UqRC8LA,Discover AI,854 ,1:02:42
1288,Why is AI so bad at multiplication? ,https://youtu.be/EQcSmW2PbSs,Microsoft Reactor,17000,1:02:42
1289,Prefect - Workflow Orchestration Framework for Building Data Pipelines - Install Locally ,https://youtu.be/iyUgBcYLHdA,Tunadorable,5500,1:59:32
1290,alphaXiv - A platform to discuss AI papers ,https://youtu.be/Vmv7vCQ6JjY,Fahd Mirza,8200,1:59:32
1291,Empowering Agents with LLMs ,https://youtu.be/HAIpMAZB_F4,Elvis Saravia,2500,34:23
1292,Crawl4AI: The Ultimate Web Scraping Tool for AI🚀 ,https://youtu.be/GF7wnswJF74,AI User Group,128 ,34:23
1293,REFLECTION 70B: What Happened? (#1 on HuggingFace) ,https://youtu.be/CMLCpZarQkE,AI Anytime,96 ,59:57
1294,Fine Tune Qwen2 VL Model using Llama Factory ,https://youtu.be/_gP5KylFHxE,Discover AI,87 ,59:57
1295,AI Strategist w/ Monte Carlo Tree Search ,https://youtu.be/1LbZZ3g57h0,AI Anytime,716 ,5:46:05
1296,The AdEMAMix Optimizer: Better- Faster- Older ,https://youtu.be/z7d0_dLTtLw,Discover AI,97 ,5:46:05
1297,Lamba - Enhancing your JupyterLab Developer Experience with Local LLMs and Code Snippets ,https://youtu.be/6uxCIU7_9bA,Arxiv Papers,470 ,50:32
1298,Dean Pleban - Customizing and Evaluating LLMs- an Ops Perspective | PyData Global 2023 ,https://youtu.be/j3kGJk-JYu0,PyData,1600,50:32
1299,Guillaume Lemaitre - Get the best from your scikit-learn classifier | PyData Global 2023 ,https://youtu.be/QyaMmSXxH2w,PyData,176 ,1:59:08
1300,Elijah ben Izzy &amp; Stefan Krawczyk - Bridging Classic ML Pipelines with the World of LLMs ,https://youtu.be/MECsLD9loig,PyData,503 ,1:59:08
1301,Hugo Bowne-Anderson - Full-stack Machine Learning and Generative AI for Data Scientists ,https://youtu.be/6odLMxnUs5g,PyData,968 ,21:41
1302,Matt Harrison - An Introduction to Pandas 2- Polars- and DuckDB | PyData Global 2023 ,https://youtu.be/CDmHAxo-4CY,PyData,2300,21:41
1303,Ramona Sartipi - When Design Thinking Meets Opensource | PyData Global 2023 ,https://youtu.be/BEDHx_drhHQ,PyData,349 ,1:52:32
1304,Pattaniyil- Ravi- &amp; Zengin - Using LLMs to improve your Search Engine | PyData Global 2023 ,https://youtu.be/dVwhcER2rBQ,PyData,83 ,1:52:32
1305,Heidrich- Kiraly- &amp; Ray - sktime - python toolbox for time series | PyData Global 2023 ,https://youtu.be/u4kOaWY0KDs,PyData,7400,22:49
1306,Olivier Grisel - Predictive survival analysis with scikit-learn- scikit-survival and lifelines ,https://youtu.be/oQqOiwUhJkA,PyData,159 ,22:49
1308,MLSecOps Connect: Ask the Experts | ML Model Security - Is Your AI Protected? ,https://youtu.be/Qt0Nck1Gs7U,Zilliz,86 ,23:43
1309,LLM inference optimization: Architecture- KV cache and Flash attention ,https://youtu.be/ObAoSIL8LCM,MLSecOps,7000,12:46
1310,Attention Heads of Large Language Models: A Survey ,https://youtu.be/LBreFhp1aEU,YanAITalk,139 ,12:46
1311,Best Practices for Building Production RAG - Part 1 ,https://youtu.be/_vZOIuV-nns,Arxiv Papers,128 ,10:07
1312,MMMU-Pro: A More Robust Multi-discipline Multimodal Understanding Benchmark ,https://youtu.be/ibAi2Owtafc,TwoSetAI,2300,10:07
1313,Stanford Webinar - AI in the Workplace: Rethinking Skill Development ,https://youtu.be/Tt_35YnQ9uk,Arxiv Papers,2100,45:44
1314,Itamar Turner-Trauring - Optimize first- parallelize second: a better path to faster data processing ,https://youtu.be/q27QT2IeGe8,Stanford Online,5700,45:44
1315,Patrick Deziel &amp; Prema Roman - Reconceptualizing Machine Learning for the Real-time World ,https://youtu.be/q27QT2IeGe8,PyData,378 ,1:42:32
1316,Do we really need to use every single transformer layer? ,https://youtu.be/MpWyru5f60o,PyData,1100,1:42:32
1317,How to use LLMs for Fact Checking ,https://youtu.be/9AI_aeof8-4,Tunadorable,4000,34:22
1318,NEW CORE of AI Agents (MIT- Stanford) ,https://youtu.be/nwDyXwPt2bI,Trelis Research,2200,34:22
1319,Jina-ColBERT-v2 : A General-Purpose Multilingual Late Interaction Retriever ,https://youtu.be/G-LjfQALmxI,Discover AI,335 ,21:23
1320,815: Polars: Faster DataFrame Ops — with Marco Gorelli ,https://youtu.be/LFCIEhlsozU,Fahd Mirza,579 ,21:23
1321,NEW: AI Agents That Design Themselves w/ ADAS ,https://youtu.be/imRQnmGq09k,Super Data Science: ML &amp; AI Podcast with Jon Krohn,699 ,24:07
1322,CONTEXT CACHING for Faster and Cheaper Inference ,https://youtu.be/0gYMqFYRtDI,Discover AI,480 ,24:07
1323,Visualize - Bringing Structure to Unstructured Data // Markus Stoll // MLOps Podcast #258 ,https://youtu.be/QMfrb3726Yo,Trelis Research,5200,27:13
1324,Hyukjin Kwon - Demystifying pandas with PySpark when scaling out | PyData Vermont 2024 ,https://youtu.be/pQt8yQuPOGo,MLOps.community,75 ,27:13
1325,Multimodal RAG with Milvus and GPT-4o ,https://youtu.be/uVnYle95T0c,PyData,146 ,40:28
1326,Segment Anything Model 2 +Building XR Applications +Code-Savvy Assistants +Multi-Modal RAG Embedding ,https://youtu.be/kjyHo7byP1s,Zilliz,1400,40:28
1327,The CORE IDEA of AI Agents Explained ,https://youtu.be/xR-CxiCkzsE,AI Performance Engineering,1500,40:54
1328,Modularity in Transformers: Investigating Neuron Separability &amp; Specialization ,https://youtu.be/47v7DcV94tQ,Discover AI,923 ,40:54
1329,Smaller- Weaker- Yet Better: Training LLM Reasoners via Compute-Optimal Sampling ,https://youtu.be/2YSOPncByt4,Arxiv Papers,3100,2:01:53
1330,KN-RAG: A Novel Approach ,https://youtu.be/nfgAVaoa7D4,Arxiv Papers,1800,2:01:53
1331,Production-Ready Optimization Strategies for #langchain #rag Applications ,https://youtu.be/lpOb1bQO7aM,Zhixiao Wang,870 ,1:15:25
1333,The Mamba in the Llama: Distilling and Accelerating Hybrid Models ,https://youtu.be/5IqkZ_yms4k,TwoSetAI,71 ,46:10
1334,DSPy: Advanced Agents? ,https://youtu.be/W5t7HKLUpjM,Sasha Rush,280 ,46:10
1335,LitServe - LLM Serving Inference Engine - Install and Test Locally ,https://youtu.be/0kd9at_rjII,AI Makerspace,4600,23:52
1336,Stanford CS229 I Machine Learning I Building Large Language Models (LLMs) ,https://youtu.be/5M86NovlGnE,Fahd Mirza,2200,23:52
1337,Power Scheduler: A Batch Size and Token Number Agnostic Learning Rate Scheduler ,https://youtu.be/WA1uPZ2h490,Stanford Online,55 ,1:18:23
1338,Exploring Long Context Language Models // MLOps Reading Group August 2024 ,https://youtu.be/Po7PRIBjRoQ,Arxiv Papers,67 ,1:18:23
1339,Anthropic's Big SECRET REVEALED 💥Claude Sonnet System Prompt!! 💥 ,https://youtu.be/a5mPqmNhKQA,MLOps.community,292 ,29:02
1340,Making some embedding vectors functions of each other ,https://youtu.be/SOSKgxKCi2E,1littlecoder,146 ,29:02
1341,FERRET: Faster and Effective Automated Red Teaming withReward-Based Scoring Technique ,https://youtu.be/h03Gdr8pqyY,Tunadorable,69 ,24:37
1342,SLM Meets LLM: Balancing Latency- Interpretability and Consistency in Hallucination Detection ,https://youtu.be/9W6sq8g-0Ho,Arxiv Papers,68 ,24:37
1343,SimCSE - Unsupervised Sentence Embeddings ,https://youtu.be/CyDplDZMsVA,Arxiv Papers,221000,24:43
1344,How to iteratively build robust and reliable Generative AI systems : Part 2 ,https://youtu.be/_WNLjqrBaBY,TechViz - The Data Science Guy,411 ,24:43
1346,TableBench: A Comprehensive and Complex Benchmark for Table Question Answering ,https://youtu.be/4ta842VAyIM,Arxiv Papers,3500,44:12
1347,The Key Equation Behind Probability ,https://youtu.be/8OsPJXyGTjE,Arxiv Papers,404 ,49:53
1348,How to iteratively build robust and reliable Generative AI systems : Part 1 ,https://youtu.be/jk2FsJxZFo8,Artem Kirsanov,350 ,49:53
1349,Show-o: One Single Transformer to Unify Multimodal Understanding and Generation ,https://youtu.be/QyM4ttPLDLE,Aritra Sen,8900,36:12
1350,Better Agents with #llamaindex Workflows ,https://youtu.be/ZNcxMLBEydA,Arxiv Papers,94 ,36:12
1351,What is a Masked Language Model (MLM) ? ,https://youtu.be/zUEYB8GXLJo,AI Makerspace,94000,37:31
1352,LLM Pruning and Distillation in Practice: The Minitron Approach ,https://youtu.be/U4QWzTPg1gI,TechViz - The Data Science Guy,7800,37:31
1353,Complete @LangChain Essential in 1 shot | LangChain Core | LangServe | LangGraph | LangSmith | Agent ,https://youtu.be/exaNWuIuqec,Arxiv Papers,16000,17:21
1354,Recurrent Neural Networks Learn to Store and Generate Sequences using Non-Linear Representations ,https://youtu.be/JTjKoncSoMg,Sunny Savita,154 ,17:21
1355,Inside GPT – Large Language Models Demystified • Alan Smith • GOTO 2024 ,https://youtu.be/5QFqvTr8zSM,Arxiv Papers,9500,1:19:27
1356,10x Development: LLMs For the working Programmer - Manuel Odendahl ,https://youtu.be/tFuiQKUHcdY,GOTO Conferences,285 ,1:19:27
1357,The BEST Mental Model for Optimizing Your LLMs - Part 2 ,https://youtu.be/I7HE_MyVzf4,AI Engineer,474 ,57:21
1358,Transformers to SSMs: Distilling Quadratic Knowledge to Subquadratic Models ,https://youtu.be/NtYr4nfndDM,TwoSetAI,236 ,57:21
1359,The Hidden Cost of Embeddings in RAG and how to Fix it ,https://youtu.be/3vJCGI7NnyE,Arxiv Papers,337 ,23:29
1361,Ennia Suijkerbuijk - Evaluating LLM Frameworks ,https://youtu.be/YeAAUghx_Xs,PyData,730 ,30:56
1362,Sanne van den Bogaart - Explainable AI in the LIME-light ,https://youtu.be/HN8o4D7UjAE,PyData,11000,30:56
1363,Ferdinand Schenck - 🌳 The taller the tree- the harder the fall. Determining tree height from space.. ,https://youtu.be/Ff78Y6FXIkw,PyData,988 ,52:52
1364,Vincent D. Warmerdam - Scikit-Learn can do THAT?! ,https://youtu.be/AImwkZYbUvE,PyData,1000,52:52
1365,811: Scaling Data Science Teams Effectively — with Nick Elprin ,https://youtu.be/8W5kF-Eydhc,PyData,839 ,48:07
1366,CrewAI August Update: Planning Steps- Training- and Advanced Features Explained ,https://youtu.be/xdAKa8jFx3g,Super Data Science: ML &amp; AI Podcast with Jon Krohn,825 ,48:07
1367,Design and Development Principles for LLMOps // Andy McMahon // MLOps Podcast #254 ,https://youtu.be/pqYWtw9jlWw,Sam Witteveen,3100,5:40:59
1368,Sam Aaron - Sonic Pi - Live Coding as a tool for next-gen education. ,https://youtu.be/m4Ivtn-ks4E,MLOps.community,4500,5:40:59
1369,Multi-Modal RAG - Segment Anything Model v2- ImageBind- Embeddings- Fine-Tuning ,https://youtu.be/fgXaVVDNq6A,PyData,1800,25:48
1370,Add multi-channel communication in your RAG app ,https://youtu.be/DNhV6WcOVeM,AI Performance Engineering,84 ,25:48
1371,Not Diamond: Cut AI Costs with Smart LLM Routing ,https://youtu.be/8DWD7hv-aL0,Microsoft Reactor,80 ,1:03:45
1372,Building a multi-strategy RAG workflow with reflection in LlamaIndex ,https://youtu.be/A5ff8hu1amM,Mervin Praison,645 ,1:03:45
1373,Improving GraphRAG using LangGraph ,https://youtu.be/i71LCDU5EUo,LlamaIndex,218 ,45:05
1374,Can Large Language Models Understand Symbolic Graphics Programs? ,https://youtu.be/3FvlqYX_E-Y,Data Science in your pocket,304 ,45:05
1375,BAM! Just Like That: Simple and Efficient Parameter Upcycling for Mixture of Experts ,https://youtu.be/9vM4p9NN0Ts,Arxiv Papers,495 ,25:09
1376,AI-powered ETL for Complex PDF Files - Aryn ,https://youtu.be/RaR7rr_bN0A,Arxiv Papers,107 ,25:09
1377,LLMSec - Tool to Detect and Block Malicious User Prompts ,https://youtu.be/ZD4-QhJqr34,Fahd Mirza,113 ,36:52
1378,Data Quality = Quality AI // Panel // AIQCON ,https://youtu.be/oiaGCbmCmzY,Fahd Mirza,26000,36:52
1379,Deformable DEtection TRansformer DETR Model - Install Locally ,https://youtu.be/WGhcxQeOGbE,MLOps.community,54000,32:48
1380,Self-Alignment of LLM from Scratch    through an Iterative Self-Enhancement Paradigm ,https://youtu.be/isL2UNH65Ws,Fahd Mirza,33000,32:48
1381,Towards flexible perception with visual memory ,https://youtu.be/G_3TL6X46rg,Arxiv Papers,297 ,59:54
1382,Building with Anthropic Claude: Prompt Workshop with Zack Witten ,https://youtu.be/PUpmRHtuc2Y,Arxiv Papers,19000,59:54
1383,The AI Scientist | Fully Automated Open-Ended Scientific Discovery ,https://youtu.be/CVmxiPDdpj0,AI Engineer,15000,19:57
1384,The AI Bubble: Will It Burst- and What Comes After? ,https://youtu.be/om7A8GMJZsw,Wes Roth,15000,19:57
1385,Mutual Reasoning Makes Smaller LLMs Stronger Problem-Solvers ,https://youtu.be/pSIHlPqACR0,Machine Learning Street Talk,1200,10:40
1386,Best Open Source Text-to-Speech AI Tutorial in 2024 ,https://youtu.be/KHVR587oW8I,Arxiv Papers,717 ,10:40
1387,The BEST Mental Model for Optimizing Your LLMs - Part 1 ,https://youtu.be/oqdMp3xG3Ew,1littlecoder,2000,25:37
1388,Is ChatGPT an N-gram model on steroids? ,https://youtu.be/PkOEVDx6X7c,TwoSetAI,2100,25:37
1389,LLM Security 101: Jailbreaks- Prompt Injection Attacks- and Building Guards ,https://youtu.be/6imZsF8RKt4,Machine Learning Street Talk,1600,49:48
1390,Agent Q: Advanced Reasoning and Learning for Autonomous AI Agents ,https://youtu.be/1hk_PuczseA,Trelis Research,508 ,49:48
1391,NP-Hard: The End of AI? ,https://youtu.be/ourFXhqIXjc,Arxiv Papers,322 ,16:00
1392,Boost Your RAG Chatbot’s Accuracy with Synthetic Test Data Generation! ,https://youtu.be/6GnsndNL5u4,Discover AI,61 ,16:00
1393,Advance RAG 12-  Powerful RAG with Merger Retriever and Hypothetical Document Embeddings(HyDE) #ai ,https://youtu.be/cBK7EMukEeI,AI Anytime,54 ,1:29:46
1394,OpenResearcher - AI Assistant for Accelerated Scientific Research ,https://youtu.be/MznD2DzlQCc,Sunny Savita,1900,1:29:46
1395,Controllable RAG Agent For Solving Complex Tasks ,https://youtu.be/zwItokY087U,Fahd Mirza,2000,7:58
1396,Learned Ranking Function: From Short-term Behavior Predictions to Long-term User Satisfaction ,https://youtu.be/zwItokY087U,Fahd Mirza,870 ,7:58
1397,Does Liking Yellow Imply Driving a School Bus? Semantic Leakage in Language Models ,https://youtu.be/NmXFRQhrVF4,Arxiv Papers,268 ,27:08
1398,Which is in charge- consciousness or the brain? ,https://youtu.be/0dvF0R0hCh0,Arxiv Papers,2700,27:08
1399,Fine-Tuning Embeddings for Better Retrieval ,https://youtu.be/Ra8n_9wnHFs,Tunadorable,99 ,9:47
1400,How GoML is building the future of generative AI on AWS| AWS OnAir S05 ,https://youtu.be/WAucmqgLFBw,AI Makerspace,3500,9:47
1401,The Variational Book // Yuri Plotkin // MLOps Podcast #253 ,https://youtu.be/HHSp4vN4IpU,AWS Events,519 ,10:26
1402,Can concatenated small networks compete with large ones? ,https://youtu.be/9Hckg9gsBYs,MLOps.community,3800,10:26
1403,Body Transformer: Leveraging Robot Embodiment for Policy Learning ,https://youtu.be/7GU95sic2Y4,Tunadorable,873 ,42:57
1404,AI Scientist ,https://youtu.be/es_8_iT-oQk,Arxiv Papers,2500,42:57
1405,The AI Scientist: Towards Fully Automated Open-Ended Scientific Discovery ,https://youtu.be/PUC1yzPv4nk,hu-po,140 ,5:41
1406,How to Build and Use Langchain Agents with Pandas DataFrames ,https://youtu.be/uGj4REGFp3A,Arxiv Papers,1800,5:41
1407,BEST 46 NEW AI Papers of this TUESDAY ,https://youtu.be/LHEKLqpI2VY,Ryan &amp; Matt Data Science,1600,23:00
1408,LLM Evaluation using DeepEval ,https://youtu.be/eCZaqKTwtvQ,Discover AI,1700,23:00
1409,VITA: Towards Open-Source Interactive Omni Multimodal LLM ,https://youtu.be/hALjJVuFy2Y,Data Science in your pocket,410 ,14:43
1410,Evals for AI Agents- the right way!!! ,https://youtu.be/xnmok9Al7iA,Arxiv Papers,562 ,14:43
1411,Contrarian Guide to AI: Jason Liu on Betting Against Agents while Doubling Down on RAG &amp; Fine-Tuning ,https://youtu.be/m5Ro5jQqf0M,1littlecoder,125 ,5:43
1412,Trade-off between world modeling (predicting) vs agent modeling (acting) ,https://youtu.be/06kJ390a-O8,High Agency,23000,5:43
1413,Better RAG with Sentence Window Retriever - LlamaIndex ,https://youtu.be/DaSjS98WCWk,Tunadorable,33000,16:49
1414,Better RAG with Auto Merging Retriever - LlamaIndex ,https://youtu.be/kYZEafamuBY,Aritra Sen,22000,16:49
1415,Conversational Prompt Engineering ,https://youtu.be/gfSslXL1HCs,Aritra Sen,761 ,13:03
1416,Jay Alammar on LLMs- RAG- and AI Engineering ,https://youtu.be/e6Y0zru7Ltw,Arxiv Papers,732 ,13:03
1417,Complete DSPy Tutorial - Master LLM Prompt Programming in 8 amazing examples! ,https://youtu.be/AuVJ_GgF5jc,Machine Learning Street Talk,4000,17:22
1418,Best AI Voice Generator | 2024.08 ,https://youtu.be/r2fxb-OnBRM,Neural Breakdown with AVB,2900,17:22
1419,Transformer Explainer - Learn How LLMs Work Visually ,https://youtu.be/LNfjhZ5kkzk,Thorsten-Voice,250 ,24:26
1420,Designing High-Quality Synthetic Data for Training &amp; Fine-tuning LLMs ,https://youtu.be/G1MeeScQSJQ,Fahd Mirza,9500,24:26
1421,Decoding the Decoder LLM without de code: Ishan Anand ,https://youtu.be/89iylAs2F3E,Microsoft Reactor,3700,49:19
1422,How to use Aurora as a Knowledge Base for Amazon Bedrock for RAG | The Data Dive on AWS OnAir S01 ,https://youtu.be/hkhDdcM5V94,AI Engineer,300 ,49:19
1423,ChatEXAONE - LG Drops Enterprise AI Agent for Corporate Efficiency ,https://youtu.be/_3o3U5qBPJM,AWS Events,404 ,35:18
1424,Agents- Agents and more Agents 🤖🤖🤖 ,https://youtu.be/91SK90SahHc,Fahd Mirza,327 ,35:18
1425,What would it mean for an AI to &quot;understand&quot;? ,https://youtu.be/r8LZDIOyNzo,Prompt Engineering,450 ,14:46
1426,Protect your most sensitive AI data and applications in the cloud | AWS AI Infrastructure Day 2024 ,https://youtu.be/STuEJLBLvoc,Tunadorable,248 ,14:46
1427,Generative AI Inference with AWS Graviton Processors | AWS AI Infrastructure Day 2024 on AWS OnAir ,https://youtu.be/Ob4KePkOI8Q,AWS Events,1300,10:31
1428,Build high-performance foundation models with AWS Trainium &amp; Inferentia | AWS AI Infrastructure Day ,https://youtu.be/W485bz0_TdI,AWS Events,2000,10:31
1429,From PoC to Production: Deploying Gen AI workloads on AWS Inferentia | AWS Infrastructure Day 2024 ,https://youtu.be/ysB863OXcIw,AWS Events,510 ,23:35
1430,Accelerate generative AI/ML workloads with AWS storage | AI Infrastructure Day 2024 on AWS OnAir ,https://youtu.be/KYmydU7f9Lc,AWS Events,644 ,23:35
1431,LangFuse : LLM tracing and debugging ,https://youtu.be/oB4B32uWR6o,AWS Events,11000,14:20
1432,Advance RAG 11-  Powerful RAG with Sentence Window Retriever using @LlamaIndex  and @qdrant #ai #llm ,https://youtu.be/7rba4exIaOs,Data Science in your pocket,7500,14:20
1433,RAG Foundry - Framework for Enhancing LLMs for RAG ,https://youtu.be/nqgnGcNe_i4,Sunny Savita,655000,35:28
1434,Building an Agentic RAG locally with Milvus- Ollama and Llama Agents ,https://youtu.be/1vAAvOHpqx0,Fahd Mirza,328 ,35:28
1435,Intro to GraphRAG ,https://youtu.be/tENsalmU_ik,Zilliz,407 ,27:37
1436,How to run SAM 2 (Segment Anything AI Model)? ,https://youtu.be/pl_RuGqx1HA,Microsoft Reactor,7300,27:37
1437,10 Important Python Concepts In 20 Minutes ,https://youtu.be/7dSMIZb-V3Q,AI Anytime,3100,26:19
1438,Securing your RAG from Prompt Injection Attacks with Sachin Dharashivkar ,https://youtu.be/u2pFB3JamtE,Indently,21000,26:19
1439,Internationalization for RAG ,https://youtu.be/gUJkyp9j3sM,Qdrant - Vector Database &amp; Search Engine,16000,21:45
1440,Mistral AI Introduces Agents! (Tutorial) ,https://youtu.be/gUJkyp9j3sM,Microsoft Reactor,19000,21:45
1441,Goldfish Loss for Mitigating Memorization in LLMs ,https://youtu.be/NkPDAlflmJc,Elvis Saravia,2500,50:00
1442,“I want to give ChatGPT 10x more docs” - RAG Explained ,https://youtu.be/RBzYKL_dO84,Tunadorable,234 ,50:00
1443,Generative Feedback Loops: The Secret Weapon for Supercharging Your RAG System ,https://youtu.be/CG9StTrrGh4,The AI Advantage,1600,11:21
1444,Sequential vs. Multi Agents: Which Flowise Feature is Right for You? ,https://youtu.be/tKcR4Oc5N7I,TwoSetAI,442 ,11:21
1445,807: Superintelligence and the Six Singularities — with Dr. Daniel Hulme ,https://youtu.be/VgA02gmAgdA,Leon van Zyl,8000,17:42
1446,Self-Taught Evaluators ,https://youtu.be/R08oRXYjb-U,Super Data Science: ML &amp; AI Podcast with Jon Krohn,1300,17:42
