,title,link,channel,views,length
1481,Talking Nonsense: Probing Large Language Models' Understanding ofAdversarial Gibberish Inputs ,https://youtu.be/9hf_nFMiLCo,Arxiv Papers,935 ,9:09
1482,Hanrui Wang's PhD Defense- Toward Practical Quantum Computing Systems @ MIT ,https://youtu.be/L4tFxMWFVFc,MIT HAN Lab,105 ,9:09
1483,AdvPrompter: Fast Adaptive Adversarial Prompting for LLMs ,https://youtu.be/jodNnvBFYws,Arxiv Papers,10000,41:37
1484,How Good is LLAMA-3 for RAG- Routing- and Function Calling ,https://youtu.be/Ev0uzdzesjU,Prompt Engineering,7600,41:37
1485,Building End To End Webloader RAG Application using Groq With DataStax and Cassio- Langchain ,https://youtu.be/ScJY1nBl0nM,Krish Naik,159 ,35:53
1486,LLaMa Family: Alpaca- Vicuna and LLaVA ,https://youtu.be/52kMBrAI_IM,YanAITalk,3900,35:53
1487,❄️ Snowflake ❄️ Arctic 480Bx128 MoE:  MoE with 128 EXPERTS faster than LLama3!? ,https://youtu.be/MbS6uMvuXyQ,Ai Flux,241 ,4:12
1488,AdvPrompter - Fast Adaptive Adversarial Prompting for LLMs ,https://youtu.be/xTMngs6JWNM,Fahd Mirza,242 ,4:12
1489,Apply ML with your partners without sharing underlying data using AWS Clean Rooms ML | AWS OnAir S05 ,https://youtu.be/TWnhgSqRfm8,AWS Events,936 ,15:49
1490,LLMs: Rewriting Our Tomorrow (plus code) #ai ,https://youtu.be/RG4RNiHdqh0,Discover AI,17000,15:49
1491,Meta Llama 3 Fine tuning- RAG- and Prompt Engineering for Drug Discovery ,https://youtu.be/XICHJx2_Rm8,ChemicalQDevice,5300,56:31
1492,LangChain Expression Language - The ONLY video you need to TRULY understand LCEL ,https://youtu.be/p7nJ8-zf2vE,Coding Crash Courses,1400,56:31
1493,How Context Length of LLM is Increased ,https://youtu.be/oRnYBp_5X-o,Fahd Mirza,214 ,24:25
1494,AUTOCRAWLER : A Progressive Understanding Web Agent for Web Crawler Generation ,https://youtu.be/wXSglU2DNE4,Arxiv Papers,1300,24:25
1495,How Llama 3 Behaves After Fine-Tuning - Install Llama 3 8B Instruct 262k Locally ,https://youtu.be/Io0fek8fJbo,Fahd Mirza,129 ,24:55
1496,Retrieval Head Mechanistically Explains Long-Context Factuality ,https://youtu.be/ly53IU0x1Tk,Arxiv Papers,152 ,24:55
1497,Let’s Think Dot ,https://youtu.be/8Rbq6zHarZM,Arxiv Papers,3000,21:32
1498,OpenELM- Phi-3- Quantized LLaMA-3 ,https://youtu.be/qFZbu2P1vZ8,hu-po,1900,21:32
1499,Autonomous AI Agents: 14% MAX Performance ,https://youtu.be/3e9YAdOpihI,Discover AI,86000,25:34
1500,MASSIVE Step Allowing AI Agents To Control Computers (MacOS- Windows- Linux) ,https://youtu.be/lA3Tju4VUho,Matthew Berman,7600,25:34
1501,This AI Research Agent Generates Detailed Report Using PhiData ,https://youtu.be/hGXhFa3gzBs,Mervin Praison,207 ,27:35
1502,LangTail Introduction - LLMOps Platform ,https://youtu.be/AF8kJE6my38,Fahd Mirza,7400,27:35
1503,LM Studio 2.0: Image Analysis Revolution with AI Unleashed ,https://youtu.be/1p9HoSBDo2k,Mervin Praison,7500,6:58
1504,Testing Framework Giskard for LLM and RAG Evaluation (Bias- Hallucination- and More) ,https://youtu.be/vc-UbhcPbYQ,AI Anytime,3600,6:58
1505,Advanced RAG Techniques with @LlamaIndex ,https://youtu.be/ucJJ7tM8xkM,Timescale,249000,15:16
1506,Python RAG Tutorial (with Local LLMs): AI For Your PDFs ,https://youtu.be/u_17Y6UE6eo,pixegami,1800,15:16
1507,🤗 Hugging Cast S2E3 - Deploying LLMs on Google Cloud ,https://youtu.be/MgHxUm0xKCE,HuggingFace,4700,14:15
1508,Quantize LLMs with AWQ: Faster and Smaller Llama 3 ,https://youtu.be/zxIfm1XY72w,AI Anytime,1100,14:15
1509,Leading Enterprise Data Teams // Sol Rashidi // MLOps Podcast #227 ,https://youtu.be/2WOa4_3Bgtw,MLOps.community,151 ,45:11
1510,LayerSkip: Enabling Early Exit Inference and Self-Speculative Decoding ,https://youtu.be/kNCl3FaZXuE,Arxiv Papers,40000,45:11
1511,[ML News] Devin exposed | NeurIPS track for high school students ,https://youtu.be/Fr_7HtHjcf0,Yannic Kilcher,3400,15:21
1512,Merge LLMs with No Code Mergekit GUI ,https://youtu.be/KgrSXWZIvAc,AI Anytime,276 ,15:21
1513,MambaByte: Token-free Selective State Space Model ,https://youtu.be/6MY-IgqiTpg,Fahd Mirza,480 ,14:14
1514,MambaByte: Token-free Selective State Space Model ,https://youtu.be/3a0_hAiFKag,Arxiv Papers,177 ,14:14
1515,Understanding When and Why Transformers Generalize Hierarchically ,https://youtu.be/hrPQS__ayu8,Arxiv Papers,12000,20:15
1516,How to Use Hugging Face Inference API ,https://youtu.be/qYjS1vmWEMA,Fahd Mirza,443 ,20:15
1517,AI Horde - Crowdsourced AI For Free ,https://youtu.be/XtiKyTWuqxM,Fahd Mirza,13000,7:34
1518,How Good is Phi-3-Mini for RAG- Routing- Agents ,https://youtu.be/_UFZB_mh6sI,Prompt Engineering,1900,7:34
1519,Estimate Memory Consumption of LLMs for Inference and Fine-Tuning ,https://youtu.be/V83SeIr10FI,AI Anytime,282 ,13:47
1520,Many-Shot In-Context Learning ,https://youtu.be/p42BzKKAO74,Fahd Mirza,1000,13:47
1521,Discover a Graph Data Model Using Generative AI and Diagram as Code | Amazon Web Services ,https://youtu.be/za4yminmZ-w,Amazon Web Services,227 ,19:13
1522,Build a data foundation for healthcare transformation with AWS and Redox | AWS Events ,https://youtu.be/8q_9AX9DRnk,AWS Events,39000,19:13
1523,Test Your Prompts with Every ChatBot (for Free) ,https://youtu.be/jw0w0SOcl0k,Matt Wolfe,580 ,45:39
1524,Authorization process simplification using generative AI | AWS Events ,https://youtu.be/dxYreblrQbc,AWS Events,542 ,45:39
1525,Best Prompt Engineering Tool for Anthropic Models - MetaPrompt ,https://youtu.be/YUMdqJxgx5k,Fahd Mirza,209 ,11:44:09
1526,Free LLM Benchmarks for Enterprise - Vals AI ,https://youtu.be/CS1O2ZCHsbY,Fahd Mirza,434 ,11:44:09
1527,Startup AI School: Application Design and Development in the Gen AI Era #7 ,https://youtu.be/LzxSY7197ns,Microsoft Reactor,64 ,20:31
1528,Integrating Multimodal AI in Your Apps with Floom ,https://youtu.be/ScSTs8sWLzM,Zilliz,181 ,20:31
1529,LangWatch Introduction for AI Quality Control ,https://youtu.be/_j2DkY3T-w4,Fahd Mirza,45 ,37:47
1530,Weak-to-Strong Extrapolation Expedites Alignment ,https://youtu.be/0d0GK3U0ap8,Arxiv Papers,86 ,37:47
1531,AutoGluon-Multimodal (AutoMM): Supercharging Multimodal AutoML with Foundation Models ,https://youtu.be/6WbvUMqnlYY,Arxiv Papers,124 ,45:54
1532,The Changing Face of AI Engineering // Amritha Arun Babu &amp; Abhik Choudhury // Podcast #221 clip ,https://youtu.be/AIR9QduDqD8,MLOps.community,302 ,45:54
1533,Introduction to foundation model evaluation on Amazon SageMaker Clarify | Amazon Web Services ,https://youtu.be/YEm4tuo2HPA,Amazon Web Services,113 ,11:28
1534,Bring your own datasets | Amazon Web Services ,https://youtu.be/A2pDicTvOEM,Amazon Web Services,93 ,11:28
1535,Human-driven foundation model evaluation | Amazon Web Services ,https://youtu.be/YZp3Hy6YFqY,Amazon Web Services,104 ,15:35
1536,FM Eval Library Deep Dive  | Amazon Web Services ,https://youtu.be/6NKnaeyQ-2w,Amazon Web Services,642 ,15:35
1537,Build a foundation model evaluation pipeline | Amazon Web Services ,https://youtu.be/tYLf-YLzmZE,Amazon Web Services,725 ,10:02
1538,JP Morgan Presents FlowMind for LLMs ,https://youtu.be/GoqhT-Bthiw,Fahd Mirza,112 ,10:02
1539,Fireside Interview with Josh Wilson - Creator of AlwaysReddy ,https://youtu.be/KeY6qPAvyq0,Fahd Mirza,87000,12:12
1540,Complete Langchain Course For Generative AI In 3 Hours ,https://youtu.be/gDQYUaVvH6k,Krish Naik,505 ,12:12
1541,DSPy Assertions: Computational Constraints for Self-Refining LM Pipelines // Arnav Singhvi // Talk ,https://youtu.be/2TJxpyO3ei4,MLOps.community,109 ,13:41
1542,GenAI is Leading the Biggest Human Revolution ,https://youtu.be/gVLYrDPNPzY,Super Data Science: ML &amp; AI Podcast with Jon Krohn,6400,13:41
1543,MambaByte: Token-Free Language Modeling ,https://youtu.be/OMkyocVyEpQ,Sasha Rush 🤗,291 ,2:15:17
1544,Accelerate ML Production with Agents // Salma Mayorquin // AI in Production Conference ,https://youtu.be/qB0AAPCu4o0,MLOps.community,182 ,2:15:17
1545,Shipping LLMs: Buckle Up &amp; Enjoy the Ride // Rex Harris // AI in Production Conference ,https://youtu.be/fda_wMpRP7U,MLOps.community,4500,14:12:04
1546,RAG Evaluation (Answer Hallucinations) | LangSmith Evaluations - Part 13 ,https://youtu.be/GtveKYXYo_0,LangChain,1300,14:12:04
1547,mergekit: Llama 3 Fine-Tuning and Merging ,https://youtu.be/TkKAmwO8oOY,AI Makerspace,1100,19:27
1548,DSU - Unlock the Power of Generative AI with Amazon Neptune | Amazon Web Services ,https://youtu.be/Vw5WucSrObo,Amazon Web Services,53000,19:27
1549,Leave No Context Behind: Efficient Infinite Context Transformers with Infini-attention ,https://youtu.be/Vw5WucSrObo,Yannic Kilcher,5000,25:02
1550,No more Fine-Tuning: Unsupervised ICL+ ,https://youtu.be/V5Q2To6hEr4,Discover AI,50000,25:02
1551,BIG win for Open Source AI | Snowflake Arctic 128 Experts MoE- &quot;Cookbook&quot; create world-class models ,https://youtu.be/V5Q2To6hEr4,Wes Roth,185 ,19:22
1552,Mini-Gemini: MGM 7B to MGM 34B ,https://youtu.be/sY8mBFwp-dw,Fahd Mirza,1300,19:22
1553,Snowflake Arctic - Best LLM for Enterprise AI ,https://youtu.be/85FVwWPg63Q,Fahd Mirza,663 ,26:45
1554,We Won Anthropic's Developer Contest with Our STORM Implementation! (Step-,https://youtu.be/WoJ44CYrElc,TwoSetAI,210 ,26:45
1555,Promptflow | A tool for RAG development ,https://youtu.be/_4hFNzY1iMA,Rajib Deb,19000,5:31
1556,Thomas Dietterich- &quot;What’s Wrong with Large Language Models- and What We Should Be Building Instead&quot; ,https://youtu.be/N5F_1JAtdzU,Johns Hopkins Institute for Assured Autonomy,1200,5:31
1557,777: Generative AI in Practice — with Bernard Marr (@bernardmarr) ,https://youtu.be/CUzpdnG-2SA,Super Data Science: ML &amp; AI Podcast with Jon Krohn,3100,12:18
1558,BEST LLMs for Coding- Long Context- Overall Perform ,https://youtu.be/LvghO60B79k,Discover AI,76000,12:18
1559,LangGraph 101: it's better than LangChain ,https://youtu.be/rACZ6nDMHx0,James Briggs,43000,3:45
1560,NEW Reka Core SOTA Model Does Text- Audio- Video- and more! ,https://youtu.be/C3H4LKmcw1M,Matthew Berman,6100,3:45
1561,RAG Evaluation (Answer Correctness) | LangSmith Evaluations - Part 12 ,https://youtu.be/EXCdKNpUsY4,LangChain,56000,8:30
1562,Stanford CS25: V4 I Overview of Transformers ,https://youtu.be/W2ueLkRJg4U,Stanford Online,3500,8:30
1563,The Biggest AI Fails (yet) ,https://youtu.be/krFjb9jvXy4,AI Search,167 ,6:16
1564,A Multimodal Automated Interpretability Agent ,https://youtu.be/ab4vRwe77vw,Fahd Mirza,386 ,6:16
1565,Efficient finetuning of Llama 3 with FSDP QDoRA ,https://youtu.be/BQ1we0Sf-dE,Fahd Mirza,47000,1:01:02
1566,[ML News] Llama 3 changes the game ,https://youtu.be/zEvHrSd8DJU,Yannic Kilcher,425 ,1:01:02
1567,The Rise of Modern Data Management // Chad Sanderson // MLOps Podcast #226 ,https://youtu.be/zEvHrSd8DJU,MLOps.community,110 ,14:28
1568,Multi-Head Mixture-of-Experts ,https://youtu.be/zq0lr-y8NXg,Arxiv Papers,3600,14:28
1569,MultiModal RAG Application Using LanceDB and LlamaIndex for Video Processing ,https://youtu.be/Vnsyer0ASHo,Sunny Savita,308 ,1:01:08
1570,SnapKV: LLM Knows What You are Looking for Before Generation ,https://youtu.be/K_g9XmybXV0,Arxiv Papers,147 ,1:01:08
1571,Achieving 97% on GSM8K: Deeply Understanding the Problems Makes LLMs Perfect Reasoners ,https://youtu.be/gUJetd1m53g,Arxiv Papers,281 ,7:07
1572,OpenELM: An Efficient Language Model Family with Open-source Training and Inference Framework ,https://youtu.be/uDXusoQRx5o,Arxiv Papers,116000,7:07
1573,Things Required To Master Generative AI- A Must Skill In 2024 ,https://youtu.be/IgM_UKlstOQ,Krish Naik,21000,1:04:55
1574,Step ,https://youtu.be/_DMZ6sP4LE4,Underfitted,386 ,1:04:55
1575,Making Sense of LLMOps // Maria Vechtomova &amp; Başak Tuğçe Eskili // AI in Production Conference ,https://youtu.be/jVU0T_-Aei8,MLOps.community,213 ,8:49
1576,Lessons from Building LLM-based Social Media Products // Faizaan Charania // AI in Production ,https://youtu.be/xWif8_m--Xg,MLOps.community,2400,8:49
1577,Best LLM Pretraining to Real World Application Pipeline with Code Explained ,https://youtu.be/1TZwFGThcFc,Neural Hacks with Vasanth,51000,19:21
1578,12 INSANE Predictions That Will CHANGE THE WORLD (Vinod Khosla) ,https://youtu.be/swCPic00c30,Matthew Berman,56000,19:21
1579,Llama3 + CrewAI + Groq = Email AI Agent ,https://youtu.be/3_ygPgTdowE,Sam Witteveen,5900,16:28
1580,Multimodal RAG Systems: Comprehensive Introduction to Next-Gen AI Technology #multimodal #rag #ai ,https://youtu.be/8INvfiLv-cU,Sunny Savita,797 ,16:28
1581,Generative AI RAN Chatbot | Amazon Web Services ,https://youtu.be/kcd0BTKJuXk,Amazon Web Services,629 ,10:03
1582,Accelerating the Pace of Generative AI Innovation on AWS | Amazon Web Services ,https://youtu.be/SqxBmurAn_U,Amazon Web Services,710 ,10:03
1583,Workday scales machine learning and generative AI features with AWS | Amazon Web Services ,https://youtu.be/zI7JL69Vrhw,Amazon Web Services,5200,30:54
1584,Ryanair- Europe's largest airline- revolutionizes air travel with Amazon Bedrock and Amazon Connect ,https://youtu.be/IlNglM9bKLw,Amazon Web Services,2700,30:54
1585,NYSE trusts Amazon Bedrock to deploy generative AI across world’s largest capital market ,https://youtu.be/i54OXTEcaKA,Amazon Web Services,331 ,50:37
1586,PEAKDEFENCE automates security and compliance with GenAI on AWS (Business) - Cloud Adventures ,https://youtu.be/bdNdo6PTMEA,Amazon Web Services,180 ,50:37
1587,PhysDreamer - AI and Physics Meet ,https://youtu.be/r_UBBfTPcF0,Fahd Mirza,2700,1:06:02
1588,Generative AI Journeys - Fireside Chat with Bridgewater Associates | Amazon Web Services ,https://youtu.be/fyAo-K7uxsk,Amazon Web Services,1200,1:06:02
1589,Amazon Bedrock Customer series: Secure- private- responsible generative AI | Amazon Web Services ,https://youtu.be/5Km-6zZP8IQ,Amazon Web Services,1100,8:27
1590,Amazon Bedrock Customer series: Model choice unlocks endless possibilities | Amazon Web Services ,https://youtu.be/c61tw8DmLsg,Amazon Web Services,1900,8:27
1591,Amazon Bedrock Customer series: Deliver results- elevate user experiences | Amazon Web Services ,https://youtu.be/uzADTZnUA_0,Amazon Web Services,2900,11:13
1592,Amazon Bedrock Customer series: Build and scale generative AI applications | Amazon Web Services ,https://youtu.be/lG-JeZsRMwY,Amazon Web Services,306 ,11:13
1593,Phi-3 Technical Report: A Highly Capable Language Model Locally on Your Phone ,https://youtu.be/fZEE2iEKfV8,Arxiv Papers,90 ,57:20
1594,Preference Fine-Tuning of LLMs Should Leverage Suboptimal- On-Policy Data ,https://youtu.be/e8vg1vin78U,Arxiv Papers,771 ,57:20
1595,Unlocking LLM Potential with your own APIs ,https://youtu.be/7ZLQGbPB1ac,Microsoft Reactor,126 ,17:42
1596,The Instruction Hierarchy: Training LLMs to Prioritize Privileged Instructions ,https://youtu.be/COtmBdS6Y-s,Arxiv Papers,1100,17:42
1597,Install Snowflake Arctic Embed - Low Latency Embedding Model ,https://youtu.be/qaWOwbFw3cs,Fahd Mirza,1300,13:22
1598,Gemini 1.5 PRO vs Lllama3-70B-Instruct: TEST ,https://youtu.be/-mheby36bAg,Discover AI,4400,13:22
1599,MIXTRAL 8x22B: The BEST MoE Just got Better | RAG and Function Calling ,https://youtu.be/lTfhw_9cJqc,Prompt Engineering,159 ,12:43
1600,Next Steps in the AGI Evolution ,https://youtu.be/fKMB5UlVY1E,Super Data Science: ML &amp; AI Podcast with Jon Krohn,5700,12:43
1601,Fine Tune Llama 3 using ORPO ,https://youtu.be/_IAdEzwJxZA,AI Anytime,3900,21:15
1602,Next-Gen AI: RecurrentGemma (Long Context Length) ,https://youtu.be/TAuFH76iz-U,Discover AI,8100,21:15
1603,Q* ,https://youtu.be/WLDehSkSIhY,hu-po,171 ,2:43
1604,Nearest Neighbor Search using a Single GPU - BANG ,https://youtu.be/kzB23CoZG30,Fahd Mirza,3400,2:43
1605,why llama-3-8B is 8 billion parameters instead of 7? ,https://youtu.be/h5agcL6t4uM,Chris Hay,39 ,5:19
1606,Stronger Random Baselines for In-Context Learning ,https://youtu.be/1hIBnsvH6-M,Arxiv Papers,49 ,5:19
1607,HalluciBot: Is There No Such Thing as a Bad Question? ,https://youtu.be/pvrioGzF-6s,Arxiv Papers,79 ,15:07
1608,Towards Reliable Latent Knowledge Estimation in LLMs ,https://youtu.be/8_060Tql5dU,Arxiv Papers,146000,15:07
1609,Build Anything with Llama 3 Agents- Here’s How ,https://youtu.be/KV8B-sD7T0o,David Ondrej,2800,20:14
1610,AI Agents: Looping vs Planning ,https://youtu.be/aO1XvwGT8go,Jason Liu,22000,20:14
1611,A little guide to building Large Language Models in 2024 ,https://youtu.be/HEHUpBO8UVc,ThomWolf,212000,41:44
1612,Sam Altman &amp; Brad Lightcap: Which Companies Will Be Steamrolled ,https://youtu.be/RWo4GDTZIsE,20VC with Harry Stebbings,5800,41:44
1613,LLaMA 3 vs Mistral vs GPT-4:RAG Test Blowout - Which Model Truly Reigns Supreme? ,https://youtu.be/En78C8eXWv8,ML Explained,1500,13:24
1614,Fine-Tune Llama 3 Using ORPO on Your Own Dataset ,https://youtu.be/v21fCCuVMQg,Fahd Mirza,3200,13:24
1615,Fine Tune Multimodal LLM &quot;Idefics 2&quot; using QLoRA ,https://youtu.be/rqiqDqfMtTc,AI Anytime,2100,1:20:41
1616,Introducing Open Source LLM Models - Learn Llama 2 ,https://youtu.be/_cfyERvND0w,DSwithBappy,56 ,1:20:41
1617,Chinchilla Scaling: A replication attempt ,https://youtu.be/1D4YoAUpjlg,Arxiv Papers,1300,22:05
1618,Create Synthetic Dataset from Scratch for Free in Colab - Distilabel ,https://youtu.be/7CXJWnHI05w,Fahd Mirza,118 ,22:05
1619,The Illusion of State in State-Space Models ,https://youtu.be/gnyOMWTZ1LY,Arxiv Papers,254 ,8:16
1620,Is DPO Superior to PPO for LLM Alignment? A Comprehensive Study ,https://youtu.be/WnBSMy2WB-k,Arxiv Papers,283 ,8:16
1621,Mixture of Attention - Swap Face Body in Image with AI ,https://youtu.be/lcoBJBNJZQM,Fahd Mirza,80000,3:56
1622,LLAMA-3 🦙: EASIET WAY To FINE-TUNE ON YOUR DATA 🙌 ,https://youtu.be/mK14StriSOg,Prompt Engineering,1700,3:56
1623,Llama 3 - The Best Open Source Model Easy Finetune and Inference with Architecture Explanation ,https://youtu.be/KRPZ1rcb4Mw,Neural Hacks with Vasanth,45000,9:13
1624,How To Use Meta Llama3 With Huggingface And Ollama ,https://youtu.be/BuGeY4MMTLs,Krish Naik,113000,9:13
1625,Reliable- fully local RAG agents with LLaMA3 ,https://youtu.be/VDZWZhTBU-w,LangChain,173 ,2:44
1626,BLINK - Multimodal LLM Can See but Not Perceive ,https://youtu.be/-kPb8AN-8Mg,Fahd Mirza,17000,2:44
1627,Flow Engineering with LangChain/LangGraph and CodiumAI ,https://youtu.be/tCWPqi9Pbmg,LangChain,1000,33:16
1628,Create Code Interpreter with Llama 3 for Free ,https://youtu.be/M7Jd19K_mws,Fahd Mirza,183 ,33:16
1629,Beyond AGI- Can AI Help Save the Planet? // Patrick Beukema // MLOps Podcast #225 ,https://youtu.be/PrZs1F1dI10,MLOps.community,205 ,26:29
1630,Toward Self-Improvement of LLMs via Imagination- Searching- and Criticizing ,https://youtu.be/Eg0stFnlB7A,Arxiv Papers,187 ,26:29
1631,From R to Q: Your Language Model is Secretly a Q-Function ,https://youtu.be/9SgBPfU_J3I,Arxiv Papers,345 ,2:37:05
1632,Function Hub for AI Agents - Install Locally - Upsonic Tiger ,https://youtu.be/_zgOvae-ccY,Fahd Mirza,14000,2:37:05
1633,Advance RAG control flow with Mistral and LangChain: Corrective RAG- Self-RAG- Adaptive RAG ,https://youtu.be/c5D45H3xgYQ,Mistral AI,16000,11:02
1634,Llama 3 RAG Demo with DSPy Optimization- Ollama- and Weaviate! ,https://youtu.be/C9jVxOLwcgY,Connor Shorten,5600,11:02
1635,4 Skills You Need to Be a Full-Stack Data Scientist ,https://youtu.be/hlVBbV_Lezw,Shaw Talebi,2300,50:25
1636,Summary Evaluators | LangSmith Evaluations - Part 11 ,https://youtu.be/hlVBbV_Lezw,LangChain,20000,50:25
1637,8-Building Gen AI Powered App Using Langchain And Huggingface And Mistral ,https://youtu.be/BUYVlUqVP4w,Krish Naik,280 ,1:00:30
1638,Megalodon 7B - Alternate of Transformers and State Space Models ,https://youtu.be/Zn7S5mLfkrc,Fahd Mirza,1100,1:00:30
1639,Introduction to AI Agents with Milvus and LlamaIndex ,https://youtu.be/sbZEvr-ROF8,Zilliz,24000,9:41
1640,Fine-Tune Llama 3 Model on Custom Dataset - Step-,https://youtu.be/nPIGVaYPQAg,Fahd Mirza,78 ,9:41
1641,BLINK: Multimodal Large Language Models Can See but Not Perceive ,https://youtu.be/dnrX5amf9_0,Arxiv Papers,43 ,13:48
1642,Reka Core- Flash- and Edge: A Series of Powerful Multimodal Language Models ,https://youtu.be/vOA9JSDPJs0,Arxiv Papers,103 ,13:48
1643,TRIFORCE: Lossless Acceleration of Long Sequence Generation with Hierarchical Speculative Decoding ,https://youtu.be/ryKZT4K1Ds0,Arxiv Papers,1600,11:21
1644,Multi-modal MoonDream API - Mixtral 8x22B Instruct - Llama 3 ,https://youtu.be/3epDk3lf3n8,Trelis Research,795 ,11:21
1645,How to Use LLM Function Calling Locally for Free ,https://youtu.be/l4KS9o2yXGo,Fahd Mirza,999 ,1:31:57
1646,How to do RAG in OpenAI GPT4 Locally with File Search ,https://youtu.be/YngD5VakkSY,Fahd Mirza,1400,1:31:57
1647,Complete Automated Local Setup for AI (ML-DL-GenAI) Development With Vscode- Git- Anaconda &amp; Docker ,https://youtu.be/2Y7PZx7wmBA,Sunny Savita,16000,17:09
1648,WizardLM 2 - First Open Model Outperforming GPT-4 ,https://youtu.be/i-txsBoTJtI,Prompt Engineering,117 ,17:09
1649,Many-Shot In-Context Learning ,https://youtu.be/W31UMLHcqc4,Arxiv Papers,58 ,9:37
1650,Fewer Truncations Improve Language Modeling ,https://youtu.be/2-SPH9hIKT8,Arxiv Papers,1700,9:37
1651,Mighty New TransformerFAM (Feedback Attention Mem) ,https://youtu.be/G8T1O81W96Y,Discover AI,356 ,13:23
1652,How to Create Scalable and Distributed Workflows with DVC and Ray ,https://youtu.be/sbKz-f05QZY,DVCorg,435 ,13:23
1653,Graphs and Language // Louis Guitton // AI in Production Lightning Talk ,https://youtu.be/Tj8l2i3uf0A,MLOps.community,572 ,48:59
1654,A Quick &amp; Practical Introduction to Prompt Engineering ,https://youtu.be/8GWmu99-sjA,Automata Learning Lab,371 ,48:59
1655,Berkeley Function Calling Leaderboard for LLMs ,https://youtu.be/x4-YyYTb72Y,Fahd Mirza,5000,6:42
1656,Google just Solved the Context Window Challenge for Language Models ? ,https://youtu.be/BNPG8uQiGNQ,What's AI by Louis-François Bouchard,128 ,6:42
1657,AI For Marketers #13 ,https://youtu.be/UkueW4LMYS8,AI User Group,657 ,36:50
1658,Don't Deploy RAG Without This! Embedding Quantization (~4 lines of code) ,https://youtu.be/UkueW4LMYS8,TwoSetAI,778 ,36:50
1659,Innovative Gen AI Applications: Beyond Text // MLOps Mini Summit #5 ,https://youtu.be/6Z8S4nynH5w,MLOps.community,31000,42:14
1660,Hugging Face got hacked ,https://youtu.be/-YZ-YZ05VXU,Yannic Kilcher,402 ,42:14
1661,Enabling Efficient Trillion Parameter Scale Training for Deep Learning Models // Tunji Ruwase ,https://youtu.be/RWNz6ZsYTFo,MLOps.community,4000,17:47
1662,Data Agents with LlamaIndex ,https://youtu.be/aQmoog_s8HE,AI Makerspace,56000,17:47
1663,Retrieval Augmented Generation (RAG) Explained: Embedding- Sentence BERT- Vector Database (HNSW) ,https://youtu.be/bTokYBLnFp8,Umar Jamil,97000,14:53
1664,Deploy ML models with FastAPI- Docker- and Heroku | Tutorial ,https://youtu.be/LA-hZDnn5Hc,AssemblyAI,5300,14:53
1665,Mamba- SSMs &amp; S4s Explained in 16 Minutes ,https://youtu.be/-ROS6gfYIts,Vivian C.,4900,14:18
1666,Setup vLLM with T4 GPU in Google Cloud ,https://youtu.be/LjAEAkjgefs,CodeJet,3400,14:18
1667,Chain of Thought with Retrieval for LLMs ,https://youtu.be/eBjxz7qrNBs,Vivek Haldar,786 ,10:21
1668,AI Papers Review - CRAG- RAPTOR RAG - Diving into RAG and AI Agents - S01 ,https://youtu.be/ckYc-g46nss,PolyAgent,86 ,10:21
1669,Self-playing Adversarial Language Game Enhances LLM Reasoning ,https://youtu.be/1YKb0ZIZBnI,Arxiv Papers,188000,14:50
1670,CrewAI Tutorial: Complete Crash Course for Beginners ,https://youtu.be/PO-I6LLu7Qo,codewithbrandon,47000,14:50
1671,How to Create FULLY Autonomous AI Research Agents ,https://youtu.be/cxVqnLB-au4,Jack Roberts,7000,11:55
1672,AWQ for LLM Quantization ,https://youtu.be/wEj29zDFstY,MIT HAN Lab,2200,11:55
1673,Integrate Google Search into your LLM | LangChain Agents | Web Search | Python | HuggingFace ,https://youtu.be/sgnrL7yo1TE,Eduardo Vasquez,14000,24:53
1674,An Introduction to LLM Agents | From OpenAI Function Calling to LangChain Agents ,https://youtu.be/1h3_h8t3L14,Automata Learning Lab,48000,24:53
1675,I Automated My YouTube Channel With CrewAI [Free Source Code Included] ,https://youtu.be/xm9devSQEqU,codewithbrandon,975 ,10:22
1676,Idefics2 and The Cauldron - Good Model for OCR ,https://youtu.be/zMgrHzs_cAg,Fahd Mirza,52000,10:22
1677,Unlock AI Agent real power?! Long term memory &amp; Self improving ,https://youtu.be/RZ2Vu8z-P1Q,AI Jason,741 ,53:32
1678,AutoVector | Chat With Your Both SQL and Free Text Data Simultaneously ,https://youtu.be/RZ2Vu8z-P1Q,MG,6600,53:32
1679,How to convert PDF DOCX to Structured TXT Formats for RAG! (UNSTRUCTURED Tutorial) ,https://youtu.be/ThyV188RYao,1littlecoder,138 ,9:53
1680,Pi Day 2024 AWS OnAir: Comparing Amazon S3 Standard and S3 Express One Zone for ML model training ,https://youtu.be/YL9zey9NLlw,AWS Events,113 ,9:53
1681,Pi Day 2024 AWS OnAir: AWS Training Certification - Learn Generative AI For Developers ,https://youtu.be/BA9kcVofRNI,AWS Events,124 ,57:22
1682,Pi Day 2024 AWS OnAir: Accelerating an Amazon SageMaker ML model with Amazon FSx for Lustre ,https://youtu.be/BA9kcVofRNI,AWS Events,53 ,57:22
1683,Pi Day 2024 AWS OnAir; Be your own best auditor for generative AI ,https://youtu.be/fiTc-ohDwMk,AWS Events,313 ,17:06
1684,Pi Day 2024 AWS OnAir: Fine-tuning &amp; Retrieval-Augmented Generation (RAG) for generative AI ,https://youtu.be/tOoj9TQDSAo,AWS Events,171 ,17:06
1685,Pi Day 2024 AWS OnAir: Accelerate the data path to compute for generative AI | AWS Events ,https://youtu.be/ve37vJL3uvw,AWS Events,70 ,10:10
1686,Reducing hallucination in structured outputs via Retrieval-Augmented Generation ,https://youtu.be/MEKslMfr9W0,Arxiv Papers,1700,10:10
1687,How to Convert Websites into LLM Ready Data ,https://youtu.be/z6Zssf-yu0k,Fahd Mirza,1800,13:26
1688,Reduce GPT-4 costs ,https://youtu.be/YMXaMktbRFM,Rithesh Sreenivasan,933 ,13:26
1689,775: What will humans do when machines are vastly more intelligent? — with Aleksa Gordić ,https://youtu.be/iCCdD4ohNi0,Super Data Science: ML &amp; AI Podcast with Jon Krohn,243 ,16:39
1690,Compression Represents Intelligence Linearly ,https://youtu.be/OvzSyaN3zKg,Arxiv Papers,59 ,16:39
1691,Learn Your Reference Model for Real Good Alignment ,https://youtu.be/ww4SAXmUwlE,Arxiv Papers,2300,13:23
