,title,link,channel,views,length
855,Avoiding rolling hot keys with Amazon DynamoDB - Amazon DynamoDB Nuggets | Amazon Web Services ,https://youtu.be/M3CL01ZmYIM,Amazon Web Services,448 ,15:23
856,AWS re:Inforce 2024 - Gen AI–powered Lambda code remediation using Amazon Inspector (APS322) ,https://youtu.be/38ACfUhv6Tc,AWS Events,1000,15:23
857,AWS re:Inforce 2024 - Navigating privacy and compliance while securing gen AI applications (GAI201) ,https://youtu.be/0Xp7K2rHcZg,AWS Events,9400,4:55
858,MoME Reduces LLM Hallucinations ,https://youtu.be/pyolU3Sk05w,Elvis Saravia,17000,4:55
859,Building Multi-Modal Search with Vector Databases ,https://youtu.be/LDh5MdR-CPQ,DeepLearningAI,2000,30:20
860,Indexing in Vector Databases ,https://youtu.be/RVMpm86equc,Fahd Mirza,19000,30:20
861,How to Choose a Vector Database ,https://youtu.be/YOClk49Cy2o,Pinecone,6500,6:09
862,Vector Database 101: A Crash Course ,https://youtu.be/nGNdlPOWHHc,Zilliz,18000,6:09
863,Understanding How Vector Databases Work! ,https://youtu.be/tg-ZjNl3OCg,The ML Tech Lead!,22000,4:47
864,What is a vector database? Why are they critical infrastructure for #ai #applications? ,https://youtu.be/VCPx0nUit80,Pinecone,28000,4:47
865,Complete Tutorial on Vector Database - Learn ChromaDB- Pinecone &amp; Weaviate | Generative AI ,https://youtu.be/T3tonLXqoy8,DSwithBappy,23000,47:04
866,Building AI Agents from Scratch- Simplified ,https://youtu.be/WIm2VAVmnfs,Data Centric,3900,47:04
867,Build AI Agents without Coding using Open Source Dify AI ,https://youtu.be/i-fM0jWN9ZU,AI Anytime,114 ,11:26
868,MELTing point - Mobile Evaluation of Language Transformers ,https://youtu.be/eFcHQ_6-qoI,Fahd Mirza,313 ,11:26
869,Llama-3 Spellbound Instruct Tuning-Free - Multi-Turn Story Roleplay - Install Locally ,https://youtu.be/9iWcip5oO8Q,Fahd Mirza,57 ,8:16
870,Ad Auctions for LLMs via Retrieval Augmented Generation ,https://youtu.be/9HhcFiSgLok,Arxiv Papers,4000,8:16
871,Build a Research Assistant AI Agent using Crew AI ,https://youtu.be/-eNfRtGqU4o,AI Anytime,220 ,25:49
872,The Shortcomings of RLHF for LLM Fine-Tuning ,https://youtu.be/GjNMvsGafmA,Super Data Science: ML &amp; AI Podcast with Jon Krohn,14000,25:49
873,NEW TextGrad ,https://youtu.be/ijCjKnbQgXc,Discover AI,388 ,35:15
874,Sorry We Don't Know How LLMs Work - Extracting Concepts from GPT-4 ,https://youtu.be/6HO4gVW5F7E,Fahd Mirza,1200,35:15
875,Shorter Sequence Lengths Using Matryoshka Models ,https://youtu.be/jHx4psu1C0k,Tunadorable,953 ,18:51
876,Generative AI Journeys - Fireside Chat with NinjaTech AI | Amazon Web Services ,https://youtu.be/QVIYDhN4nxg,Amazon Web Services,1700,18:51
877,Advanced RAG 04 - Reranking with Cross Encoders- and Cohere API ,https://youtu.be/3tndVt8W-Tk,Sunny Savita,771 ,11:37
878,Python Validate User Inputs in 20 Minutes ,https://youtu.be/Bs36gxpKcqk,Ryan &amp; Matt Data Science,20000,11:37
879,Building a Generative UI App With LangChain Python ,https://youtu.be/3WUobZryyok,LangChain,424 ,6:05
880,Amazon DynamoDB Well-Architected Lens - Security | Amazon Web Services ,https://youtu.be/swM4bQMW0EQ,Amazon Web Services,1200,6:05
881,AWS re:Inforce 2024 - Securely accelerating generative AI innovation (SEC203-INT) ,https://youtu.be/Yo-AzVpWrRg,AWS Events,77 ,1:21:53
882,The Challenge of Establishing AI Quality Standards // Cody Peterson // MLOps podcast #234 ,https://youtu.be/6yLmbL1o3Ow,MLOps.community,459 ,1:21:53
883,[LLM News] Apple Intelligence- Dream Machine- Self Teaching- AI Personality- Function Calling Course ,https://youtu.be/035I2WKj5F0,Elvis Saravia,136 ,32:17
884,An Image is Worth More Than 1616 Patches: Exploring Transformers on Individual Pixels ,https://youtu.be/wc3Lh-eiNBM,Arxiv Papers,133 ,32:17
885,Why Warmup the Learning Rate? Underlying Mechanisms and Improvements ,https://youtu.be/8KrTO9bS91s,Arxiv Papers,225 ,24:12
886,ADASYN oversampling algorithm explained ,https://youtu.be/QKNVPHm3G70,Data Science in your pocket,978 ,24:12
887,Traceability and Observability in Multi-Step LLM Systems | Langfuse | LLMOps ,https://youtu.be/3FC3h6zaceQ,LLMOps Space,1400,14:13
888,Python Web Apps: FastAPI ,https://youtu.be/N0sCGXSs-RA,Microsoft Reactor,57000,14:13
889,MoA BEATS GPT4o With Open-Source Models!! (With Code!) ,https://youtu.be/eHxxovdhktM,Matthew Berman,263 ,12:48
890,AWS re:Inforce 2024 - Generative AI to identify potential risks in architectural diagrams (ARC222) ,https://youtu.be/4qmHMN8cr0w,AWS Events,419 ,12:48
891,AWS re:Inforce 2024 - How to protect generative AI models using GenAI Secure (DAP322-S) ,https://youtu.be/f2g24bt_P6Q,AWS Events,114 ,11:37
892,AWS re:Inforce 2024 - Shielding innovation: Safeguarding cloud and AI development (SEC222-S) ,https://youtu.be/v4Wnvn6ivmM,AWS Events,526 ,11:37
893,How to Build Production-Ready AI Models for Manufacturing // [Exclusive] LatticeFlow Roundtable ,https://youtu.be/Qks4UEsRwl0,MLOps.community,406 ,53:20
894,No Lies Detected: how to make your AI more useful ,https://youtu.be/J-tg6D7lBEg,Microsoft Reactor,589 ,53:20
895,AWS re:Inforce 2024 - Building a secure MLOps pipeline- featuring PathAI (APS302) ,https://youtu.be/SXvpKLiqRxM,AWS Events,716 ,12:20
896,AWS re:Inforce 2024 - Secure your APIs the Well-Architected way from foundation to perimeter (NIS305 ,https://youtu.be/Tr5Y3NFM6hE,AWS Events,529 ,12:20
897,AWS re:Inforce 2024 - Keeping your code secure (APS401) ,https://youtu.be/ZFbaA9eM0uo,AWS Events,588 ,23:39
898,AWS re:Inforce 2024 - Outpacing threats w/ CrowdStrike- Anthropic Claude &amp; Amazon Bedrock (TDR202-S) ,https://youtu.be/Rg0c7wS7vSI,AWS Events,1300,23:39
899,Evaluate LLM Systems &amp; RAGs: Choose the Best LLM Using Automatic Metrics on Your Dataset ,https://youtu.be/d3uoLbfBPkw,Venelin Valkov,415 ,30:58
900,AWS re:Inforce 2024 - Simplify compliance and security investigations with generative AI (GRC204-NEW ,https://youtu.be/95prjv2EEXA,AWS Events,117 ,30:58
901,AWS re:Inforce 2024 - Preserving privacy on data collaboration with AWS Clean Rooms (COM221) ,https://youtu.be/S_4XflTsjZE,AWS Events,127 ,1:01:04
902,AWS re:Inforce 2024 - How AWS Partners use observability to strengthen customer security (CFS227) ,https://youtu.be/z3j8U1CUD0o,AWS Events,499 ,1:01:04
903,AWS re:Inforce 2024 - How organizations are actually applying AWS security best practices (COM224) ,https://youtu.be/YFXzKuyxwWY,AWS Events,556 ,1:01:18
904,AWS re:Inforce 2024 - Elevate your AWS security with CloudFastener- assisted ,https://youtu.be/WWsmxrnyLKc,AWS Events,601 ,1:01:18
905,AWS re:Inforce 2024 - Cybersecurity w/ PwC: Compliance- generative AI &amp; cost optimization (GRC226-S) ,https://youtu.be/Ph4-m0hFsvU,AWS Events,449 ,46:03
906,AWS re:Inforce 2024 - Use AWS WAF to help avoid cost-prohibitive traffic in LLM apps (NIS221) ,https://youtu.be/KG2C-KsiNyI,AWS Events,1100,46:03
907,AWS re:Inforce 2024 - Reinforce AI security: Protecting AI applications- models- and data (NIS202-S) ,https://youtu.be/vRFSVGaNaG4,AWS Events,494 ,45:18
908,AWS re:Inforce 2024 - How H2O.ai bridges runtime &amp; build time intelligence for security (NIS307-S) ,https://youtu.be/95Qwsi5cs78,AWS Events,1000,45:18
909,AWS re:Inforce 2024 - Building a secure end-to-end generative AI application in the cloud (NIS321) ,https://youtu.be/qxyjkfzD-kE,AWS Events,1300,7:23
910,AWS re:Inforce 2024 - Mitigate OWASP Top 10 for LLM risks with a Zero Trust approach (GAI323) ,https://youtu.be/XyNBA0KQ8eA,AWS Events,625 ,7:23
911,AWS re:Inforce 2024 - Protect your generative AI applications against jailbreaks (GAI321) ,https://youtu.be/X4RqkxjdiS0,AWS Events,1100,10:06
912,AWS re:Inforce 2024 - Safeguarding sensitive data used in generative AI with RAG (DAP223) ,https://youtu.be/5-LDbn9jdRM,AWS Events,934 ,10:06
913,OpenAI Prompt Engineering ,https://youtu.be/HWs2TXo1uaI,Microsoft Reactor,166 ,35:21
914,SAMBA: Simple Hybrid State Space Models for Efficient Unlimited Context Language Modeling ,https://youtu.be/fH0wTfdIlGg,Arxiv Papers,833 ,35:21
915,What If We Recaption Billions of Web Images with LLaMA-3? ,https://youtu.be/fH0wTfdIlGg,Arxiv Papers,1200,14:43
916,Advance RAG 05 - Merger Retriever and LongContextReorder | Lost in Middle Phenomenon ,https://youtu.be/LjCU4V2da3U,Sunny Savita,67 ,14:43
917,Tomek's Link Undersampling algorithm explained ,https://youtu.be/0IReZ4I5W54,Data Science in your pocket,19000,16:01
918,Mesop: Google's UI Framework for Building Web Application ,https://youtu.be/I8sZFvGhDIs,Prompt Engineering,87 ,16:01
919,Multiple-Stage Optimization Leads to Sub-Optimal LLMs ,https://youtu.be/tK762dthlLU,Super Data Science: ML &amp; AI Podcast with Jon Krohn,1500,50:58
920,How to Build Database AI Agents - Hands on Easy Tutorial ,https://youtu.be/H2DDISTgm7U,Fahd Mirza,4700,50:58
921,Learn How he reproduced Karpathy's GPT-2 for Audio!!! ,https://youtu.be/68IDtv2nQKo,1littlecoder,754 ,15:29
922,Monitoring Agents with AgentOps ,https://youtu.be/frQAA9DMQeM,AI Makerspace,2900,15:29
923,Hella Brand New AI Papers - June 15- 2024 ,https://youtu.be/M1ADv0xweZQ,Tunadorable,335 ,22:24
924,Build Local LLM Agentic Apps with LLMFlex ,https://youtu.be/4pgLHxphWTk,Fahd Mirza,298 ,22:24
925,Humans Vs AI Models on AGI Tests Using ARC-AGI - Try Now Locally ,https://youtu.be/oElg6YV4KWc,Fahd Mirza,66 ,39:50
926,Unpacking DPO and PPO: Disentangling Best Practices for Learning from Preference Feedback ,https://youtu.be/lkPUVwYLO1g,Arxiv Papers,139 ,39:50
927,An Empirical Study of Mamba-based Language Models ,https://youtu.be/aypyGPoKrr4,Arxiv Papers,7000,5:40
928,Mamba 2 - Transformers are SSMs: Generalized Models and Efficient Algorithms Through SSS Duality ,https://youtu.be/9RCq-vN3jzA,Gabriel Mongaras,1000,5:40
929,Husky - A Unified Open-Source Language Agent for Multi-Step Reasoning ,https://youtu.be/uoTwBF266IY,Fahd Mirza,27000,7:00
930,Vision Transformer Basics ,https://youtu.be/k1NaKVkB_wg,Samuel Albanie,2200,7:00
931,Mixture-of-Agents (MoA) Enhances Large Language Model Capabilities ,https://youtu.be/eOmgoNIC7a0,AI Papers Academy,1600,14:02
932,What is MatMul-free Language Modeling ,https://youtu.be/DAN86Oqe07A,Fahd Mirza,407 ,14:02
933,AWS re:Inforce 2024 - Securing generative AI: Privacy and compliance considerations (GAI222) ,https://youtu.be/eDr_F3JrS7E,AWS Events,430 ,10:40
934,AWS re:Inforce 2024 - Generative AI skills and culture for security organizations (GAI121) ,https://youtu.be/L1h2OdeDKfo,AWS Events,701 ,10:40
935,AWS re:Inforce 2024 - 5 ways generative AI can enhance cybersecurity (GAI324) ,https://youtu.be/WbfVI7Hu9Ls,AWS Events,8600,14:51
936,Function Calling with OpenAI APIs | A Crash Course ,https://youtu.be/Pxx_euJiA0U,Elvis Saravia,90 ,14:51
937,Beyond Model Collapse: Scaling Up with Synthesized Data Requires Reinforcement ,https://youtu.be/nRP-frj5FmI,Arxiv Papers,811 ,1:15:44
938,Thread: AI-Powered Jupyter Notebook - Install Locally ,https://youtu.be/fZ5tumMJSxE,Fahd Mirza,93 ,1:15:44
939,How RLHF Aligns LLMs with Human Desires ,https://youtu.be/IYpsbwJmN7c,Super Data Science: ML &amp; AI Podcast with Jon Krohn,196 ,18:19
940,Estimating the Hallucination Rate of Generative AI ,https://youtu.be/E-kisR5NRKs,Arxiv Papers,847 ,18:19
941,Atomic Agents - Building AI Agents Atomically ,https://youtu.be/Tkds301xtHI,Fahd Mirza,312 ,13:15
942,AWS re:Inforce 2024 - Build- deploy- and manage your applications securely with AWS (NIS225) ,https://youtu.be/Tkds301xtHI,AWS Events,226 ,13:15
943,AWS re:Inforce 2024 - Keeping people away from data: A generative AI use case (GAI326) ,https://youtu.be/sbz3w9nFV0E,AWS Events,324 ,58:16
944,AWS re:Inforce 2024 - Mind your business: Secure your generative AI application on AWS (GAI322) ,https://youtu.be/GjNf3Zvjofc,AWS Events,1600,58:16
945,Reinforcement Learning from Human Feedback (RLHF) &amp; Direct Preference Optimization (DPO) Explained ,https://youtu.be/5til6Xri8xI,Entry Point AI,238 ,36:27
946,AWS re:Inforce 2024 - Balancing responsible AI: Privacy and data protection on AWS (GAI223) ,https://youtu.be/1zVMCmyQ2nE,AWS Events,878 ,36:27
947,AWS re:Inforce 2024 - Accelerate securely: The Generative AI Security Scoping Matrix (APS201) ,https://youtu.be/Ipa0y4rNB4M,AWS Events,849 ,6:50
948,Logits and Loss: Training and Fine-Tuning LLMs ,https://youtu.be/WPcNHYWS344,AI Makerspace,344 ,6:50
949,AWS re:Inforce 2024 - How Deloitte helps navigate generative AI compliance for customers (GRC221) ,https://youtu.be/7w9Bp-SAEHQ,AWS Events,612 ,14:44
950,AWS re:Inforce 2024 - Accelerating auditing and compliance for generative AI on AWS (GRC302) ,https://youtu.be/EtnSexLgQMc,AWS Events,754 ,14:44
951,Import Custom Models Into Amazon Bedrock - AWS OnAir S5 ,https://youtu.be/brLTY26etxw,AWS Events,179 ,52:51
952,Streamline ML governance with Amazon DataZone and Amazon SageMaker | AWS OnAir-S05 ,https://youtu.be/vsqKGZT8Qn8,AWS Events,179 ,52:51
953,AWS re:Inforce 2024 - Diversity and accessibility in the age of generative AI (ABW101) ,https://youtu.be/Cf0Jidg-pDc,AWS Events,1000,46:16
954,AWS re:Inforce 2024 - The building blocks of a culture of security (SEC202-INT) ,https://youtu.be/ci-aYGFnz6c,AWS Events,238 ,46:16
955,Assessing security risk in AI model using Microsoft Counterfit ,https://youtu.be/brKi2Lf8-8c,Microsoft Reactor,197 ,7:48
956,AWS re:Inforce 2024 - Fine-tune the COE process with generative AI (ARC221) ,https://youtu.be/-CTA79oZk9s,AWS Events,311 ,7:48
957,AWS re:Inforce 2024 - Security- and AI... so happy together? (CFS222) ,https://youtu.be/t_77sBGIG6w,AWS Events,78 ,6:00
958,AI For Marketers #15 ,https://youtu.be/p0I-hwZSWMs,AI User Group,189 ,6:00
959,AWS re:Inforce 2024 - Protecting data in generative AI applications with Amazon Bedrock (COM223) ,https://youtu.be/eSld2AkT3iI,AWS Events,165 ,12:57
960,AWS re:Inforce 2024 - Manual versus automated penetration testing on AWS (COM225) ,https://youtu.be/lY42IoXwk_I,AWS Events,280 ,12:57
961,AWS re:Inforce 2024 - Developer’s security survival guide (COM321) ,https://youtu.be/jSYih32JPnA,AWS Events,468 ,8:14
962,AWS re:Inforce 2024 - Accelerating privacy &amp; security in AI with Amazon Bedrock and Tines (TDR324-S) ,https://youtu.be/qe186Xamhac,AWS Events,81 ,8:14
963,State Soup: In-Context Skill Learning- Retrieval and Mixing ,https://youtu.be/2rVIy5pT4Xo,Arxiv Papers,181 ,1:24:37
964,AWS re:Inforce 2024 - Securing AI models and using AI to maintain compliance (SEC321-S) ,https://youtu.be/KI4YxEM6iDM,AWS Events,204 ,1:24:37
965,Large Language Models Must Be Taught to Know What They Don't Know ,https://youtu.be/Zazp0kAQ7tA,Arxiv Papers,459 ,13:36
966,AWS re:Inforce 2024 - Elevating security investigations with generative AI (TDR329) ,https://youtu.be/ea36pxxh6zA,AWS Events,1200,13:36
967,The Secret Weapons Revolutionizing Customer Support: RAG + Knowledge Graphs ,https://youtu.be/nSrj1J6ODoM,TwoSetAI,1300,6:48
968,AWS re:Inforce 2024 - Build responsible AI applications with Guardrails for Amazon Bedrock (GRC325) ,https://youtu.be/AOi6uomSHY0,AWS Events,6600,6:48
969,A Machine Learning roadmap (the one I recommend to my students) ,https://youtu.be/G3YjjAbKZ-Y,Underfitted,633 ,13:50
970,791: Reinforcement Learning from Human Feedback (RLHF) — with Dr. Nathan Lambert ,https://youtu.be/iB8FWR9aD5Q,Super Data Science: ML &amp; AI Podcast with Jon Krohn,63 ,13:50
971,Distributional Preference Alignment of LLMs via Optimal Transport ,https://youtu.be/CC-CboRGaDo,Arxiv Papers,162 ,13:07
972,Attention as a Hypernetwork ,https://youtu.be/MKimX011yOo,Arxiv Papers,2500,13:07
973,Retrieval Heads Mechanistically Explain Long-Context Factuality ,https://youtu.be/CA2AXfWWdpA,Tunadorable,5400,17:06
974,Data Scientists Automated with AI!!! ,https://youtu.be/a4J6tHqyw7E,1littlecoder,1700,17:06
975,The A to Z of Prompt Engineering - Advanced Prompt Engineering Techniques ,https://youtu.be/tc92qoRFMPA,Microsoft Reactor,394 ,16:42
976,From Robotics to Recommender Systems // Miguel Fierro // MLOps Podcast #240 ,https://youtu.be/ga4kaACFlJg,MLOps.community,1000,16:42
977,Best Practices for GenAI applications on AWS - RAG pipeline Eval - Part 4 | Amazon Web Services ,https://youtu.be/T2usmMiISrs,Amazon Web Services,2400,21:23
978,How to Make your AI Application Highly Scalable? ,https://youtu.be/JzvKJ9ytz98,Mervin Praison,1500,21:23
979,Informer attention code -  FROM SCRATCH! ,https://youtu.be/88rS6ePHOpk,CodeEmporium,6000,26:06
980,RAG explained step-,https://youtu.be/8UAApfmrTQU,Discover AI,8400,26:06
981,Movie Recommender System in Python with LLMs ,https://youtu.be/TQ6Bz-Az0yI,NeuralNine,3000,9:30
982,My TOP TEN TIPS for Fine-tuning ,https://youtu.be/mYF1cFzxusE,Trelis Research,1800,9:30
983,The future of AI agents is WebAssembly (get started now) ,https://youtu.be/1tEV5INi5Lk,Chris Hay,61 ,35:41
984,Why Has Predicting Downstream Capabilities of Frontier AI Models with Scale Remained Elusive? ,https://youtu.be/E-YnoVBN5NM,Arxiv Papers,717 ,35:41
985,Mixture-of-Agents Enhances Large Language Model Capabilities ,https://youtu.be/7wF9RMGno28,Arxiv Papers,7700,26:06
986,GROKKED LLM beats RAG Reasoning (Part 3) ,https://youtu.be/pRKFsJqn0eQ,Discover AI,1000,26:06
987,[LLMS News] AGI Predictions- Mamba-2- NLLB- GPT-4 Features- Structured LLM Generation- KLING ,https://youtu.be/P-RHhkPtIGE,Elvis Saravia,33000,5:35
988,LangGraph Simplified: Master Custom AI Agent Creation ,https://youtu.be/RBhfwJZSBWM,Data Centric,1000,5:35
989,What is Grokking and Over-Fitting of an LLM ,https://youtu.be/a6VWF_DpWDU,Fahd Mirza,215 ,8:02
990,Alice in Wonderland: Simple Tasks Showing Complete Reasoning Breakdown in State-Of-the-Art LLMs ,https://youtu.be/DvvypUqdjXo,Arxiv Papers,91 ,8:02
991,Improving Alignment and Robustness with Short Circuiting ,https://youtu.be/7zbyR_Hty1U,Arxiv Papers,37000,9:30
992,I Found The Best Alternative To ChatGPT- Get The Power Of ALL LLM Models ,https://youtu.be/McaI5kkQySU,Krish Naik,2700,9:30
993,Fine-Tune LLM in VS Code AI Toolkit Locally on Custom Dataset ,https://youtu.be/-UNY-u1zsCY,Fahd Mirza,548 ,13:35
994,Autonomous Agents for Dummies | Groq and CrewAI ,https://youtu.be/eUOb3iS4nOM,AI With Tarun,460 ,13:35
995,Uber's Michelangelo: Strategic AI Overhaul and Impact // MLOps podcast #239 ,https://youtu.be/dh_am72ykAQ,MLOps.community,1300,58:30
996,New prompting method uses thought templates | Buffer of Thoughts ,https://youtu.be/V3fhgpgLuJg,Elvis Saravia,89 ,58:30
997,Cloud Native Artificial Intelligence ,https://youtu.be/SyO8c0fM6ZU,AI User Group,1600,42:35
998,Multi-Agent Crews with CrewAI ,https://youtu.be/wEmO00ADppw,AI Makerspace,81 ,42:35
999,Block Transformer: Global-to-Local Language Modeling for Fast Inference ,https://youtu.be/gNY06JM6m8U,Arxiv Papers,299 ,6:29
1000,Buffer of Thoughts: Thought-Augmented Reasoning with Large Language Models ,https://youtu.be/6rWtZGF5LS8,Arxiv Papers,3800,6:29
1001,DSPy: Advanced Prompt Engineering? ,https://youtu.be/B0phjAyaY3Q,AI Makerspace,6900,1:14:14
1002,Gemini Flash is SURPRISINGLY Good for Agents and Function Calling ,https://youtu.be/coBTzvQsPpQ,Prompt Engineering,18000,1:14:14
1003,Why are vector databases so FAST? ,https://youtu.be/epidA1fBFtI,Underfitted,26000,16:11
1004,Building open source LLM agents with Llama 3 ,https://youtu.be/lJDxkjE9SSY,LangChain,1400,16:11
1005,Getting started with MLOps on Amazon SageMaker for generative AI | Amazon Web Services ,https://youtu.be/KwF_ZB29ZB0,Amazon Web Services,2800,47:42
1006,Advanced RAG 03 - Reranking with Sentence Transformers and BM25 API ,https://youtu.be/t-vnrD8o6TA,Sunny Savita,283 ,47:42
1007,GenAI for SW developers - V.2! 2# Dr. GPT: Grounding LLMs in Healthcare ,https://youtu.be/Tjx_kd5db34,Microsoft Reactor,1700,21:12
1008,OpenAGI - Autonomous Human Like Agents ,https://youtu.be/HE4ykZATuIw,Fahd Mirza,1000,21:12
1009,HippoRAG - Neurobiologically Inspired Memory for LLMs ,https://youtu.be/iheqPgJmX6M,Fahd Mirza,3100,8:20
1010,Amazon SageMaker overview | Amazon Web Services ,https://youtu.be/R-o_a6dvzQM,Amazon Web Services,89 ,8:20
1011,Verbalized Machine Learning: Revisiting Machine Learning with Language Models ,https://youtu.be/OAQfMoK6AV0,Arxiv Papers,341 ,18:23
1012,VectorDB Recipes: Stay up-to-date with GenAI in one place | I'm Accepting contributions on this repo ,https://youtu.be/Fy2V6ZmXK0s,Ayush Chaurasia,37 ,18:23
1013,The Brain's Bitter Lesson: Scaling Speech Decoding With Self-Supervised Learning ,https://youtu.be/Sr1NIeSIiNw,Arxiv Papers,15000,24:59
1014,RAG in 2024: Advancing to Agents ,https://youtu.be/PYvAfKNGVlg,LlamaIndex,133 ,24:59
1015,Interpretable AI in Medicine | Multimodal Foundation Models in Oncology | Mauricio Reyes ,https://youtu.be/b23mQEHVf5U,Applied Machine Learning Days,61 ,25:51
1016,Climbing the Quality Hill | Multimodal Foundation Models in Oncology | Fabian Roth ,https://youtu.be/IhawEdplzkI,Applied Machine Learning Days,70 ,25:51
1017,Training Large-Scale Medical FMs | Multimodal Foundation Models in Oncology | E. De Jong &amp; V. Botha ,https://youtu.be/GSrPRxSwcvg,Applied Machine Learning Days,17000,8:26
1018,LLM - Reasoning SOLVED (new research) ,https://youtu.be/gCGck5Fn3G4,Discover AI,57 ,8:26
1019,How Truncating Weights Improves Reasoning in Language Models ,https://youtu.be/us7nTT5hC6U,Arxiv Papers,67 ,59:05
1020,Choice of PEFT Technique in Continual Learning: Prompt Tuning is Not All You Need ,https://youtu.be/8tS_84-5Hmo,Arxiv Papers,80 ,59:05
1021,Learning to grok: Emergence of in-context learning and skill in modular arithmetic tasks ,https://youtu.be/GFxQb8lKQS4,Arxiv Papers,289 ,18:44
1022,To Believe or Not to Believe Your LLM ,https://youtu.be/rPQIYLvPszY,Arxiv Papers,1700,18:44
1023,MLSys'24 Best Paper - AWQ: Activation-aware Weight Quantization for LLM Compression and Acceleration ,https://youtu.be/6YtdtjQD1r0,MIT HAN Lab,59 ,2:15:23
1024,Does your data spark joy? Performance gains from domain upsampling at the end of training ,https://youtu.be/A20wzlC7Q-c,Arxiv Papers,3100,2:15:23
1025,Bye Bye Privacy!!! ,https://youtu.be/cpLi-82koFM,1littlecoder,4800,1:06:41
1026,How to MAKE AI Agents MORE SUCCESSFUL!!! ,https://youtu.be/j2OAeeujQ9M,1littlecoder,15000,1:06:41
1027,New Discovery: LLMs have a Performance Phase ,https://youtu.be/EjiYnHkmn1I,Discover AI,62 ,3:44
1028,Production-Ready Strategies For Achieving Precision With Midjourney ,https://youtu.be/V58mPkLB95o,AI User Group,98 ,3:44
1029,Show- Don't Tell: Aligning Language Models with Demonstrated Feedback ,https://youtu.be/VHCDtkjocl8,Arxiv Papers,2700,11:40
1030,AI Agents with LangChain- CrewAI and Llama 3: Build an AI Tweet Writing App | Step-,https://youtu.be/rJn-Ti03AjA,Venelin Valkov,1800,11:40
1031,Enhancing search on AWS with AI- RAG- and vector databases (L300) | AWS Events ,https://youtu.be/o8_LApdDvYE,AWS Events,380 ,18:16
1032,How Sonrai Analytics leverages ML to accelerate Precision Medicine (L300) | AWS Events ,https://youtu.be/mzkHGEyAPEw,AWS Events,651 ,18:16
1033,Has prompt engineering been solved? ,https://youtu.be/dU6eiWjJfSw,Elvis Saravia,395 ,8:26
1034,AWS Trainium and Inferentia // Kamran Khan and Matthew McClean // MLOps Podcast #238 ,https://youtu.be/2Z9rbnhF8yQ,MLOps.community,215 ,8:26
1035,MMLU-Pro : A New LLM Benchmark ,https://youtu.be/OyrXZdAOM54,Fahd Mirza,2100,11:04
1036,LLAMA 3 or Phi 3 AI Agent: Can they Beat Perplexity in Web Search? ,https://youtu.be/MXPYbjjyHXc,Data Centric,87 ,11:04
1037,How to handle Class Imbalance in ML problems? ,https://youtu.be/zwrRQEGM76o,Data Science in your pocket,1300,15:32
1038,CoPE - Contextual Position Encoding: Learning to Count What's Important ,https://youtu.be/bKIGLgblRwg,Gabriel Mongaras,76 ,15:32
1039,What makes unlearning hard and what to do about it ,https://youtu.be/4lx4As_e_l0,Arxiv Papers,964 ,19:35
1040,Deep Dive into Large Language Models : From RNN to RLHF ,https://youtu.be/Z1bXBinTtnQ,Aritra Sen,18000,19:35
1041,Basics And Foundation Is Important For Any Data Science or GENAI Roles-Start From Basics ,https://youtu.be/ielZJwDfZL4,Krish Naik,135 ,16:15
1042,Graph Neural Networks | Scientific Machine Learning for Science and Engineering | Vinay Sharma ,https://youtu.be/CqsDFb3ScOc,Applied Machine Learning Days,460 ,16:15
1043,Python Regular Expressions Explained in 1 Hour ,https://youtu.be/fv8sgcn3VxM,Ryan &amp; Matt Data Science,2500,9:28
1044,Best Practices for GenAI applications on AWS - RAG pipeline Eval - Part 3 | Amazon Web Services ,https://youtu.be/JlRhytfQlUg,Amazon Web Services,196 ,9:28
1045,How To Implement SetFit For Few-Shot Fine-Tuning of Sentence Transformers ,https://youtu.be/dcINVsqxQgQ,Fahd Mirza,841 ,28:26
1046,The Communication Platform of the Future ,https://youtu.be/DsAN_a01ptU,Tunadorable,108 ,28:26
1047,Perplexed ,https://youtu.be/he-fOrSkKek,Arxiv Papers,2800,43:25
1048,Informer attention Architecture - FROM SCRATCH! ,https://youtu.be/5qetCIOBKAI,CodeEmporium,5700,43:25
1049,NVIDIA NIM: Easily Deploy and Integrate Generative AI Models In App ,https://youtu.be/QgOeWbW0jeA,Mervin Praison,48 ,12:37
1050,A Few How-To Gems for Building a Thriving Community from Scratch ,https://youtu.be/KxiKlb5_Hmc,Super Data Science: ML &amp; AI Podcast with Jon Krohn,835 ,12:37
1051,50x Pandas Speed up with Nvidia GPU!!! ,https://youtu.be/cNKyjpn5tp4,1littlecoder,1800,16:55
1052,Preparing Fineweb - A Finely Cleaned Common Crawl Dataset ,https://youtu.be/fzqSP3vTZ4E,Trelis Research,2300,16:55
1053,LangGraph vs. LangChain LCEL - Can we get rid of LCEL (LangChain Expression Language) ,https://youtu.be/fzqSP3vTZ4E,Coding Crash Courses,602 ,5:40
1054,Create Complete RAG Pipeline Locally and Free with FastRAG and HayStack ,https://youtu.be/bjzh9UE9CVs,Fahd Mirza,233 ,5:40
1055,New State-of-the-art Accuracy for the 3 Primary Uses of Healthcare Language Models ,https://youtu.be/_xghhjS8JOk,John Snow Labs,448 ,9:47
1056,What is Sentence Transformer - Easiest Explanation with Demo ,https://youtu.be/E5cSYQS2QNU,Fahd Mirza,110 ,9:47
1057,MLOps Moves Fast. How Can Keep Up? ,https://youtu.be/UwcWPslAxmE,Super Data Science: ML &amp; AI Podcast with Jon Krohn,6900,14:49
1058,*Don't* miss these LLMs Concepts!! ,https://youtu.be/xP-TPVr7eAo,1littlecoder,16000,14:49
